քյամանչա	kʰ j ɑ m ɑ n t͡ʃʰ ɑ
քնամուկ	kʰ ə n ɑ m u k
քնար	kʰ ə n ɑ ɾ
քննադատաբար	kʰ ə nː ɑ d ɑ t ɑ b ɑ ɾ
քուչա	kʰ u t͡ʃʰ ɑ
քուրձ	kʰ u ɾ d͡z
քուրմ	kʰ u ɾ m
քրմուհի	kʰ ə ɾ m u h i
քրքրել	kʰ ə ɾ kʰ ə ɾ ɛ l
օբ	ɔ b
օդեսա	ɔ d ɛ s ɑ
օղ	ɔ ʁ
օղակ	ɔ ʁ ɑ k
օմսկ	ɔ m s k
օսեթ	ɔ s ɛ tʰ
օսմանական	ɔ s m ɑ n ɑ k ɑ n
օր	ɔ ɾ
օրագիր	ɔ ɾ ɑ ɡ i ɾ
օրան	ɔ ɾ ɑ n
օրդուբադ	ɔ ɾ d u b ɑ d
օրոք	ɔ ɾ ɔ kʰ
օֆիս	ɔ f i s
ֆագոտ	f ɑ ɡ ɔ t
ֆաշիստ	f ɑ ʃ i s t
ֆերմա	f ɛ ɾ m ɑ
ֆինանսներ	f i n ɑ n s n ɛ ɾ
ֆիննական	f i nː ɑ k ɑ n
ֆլամանդացի	f l ɑ m ɑ n d ɑ t͡sʰ i
ֆլամինգո	f l ɑ m i ŋ ɡ ɔ
ֆրիզ	f ə ɾ i z
