демократично	d ɪ m ɔ k r ɛ t ɪ t͡ʃ n ɔ
самобутній	s ɛ m ɔ b u tʲ nʲ i i
сатана	s ɛ t ɛ n ɑ
афганський	ɛ f ɦ ɑ nʲ sʲ k ɪ i
літ	lʲ i t
автобусна	ɛ u t ɔ b u s n ɛ
щокою	ʃ t͡ʃ ɔ k ɔ j u
оленина	ɔ ɫ ɪ n ɪ n ɛ
космодром	k ɔ s m ɔ d r ɔ m
поступку	p ɔ s t u p k u
ознайомлення	ɔ z n ɛ j ɔ m ɫ ɪ nʲ ɛ
другий	d r u ɦ ɪ i
свіча	sʲ ʋ i t͡ʃ ɛ
капітал	k ɛ p i t ɑ ɫ
ім'я	i m j ɛ
насолодитися	n ɛ s ɔ ɫ ɔ d ɪ t ɪ sʲ ɛ
чорт	t͡ʃ ɔ r t
каплиці	k ɛ p ɫ ɪ t͡sʲ i
перевиховати	p ɪ r ɪ ʋ ɪ x ɔ ʋ ɛ t ɪ
свояк	s ʋ ɔ j ɑ k
незалежности	n ɪ z ɛ ɫ ɛ ʒ n ɔ s t ɪ
досягнення	d ɔ sʲ ɑ ɦ n ɪ nʲ ɛ
ідеальний	i d ɪ ɑ lʲ n ɪ i
завдяки	z ɛ u dʲ ɛ k ɪ
тунелях	t u n ɛ lʲ ɛ x
обговорювати	ɔ b ɦ ɔ ʋ ɔ rʲ u ʋ ɛ t ɪ
лакрос	ɫ ɛ k r ɔ s
занотувати	z ɛ n ɔ t u ʋ ɑ t ɪ
епохи	ɪ p ɔ x ɪ
неприйнятний	n ɪ p r ɪ i nʲ ɛ t n ɪ i
причинний	p r ɪ t͡ʃ ɪ n ɪ i
щотижневий	ʃ t͡ʃ ɔ t ɪ ʒ n ɛ ʋ ɪ i
капітулювати	k ɛ p i t u lʲ u ʋ ɑ t ɪ
протитанковий	p r ɔ t ɪ t ɑ n k ɔ ʋ ɪ i
трактор	t r ɑ k t ɔ r
конфлікт	k ɔ n f lʲ i k t
лебединий	ɫ ɪ b ɪ d ɪ n ɪ i
пшениця	p ʃ ɪ n ɪ t͡sʲ ɛ
краб	k r ɑ b
недоступний	n ɪ d ɔ s t u p n ɪ i
роззброювати	r ɔ z b r ɔ j u ʋ ɛ t ɪ
клавіатур	k ɫ ɛ ʋ i ɛ t u r
тротуари	t r ɔ t u ɑ r ɪ
ізраїльтянин	i z r ɛ j i lʲ tʲ ɑ n ɪ n
чудовисько	t͡ʃ u d ɔ ʋ ɪ sʲ k ɔ
уста	u s t ɑ
розпочати	r ɔ z p ɔ t͡ʃ ɑ t ɪ
динаміка	d ɪ n ɑ m i k ɛ
госпіталізація	ɦ ɔ sʲ p i t ɛ lʲ i z ɑ t͡sʲ i j ɛ
африканець	ɛ f r ɪ k ɑ n ɪ t͡sʲ
повість	p ɔ ʋ i sʲ tʲ
гірський	ɦ i r sʲ k ɪ i
остаточний	ɔ s t ɛ t ɔ t͡ʃ n ɪ i
погнати	p ɔ ɦ n ɑ t ɪ
сірий	sʲ i r ɪ i
покарань	p ɔ k ɛ r ɑ nʲ
поширити	p ɔ ʃ ɪ r ɪ t ɪ
плівка	p lʲ i u k ɛ
поліціях	p ɔ lʲ i t͡sʲ i j ɛ x
потворний	p ɔ t ʋ ɔ r n ɪ i
мотоцикл	m ɔ t ɔ t͡s ɪ k ɫ
поступки	p ɔ s t u p k ɪ
позбавляти	p ɔ z b ɛ u lʲ ɑ t ɪ
виснажувати	ʋ ɪ s n ɑ ʒ u ʋ ɛ t ɪ
смертоносний	s m ɪ r t ɔ n ɔ s n ɪ i
глава	ɦ ɫ ɛ ʋ ɑ
розділ	r ɔ zʲ dʲ i ɫ
поздоровляти	p ɔ z d ɔ r ɔ u lʲ ɑ t ɪ
дорога	d ɔ r ɔ ɦ ɛ
аналізувати	ɛ n ɛ lʲ i z u ʋ ɑ t ɪ
ілюзія	i lʲ u zʲ i j ɛ
персональний	p ɪ r s ɔ n ɑ lʲ n ɪ i
коронавірус	k ɔ r ɔ n ɛ ʋ i r u s
заспокійливий	z ɛ s p ɔ k i i ɫ ɪ ʋ ɪ i
дев'яностий	d ɪ ʋ j ɛ n ɔ s t ɪ i
вступати	ʋ s t u p ɑ t ɪ
вибирати	ʋ ɪ b ɪ r ɑ t ɪ
заручати	z ɛ r u t͡ʃ ɑ t ɪ
помирати	p ɔ m ɪ r ɑ t ɪ
промовляти	p r ɔ m ɔ u lʲ ɑ t ɪ
мікроскоп	m i k r ɔ s k ɔ p
співробітник	sʲ p i u r ɔ b i t n ɪ k
номінальний	n ɔ m i n ɑ lʲ n ɪ i
прибічниця	p r ɪ b i t͡ʃ n ɪ t͡sʲ ɛ
день	d ɛ nʲ
з'ясувати	z j ɛ s u ʋ ɑ t ɪ
віртуальний	ʋ i r t u ɑ lʲ n ɪ i
пересічний	p ɪ r ɪ sʲ i t͡ʃ n ɪ i
співіснування	sʲ p i ʋ i s n u ʋ ɑ nʲ ɛ
мелодіям	m ɪ ɫ ɔ dʲ i j ɛ m
відокремити	ʋ i d ɔ k r ɛ m ɪ t ɪ
процедурний	p r ɔ t͡s ɪ d u r n ɪ i
алло	ɛ ɫ ɔ
гіпотеза	ɦ i p ɔ t ɪ z ɛ
розв'язувати	r ɔ z ʋ j ɑ z u ʋ ɛ t ɪ
ті	tʲ i
антидот	ɛ n t ɪ d ɔ t
мовознавець	m ɔ ʋ ɔ z n ɑ ʋ ɪ t͡sʲ
забобон	z ɛ b ɔ b ɔ n
оренда	ɔ r ɛ n d ɛ
етап	ɪ t ɑ p
повіки	p ɔ ʋ i k ɪ
австромарксист	ɛ u s t r ɔ m ɛ r k s ɪ s t
етика	ɛ t ɪ k ɛ
болгарин	b ɔ ɫ ɦ ɑ r ɪ n
постать	p ɔ s t ɛ tʲ
мільйон	m i lʲ j ɔ n
щі	ʃ t͡ʃʲ i
лавандовий	ɫ ɛ ʋ ɑ n d ɔ ʋ ɪ i
шведський	ʃ ʋ ɛ d͡zʲ sʲ k ɪ i
оцими	ɔ t͡s ɪ m ɪ
вчитель	ʋ t͡ʃ ɪ t ɪ lʲ
безжурний	b ɪ ʒ u r n ɪ i
хотітися	x ɔ tʲ i t ɪ sʲ ɛ
слина	s ɫ ɪ n ɛ
варіантами	ʋ ɛ rʲ i ɑ n t ɛ m ɪ
відчути	ʋ i d͡ʒ t͡ʃ u t ɪ
перлина	p ɪ r ɫ ɪ n ɛ
релігійний	r ɪ lʲ i ɦ i i n ɪ i
стать	s t ɑ tʲ
стримати	s t r ɪ m ɛ t ɪ
випроменити	ʋ ɪ p r ɔ m ɪ n ɪ t ɪ
нагромаджувати	n ɛ ɦ r ɔ m ɑ d͡ʒ u ʋ ɛ t ɪ
корінь	k ɔ rʲ i nʲ
класовий	k ɫ ɑ s ɔ ʋ ɪ i
ворота	ʋ ɔ r ɔ t ɛ
й	j
дивний	d ɪ u n ɪ i
відпочивати	ʋ i d p ɔ t͡ʃ ɪ ʋ ɑ t ɪ
жодний	ʒ ɔ d n ɪ i
змова	z m ɔ ʋ ɛ
відданий	ʋ i d ɛ n ɪ i
теплота	t ɪ p ɫ ɔ t ɑ
хрест	x r ɛ s t
овід	ɔ ʋ i d
козел	k ɔ z ɛ ɫ
борщ	b ɔ r ʃ t͡ʃ
роділля	r ɔ dʲ i lʲ ɛ
періодизаціям	p ɪ rʲ i ɔ d ɪ z ɑ t͡sʲ i j ɛ m
органічна	ɔ r ɦ ɛ nʲ i t͡ʃ n ɛ
вирізнятися	ʋ ɪ rʲ i zʲ nʲ ɑ t ɪ sʲ ɛ
дріжджі	dʲ rʲ i ʒ d͡ʒ i
крикливий	k r ɪ k ɫ ɪ ʋ ɪ i
вимикати	ʋ ɪ m ɪ k ɑ t ɪ
уособити	u ɔ s ɔ b ɪ t ɪ
видатний	ʋ ɪ d ɛ t n ɪ i
інтенсивність	i n t ɪ n s ɪ u nʲ i sʲ tʲ
тощо	t ɔ ʃ t͡ʃ ɔ
повсюдний	p ɔ u sʲ u d n ɪ i
перезаписати	p ɪ r ɪ z ɛ p ɪ s ɑ t ɪ
феє	f ɛ j ɪ
менше	m ɛ n ʃ ɪ
чарівник	t͡ʃ ɛ rʲ i u n ɪ k
зимовий	z ɪ m ɔ ʋ ɪ i
ламати	ɫ ɛ m ɑ t ɪ
зара	z ɑ r ɛ
науковий	n ɛ u k ɔ ʋ ɪ i
авіапідживлення	ɛ ʋ i ɛ p i d͡ʒ ɪ u ɫ ɪ nʲ ɛ
принизити	p r ɪ n ɪ z ɪ t ɪ
брест	b r ɛ s t
японіє	j ɛ p ɔ nʲ i j ɪ
диктатор	d ɪ k t ɑ t ɔ r
шестигранник	ʃ ɪ s t ɪ ɦ r ɑ n ɪ k
авіапасажир	ɛ ʋ i ɛ p ɛ s ɛ ʒ ɪ r
бельгійський	b ɪ lʲ ɦ i i sʲ k ɪ i
легеня	ɫ ɪ ɦ ɛ nʲ ɛ
сюди	sʲ u d ɪ
охопити	ɔ x ɔ p ɪ t ɪ
шинок	ʃ ɪ n ɔ k
трагічний	t r ɛ ɦ i t͡ʃ n ɪ i
вкус	ʋ k u s
брехнями	b r ɛ x nʲ ɛ m ɪ
високосний	ʋ ɪ s ɔ k ɔ s n ɪ i
блокадою	b ɫ ɔ k ɑ d ɔ j u
трав'яний	t r ɛ ʋ j ɛ n ɪ i
заявити	z ɛ j ɛ ʋ ɪ t ɪ
біржа	b i r ʒ ɛ
пінистий	p i n ɪ s t ɪ i
щоку	ʃ t͡ʃ ɔ k u
відважний	ʋ i d ʋ ɑ ʒ n ɪ i
бойко	b ɔ i k ɔ
технократичний	t ɪ x n ɔ k r ɛ t ɪ t͡ʃ n ɪ i
михайло	m ɪ x ɑ i ɫ ɔ
упасти	u p ɑ s t ɪ
таємницями	t ɛ j ɪ m n ɪ t͡sʲ ɛ m ɪ
компактний	k ɔ m p ɑ k t n ɪ i
епідеміологія	ɪ p i d ɪ m i ɔ ɫ ɔ ɦ i j ɛ
страх	s t r ɑ x
речі	r ɛ t͡ʃʲ i
споживчий	s p ɔ ʒ ɪ u t͡ʃ ɪ i
скаржитися	s k ɑ r ʒ ɪ t ɪ sʲ ɛ
біологія	b i ɔ ɫ ɔ ɦ i j ɛ
коханий	k ɔ x ɛ n ɪ i
водосховище	ʋ ɔ d ɔ s x ɔ ʋ ɪ ʃ t͡ʃ ɪ
атеїстичний	ɛ t ɪ j i s t ɪ t͡ʃ n ɪ i
звідкись	zʲ ʋ i d k ɪ sʲ
липа	ɫ ɪ p ɛ
стіна	sʲ tʲ i n ɑ
класти	k ɫ ɑ s t ɪ
мислити	m ɪ s ɫ ɪ t ɪ
аброгація	ɛ b r ɔ ɦ ɑ t͡sʲ i j ɛ
джгут	d͡ʒ ɦ u t
глек	ɦ ɫ ɛ k
досьє	d ɔ sʲ j ɛ
вулиця	ʋ u ɫ ɪ t͡sʲ ɛ
еволюціонувати	ɪ ʋ ɔ lʲ u t͡sʲ i ɔ n u ʋ ɑ t ɪ
цнотливий	t͡s n ɔ t ɫ ɪ ʋ ɪ i
організаціє	ɔ r ɦ ɛ nʲ i z ɑ t͡sʲ i j ɪ
добувати	d ɔ b u ʋ ɑ t ɪ
перемир'я	p ɪ r ɪ m ɪ r j ɛ
сплачувати	s p ɫ ɑ t͡ʃ u ʋ ɛ t ɪ
ресторан	r ɪ s t ɔ r ɑ n
мріями	m rʲ i j ɛ m ɪ
паузу	p ɑ u z u
емігрувати	ɪ m i ɦ r u ʋ ɑ t ɪ
наймати	n ɛ i m ɑ t ɪ
почати	p ɔ t͡ʃ ɑ t ɪ
мікрофон	m i k r ɔ f ɔ n
границя	ɦ r ɛ n ɪ t͡sʲ ɛ
бидло	b ɪ d ɫ ɔ
піраміда	p i r ɛ m i d ɛ
бере	b ɪ r ɛ
херсон	x ɪ r s ɔ n
легітимація	ɫ ɪ ɦ i t ɪ m ɑ t͡sʲ i j ɛ
рукою	r u k ɔ j u
благий	b ɫ ɛ ɦ ɪ i
позаземний	p ɔ z ɛ z ɛ m n ɪ i
бувати	b u ʋ ɑ t ɪ
рослина	r ɔ s ɫ ɪ n ɛ
дитсадків	d ɪ t͡s ɛ dʲ k i u
революція	r ɪ ʋ ɔ lʲ u t͡sʲ i j ɛ
фірма	f i r m ɛ
рейтузи	r ɪ i t u z ɪ
легеневий	ɫ ɪ ɦ ɪ n ɛ ʋ ɪ i
каштан	k ɛ ʃ t ɑ n
підвищувати	p i d ʋ ɪ ʃ t͡ʃ u ʋ ɛ t ɪ
спланувати	s p ɫ ɛ n u ʋ ɑ t ɪ
мовити	m ɔ ʋ ɪ t ɪ
турнір	t u r nʲ i r
песимістичний	p ɪ s ɪ m i s t ɪ t͡ʃ n ɪ i
церковний	t͡s ɪ r k ɔ u n ɪ i
шаповал	ʃ ɛ p ɔ ʋ ɑ ɫ
підхожий	p i d x ɔ ʒ ɪ i
переорієнтувати	p ɪ r ɪ ɔ rʲ i j ɪ n t u ʋ ɑ t ɪ
відсвяткувати	ʋ i d͡z sʲ ʋ ɛ t k u ʋ ɑ t ɪ
тригліцерид	t r ɪ ɦ lʲ i t͡s ɪ r ɪ d
безперебійний	b ɪ z p ɪ r ɪ b i i n ɪ i
пісня	p i sʲ nʲ ɛ
портфелях	p ɔ r t f ɛ lʲ ɛ x
велосипед	ʋ ɪ ɫ ɔ s ɪ p ɛ d
кончина	k ɔ n t͡ʃ ɪ n ɛ
міфологія	m i f ɔ ɫ ɔ ɦ i j ɛ
домашнє	d ɔ m ɑ ʃ nʲ ɪ
роман	r ɔ m ɑ n
патріотизмі	p ɛ tʲ rʲ i ɔ t ɪ zʲ m i
авіатраса	ɛ ʋ i ɛ t r ɑ s ɛ
порівняння	p ɔ rʲ i u nʲ ɑ nʲ ɛ
стабільний	s t ɛ b i lʲ n ɪ i
прибічник	p r ɪ b i t͡ʃ n ɪ k
відвага	ʋ i d ʋ ɑ ɦ ɛ
згодний	z ɦ ɔ d n ɪ i
герцогиня	ɦ ɪ r t͡s ɔ ɦ ɪ nʲ ɛ
акул	ɛ k u ɫ
гони	ɦ ɔ n ɪ
риба	r ɪ b ɛ
відрізнятися	ʋ i dʲ rʲ i zʲ nʲ ɑ t ɪ sʲ ɛ
навігаційний	n ɛ ʋ i ɦ ɛ t͡sʲ i i n ɪ i
рушниця	r u ʃ n ɪ t͡sʲ ɛ
афганістан	ɛ f ɦ ɛ nʲ i s t ɑ n
освіжити	ɔ sʲ ʋ i ʒ ɪ t ɪ
перевага	p ɪ r ɪ ʋ ɑ ɦ ɛ
арістотель	ɛ rʲ i s t ɔ t ɪ lʲ
квадратний	k ʋ ɛ d r ɑ t n ɪ i
вибиратися	ʋ ɪ b ɪ r ɑ t ɪ sʲ ɛ
змагатися	z m ɛ ɦ ɑ t ɪ sʲ ɛ
абсолютно	ɛ b s ɔ lʲ u t n ɔ
довоєнний	d ɔ ʋ ɔ j ɛ n ɪ i
різноманітний	rʲ i z n ɔ m ɛ nʲ i t n ɪ i
злочинець	z ɫ ɔ t͡ʃ ɪ n ɪ t͡sʲ
веретено	ʋ ɪ r ɪ t ɛ n ɔ
постійно	p ɔ sʲ tʲ i i n ɔ
брухт	b r u x t
звернення	z ʋ ɛ r n ɪ nʲ ɛ
мева	m ɛ ʋ ɛ
внаслідок	ʋ n ɑ sʲ lʲ i d ɔ k
другові	d r u ɦ ɔ ʋ i
феях	f ɛ j ɛ x
чверті	t͡ʃ ʋ ɛ r tʲ i
кишенькові	k ɪ ʃ ɪ nʲ k ɔ ʋ i
дивізіях	d ɪ ʋ i zʲ i j ɛ x
цікавий	t͡sʲ i k ɑ ʋ ɪ i
критеріям	k r ɪ t ɛ rʲ i j ɛ m
аероскопія	ɛ ɪ r ɔ s k ɔ p i j ɛ
завершення	z ɛ ʋ ɛ r ʃ ɪ nʲ ɛ
вільнодумець	ʋ i lʲ n ɔ d u m ɪ t͡sʲ
скловидний	s k ɫ ɔ ʋ ɪ d n ɪ i
довічний	d ɔ ʋ i t͡ʃ n ɪ i
нирка	n ɪ r k ɛ
ковзкий	k ɔ u z k ɪ i
доброчесний	d ɔ b r ɔ t͡ʃ ɛ s n ɪ i
обстежувати	ɔ b s t ɛ ʒ u ʋ ɛ t ɪ
танцювати	t ɛ nʲ t͡sʲ u ʋ ɑ t ɪ
опитати	ɔ p ɪ t ɑ t ɪ
ради	r ɑ d ɪ
слимак	s ɫ ɪ m ɑ k
зелен	z ɛ ɫ ɪ n
епох	ɪ p ɔ x
румунський	r u m u nʲ sʲ k ɪ i
грізний	ɦ rʲ i z n ɪ i
ситуаціях	s ɪ t u ɑ t͡sʲ i j ɛ x
безжальний	b ɪ ʒ ɑ lʲ n ɪ i
така	t ɛ k ɑ
драматургічний	d r ɛ m ɛ t u r ɦ i t͡ʃ n ɪ i
автовласник	ɛ u t ɔ u ɫ ɑ s n ɪ k
українськими	u k r ɛ j i nʲ sʲ k ɪ m ɪ
город	ɦ ɔ r ɔ d
унікальний	u nʲ i k ɑ lʲ n ɪ i
споживання	s p ɔ ʒ ɪ ʋ ɑ nʲ ɛ
посуд	p ɔ s u d
нас	n ɑ s
діафрагмами	dʲ i ɛ f r ɑ ɦ m ɛ m ɪ
критикувати	k r ɪ t ɪ k u ʋ ɑ t ɪ
болниця	b ɔ ɫ n ɪ t͡sʲ ɛ
привітати	p r ɪ ʋ i t ɑ t ɪ
ворожнеча	ʋ ɔ r ɔ ʒ n ɛ t͡ʃ ɛ
недооцінювати	n ɪ d ɔ ɔ t͡sʲ i nʲ u ʋ ɛ t ɪ
стілець	sʲ tʲ i ɫ ɛ t͡sʲ
туризм	t u r ɪ z m
албанія	ɛ ɫ b ɑ nʲ i j ɛ
глід	ɦ lʲ i d
медитація	m ɪ d ɪ t ɑ t͡sʲ i j ɛ
діафрагмі	dʲ i ɛ f r ɑ ɦ m i
засновник	z ɛ s n ɔ u n ɪ k
скло	s k ɫ ɔ
дошках	d ɔ ʃ k ɛ x
кільце	k i lʲ t͡s ɛ
ізумрудний	i z u m r u d n ɪ i
келих	k ɛ ɫ ɪ x
антибіотики	ɛ n t ɪ b i ɔ t ɪ k ɪ
сукня	s u k nʲ ɛ
кишенях	k ɪ ʃ ɛ nʲ ɛ x
радість	r ɑ dʲ i sʲ tʲ
портфеля	p ɔ r t f ɛ lʲ ɛ
можна	m ɔ ʒ n ɛ
різноманіття	rʲ i z n ɔ m ɛ nʲ i tʲ ɛ
амбіція	ɛ m b i t͡sʲ i j ɛ
родзинка	r ɔ d͡z ɪ n k ɛ
ненароджений	n ɪ n ɛ r ɔ d͡ʒ ɪ n ɪ i
щоко	ʃ t͡ʃ ɔ k ɔ
карась	k ɛ r ɑ sʲ
суспільство	s u sʲ p i lʲ s t ʋ ɔ
прати	p r ɑ t ɪ
серцевий	s ɪ r t͡s ɛ ʋ ɪ i
щавель	ʃ t͡ʃ ɛ ʋ ɛ lʲ
термометричний	t ɪ r m ɔ m ɪ t r ɪ t͡ʃ n ɪ i
для	dʲ lʲ ɑ
шовковий	ʃ ɔ u k ɔ ʋ ɪ i
склянка	s k lʲ ɑ n k ɛ
волейболістка	ʋ ɔ ɫ ɪ i b ɔ lʲ i s t k ɛ
зима	z ɪ m ɑ
змі	zʲ m i
помста	p ɔ m s t ɛ
кара	k ɑ r ɛ
пархоменко	p ɛ r x ɔ m ɪ n k ɔ
енергій	ɪ n ɛ r ɦ i i
терпеливість	t ɪ r p ɪ ɫ ɪ ʋ i sʲ tʲ
здогадуватися	z d ɔ ɦ ɑ d u ʋ ɛ t ɪ sʲ ɛ
яловичину	j ɑ ɫ ɔ ʋ ɪ t͡ʃ ɪ n u
динамічно	d ɪ n ɛ m i t͡ʃ n ɔ
ягода	j ɑ ɦ ɔ d ɛ
дієвий	dʲ i j ɛ ʋ ɪ i
вижлоктати	ʋ ɪ ʒ ɫ ɔ k t ɛ t ɪ
трагедія	t r ɛ ɦ ɛ dʲ i j ɛ
підприємство	p i d p r ɪ j ɛ m s t ʋ ɔ
теща	t ɛ ʃ t͡ʃ ɛ
дебютувати	d ɪ b u t u ʋ ɑ t ɪ
відчиняти	ʋ i d͡ʒ t͡ʃ ɪ nʲ ɑ t ɪ
упевненість	u p ɛ u n ɪ nʲ i sʲ tʲ
наявний	n ɛ j ɑ u n ɪ i
комора	k ɔ m ɔ r ɛ
подібність	p ɔ dʲ i b nʲ i sʲ tʲ
суб'єкт	s u b j ɛ k t
звідси	zʲ ʋ i d͡z s ɪ
неврологія	n ɪ u r ɔ ɫ ɔ ɦ i j ɛ
долонях	d ɔ ɫ ɔ nʲ ɛ x
мексиканка	m ɪ k s ɪ k ɑ n k ɛ
побачення	p ɔ b ɑ t͡ʃ ɪ nʲ ɛ
маскат	m ɛ s k ɑ t
обідати	ɔ b i d ɛ t ɪ
цегла	t͡s ɛ ɦ ɫ ɛ
трансформаціях	t r ɛ n s f ɔ r m ɑ t͡sʲ i j ɛ x
двадцятиоднокутник	d ʋ ɛ d͡zʲ t͡sʲ ɛ t ɪ ɔ d n ɔ k u t n ɪ k
підняти	p i dʲ nʲ ɑ t ɪ
постатях	p ɔ s t ɛ tʲ ɛ x
білий	b i ɫ ɪ i
підвіконня	p i dʲ ʋ i k ɔ nʲ ɛ
візовий	ʋ i z ɔ ʋ ɪ i
антагонізм	ɛ n t ɛ ɦ ɔ nʲ i z m
синтезувати	s ɪ n t ɪ z u ʋ ɑ t ɪ
зоровий	z ɔ r ɔ ʋ ɪ i
сприйняття	s p r ɪ i nʲ ɛ tʲ ɑ
концепт	k ɔ n t͡s ɛ p t
шанувальник	ʃ ɛ n u ʋ ɑ lʲ n ɪ k
положення	p ɔ ɫ ɔ ʒ ɪ nʲ ɛ
забороняти	z ɛ b ɔ r ɔ nʲ ɑ t ɪ
помідор	p ɔ m i d ɔ r
аборт	ɛ b ɔ r t
обчислювати	ɔ b t͡ʃ ɪ sʲ lʲ u ʋ ɛ t ɪ
галстук	ɦ ɑ ɫ s t u k
друг	d r u ɦ
скоро	s k ɔ r ɔ
акцентувати	ɛ k t͡s ɪ n t u ʋ ɑ t ɪ
частка	t͡ʃ ɑ s t k ɛ
скроні	s k r ɔ nʲ i
комедія	k ɔ m ɛ dʲ i j ɛ
позиція	p ɔ z ɪ t͡sʲ i j ɛ
міф	m i f
ліцензія	lʲ i t͡s ɛ nʲ zʲ i j ɛ
команда	k ɔ m ɑ n d ɛ
арка	ɑ r k ɛ
аероліт	ɛ ɪ r ɔ lʲ i t
приймати	p r ɪ i m ɑ t ɪ
добривечір	d ɔ b r ɪ ʋ ɛ t͡ʃʲ i r
схематизувати	s x ɪ m ɛ t ɪ z u ʋ ɑ t ɪ
колись	k ɔ ɫ ɪ sʲ
жасмин	ʒ ɛ s m ɪ n
авіаметеослужба	ɛ ʋ i ɛ m ɪ t ɪ ɔ s ɫ u ʒ b ɛ
категоричний	k ɛ t ɪ ɦ ɔ r ɪ t͡ʃ n ɪ i
гуцульщина	ɦ u t͡s u lʲ ʃ t͡ʃ ɪ n ɛ
масть	m ɑ sʲ tʲ
портативний	p ɔ r t ɛ t ɪ u n ɪ i
репресивний	r ɪ p r ɪ s ɪ u n ɪ i
просьба	p r ɔ zʲ b ɛ
убогий	u b ɔ ɦ ɪ i
безпілотний	b ɪ zʲ p i ɫ ɔ t n ɪ i
лисиця	ɫ ɪ s ɪ t͡sʲ ɛ
гладіатор	ɦ ɫ ɛ dʲ i ɑ t ɔ r
гуманістка	ɦ u m ɛ nʲ i s t k ɛ
пласт	p ɫ ɑ s t
єврейський	j ɪ u r ɛ i sʲ k ɪ i
волокти	ʋ ɔ ɫ ɔ k t ɪ
нідерланди	nʲ i d ɪ r ɫ ɑ n d ɪ
органи	ɔ r ɦ ɛ n ɪ
щитоподібна	ʃ t͡ʃ ɪ t ɔ p ɔ dʲ i b n ɛ
руку	r u k u
тісний	tʲ i s n ɪ i
журнал	ʒ u r n ɑ ɫ
ліс	lʲ i s
наблизити	n ɛ b ɫ ɪ z ɪ t ɪ
квантова	k ʋ ɑ n t ɔ ʋ ɛ
нестерпний	n ɪ s t ɛ r p n ɪ i
плавець	p ɫ ɛ ʋ ɛ t͡sʲ
виборами	ʋ ɪ b ɔ r ɛ m ɪ
неперервний	n ɪ p ɪ r ɛ r ʋ n ɪ i
тяжкий	tʲ ɛ ʒ k ɪ i
експонат	ɪ k s p ɔ n ɑ t
артеріям	ɛ r t ɛ rʲ i j ɛ m
богослов'я	b ɔ ɦ ɔ s ɫ ɔ ʋ j ɛ
парашутизм	p ɛ r ɛ ʃ u t ɪ z m
родитися	r ɔ d ɪ t ɪ sʲ ɛ
молекулярна	m ɔ ɫ ɪ k u lʲ ɑ r n ɛ
авторизувати	ɛ u t ɔ r ɪ z u ʋ ɑ t ɪ
поєднання	p ɔ j ɪ d n ɑ nʲ ɛ
листопад	ɫ ɪ s t ɔ p ɑ d
ікра	i k r ɑ
працівниці	p r ɛ t͡sʲ i u n ɪ t͡sʲ i
самоціль	s ɛ m ɔ t͡sʲ i lʲ
тренер	t r ɛ n ɪ r
болото	b ɔ ɫ ɔ t ɔ
існуючий	i s n u j u t͡ʃ ɪ i
сприятливий	s p r ɪ j ɑ t ɫ ɪ ʋ ɪ i
можливість	m ɔ ʒ ɫ ɪ ʋ i sʲ tʲ
родовий	r ɔ d ɔ ʋ ɪ i
стимул	s t ɪ m u ɫ
населити	n ɛ s ɪ ɫ ɪ t ɪ
терем	t ɛ r ɪ m
крим	k r ɪ m
аркуш	ɑ r k u ʃ
гнати	ɦ n ɑ t ɪ
вівсів	ʋ i u sʲ i u
прислівниковий	p r ɪ sʲ lʲ i u n ɪ k ɔ ʋ ɪ i
безвідсотковий	b ɪ zʲ ʋ i d͡z s ɔ t k ɔ ʋ ɪ i
навруз	n ɛ u r u z
пень	p ɛ nʲ
дзиґа	d͡z ɪ ɡ ɛ
блокадами	b ɫ ɔ k ɑ d ɛ m ɪ
гаманець	ɦ ɛ m ɛ n ɛ t͡sʲ
шведка	ʃ ʋ ɛ d k ɛ
поема	p ɔ ɛ m ɛ
чайна	t͡ʃ ɛ i n ɑ
коровай	k ɔ r ɔ ʋ ɑ i
календарем	k ɛ ɫ ɪ n d ɛ r ɛ m
орнітологія	ɔ r nʲ i t ɔ ɫ ɔ ɦ i j ɛ
різновид	rʲ i z n ɔ ʋ ɪ d
бонусом	b ɔ n u s ɔ m
досвідчений	d ɔ sʲ ʋ i d͡ʒ t͡ʃ ɪ n ɪ i
геймплей	ɦ ɪ i m p ɫ ɛ i
гривень	ɦ r ɪ ʋ ɪ nʲ
вжити	ʋ ʒ ɪ t ɪ
корчма	k ɔ r t͡ʃ m ɛ
ензим	ɪ n z ɪ m
поступці	p ɔ s t u p t͡sʲ i
морозиво	m ɔ r ɔ z ɪ ʋ ɔ
батяри	b ɛ tʲ ɑ r ɪ
благо	b ɫ ɑ ɦ ɔ
уособлювати	u ɔ s ɔ b lʲ u ʋ ɛ t ɪ
ідеалістичний	i d ɪ ɛ lʲ i s t ɪ t͡ʃ n ɪ i
пропорції	p r ɔ p ɔ r t͡sʲ i j i
промокнути	p r ɔ m ɔ k n u t ɪ
монополіст	m ɔ n ɔ p ɔ lʲ i s t
собівартість	s ɔ b i ʋ ɑ r tʲ i sʲ tʲ
швидкість	ʃ ʋ ɪ dʲ k i sʲ tʲ
слухач	s ɫ u x ɑ t͡ʃ
позбутися	p ɔ z b u t ɪ sʲ ɛ
тістечко	tʲ i s t ɪ t͡ʃ k ɔ
соня	s ɔ nʲ ɛ
нейтралітет	n ɪ i t r ɛ lʲ i t ɛ t
кіш	k i ʃ
фільтр	f i lʲ t r
текстовий	t ɪ k s t ɔ ʋ ɪ i
імперія	i m p ɛ rʲ i j ɛ
хмельницький	x m ɪ lʲ n ɪ t͡sʲ k ɪ i
фактичний	f ɛ k t ɪ t͡ʃ n ɪ i
тисяч	t ɪ sʲ ɛ t͡ʃ
відданість	ʋ i d ɛ nʲ i sʲ tʲ
пріоритет	p rʲ i ɔ r ɪ t ɛ t
маніпулювати	m ɛ nʲ i p u lʲ u ʋ ɑ t ɪ
академічний	ɛ k ɛ d ɪ m i t͡ʃ n ɪ i
гриб	ɦ r ɪ b
україною	u k r ɛ j i n ɔ j u
аґрусівка	ɛ ɡ r u sʲ i u k ɛ
супругою	s u p r u ɦ ɔ j u
аб'юрація	ɛ b j u r ɑ t͡sʲ i j ɛ
дисбаланс	d ɪ z b ɛ ɫ ɑ n s
переоцінювати	p ɪ r ɪ ɔ t͡sʲ i nʲ u ʋ ɛ t ɪ
позбавити	p ɔ z b ɑ ʋ ɪ t ɪ
гібридний	ɦ i b r ɪ d n ɪ i
душ	d u ʃ
філософія	f i ɫ ɔ s ɔ f i j ɛ
сусідка	s u sʲ i d k ɛ
першість	p ɛ r ʃ i sʲ tʲ
інтенсифікувати	i n t ɪ n s ɪ f i k u ʋ ɑ t ɪ
феміністичний	f ɪ m i nʲ i s t ɪ t͡ʃ n ɪ i
дати	d ɑ t ɪ
підмет	p i d m ɪ t
прамова	p r ɛ m ɔ ʋ ɛ
каплицею	k ɛ p ɫ ɪ t͡s ɪ j u
систематичний	s ɪ s t ɪ m ɛ t ɪ t͡ʃ n ɪ i
росіянин	r ɔ sʲ i j ɑ n ɪ n
тополі	t ɔ p ɔ lʲ i
активність	ɛ k t ɪ u nʲ i sʲ tʲ
авіасалон	ɛ ʋ i ɛ s ɛ ɫ ɔ n
даремність	d ɛ r ɛ m nʲ i sʲ tʲ
головний	ɦ ɔ ɫ ɔ u n ɪ i
спортивний	s p ɔ r t ɪ u n ɪ i
кліматичний	k lʲ i m ɛ t ɪ t͡ʃ n ɪ i
вищий	ʋ ɪ ʃ t͡ʃ ɪ i
відпочилий	ʋ i d p ɔ t͡ʃ ɪ ɫ ɪ i
чабер	t͡ʃ ɛ b ɛ r
психологічний	p s ɪ x ɔ ɫ ɔ ɦ i t͡ʃ n ɪ i
мізерний	m i z ɪ r n ɪ i
токар	t ɔ k ɛ r
угорськомовний	u ɦ ɔ r sʲ k ɔ m ɔ u n ɪ i
шоколад	ʃ ɔ k ɔ ɫ ɑ d
яма	j ɑ m ɛ
дані	d ɑ nʲ i
зовні	z ɔ u nʲ i
сумніватися	s u m nʲ i ʋ ɑ t ɪ sʲ ɛ
вітебськ	ʋ i t ɪ b sʲ k
друже	d r u ʒ ɪ
називати	n ɛ z ɪ ʋ ɑ t ɪ
концепція	k ɔ n t͡s ɛ p t͡sʲ i j ɛ
конлі	k ɔ nʲ lʲ i
рости	r ɔ s t ɪ
будда	b u d ɛ
активувати	ɛ k t ɪ ʋ u ʋ ɑ t ɪ
візантійський	ʋ i z ɛ nʲ tʲ i i sʲ k ɪ i
судно	s u d n ɔ
фразеологічний	f r ɛ z ɪ ɔ ɫ ɔ ɦ i t͡ʃ n ɪ i
артеріє	ɛ r t ɛ rʲ i j ɪ
міжвоєнний	m i ʒ ʋ ɔ j ɛ n ɪ i
зекономити	z ɪ k ɔ n ɔ m ɪ t ɪ
апатичний	ɛ p ɛ t ɪ t͡ʃ n ɪ i
дислокація	d ɪ s ɫ ɔ k ɑ t͡sʲ i j ɛ
щонайменше	ʃ t͡ʃ ɔ n ɛ i m ɛ n ʃ ɪ
куток	k u t ɔ k
несподіваний	n ɪ s p ɔ dʲ i ʋ ɛ n ɪ i
матеріальний	m ɛ t ɪ rʲ i ɑ lʲ n ɪ i
хворіти	x ʋ ɔ rʲ i t ɪ
кошуля	k ɔ ʃ u lʲ ɛ
продавати	p r ɔ d ɛ ʋ ɑ t ɪ
петиція	p ɪ t ɪ t͡sʲ i j ɛ
абластика	ɛ b ɫ ɑ s t ɪ k ɛ
авіаучилище	ɛ ʋ i ɛ u t͡ʃ ɪ ɫ ɪ ʃ t͡ʃ ɪ
довг	d ɔ u ɦ
обмеження	ɔ b m ɛ ʒ ɪ nʲ ɛ
жолудь	ʒ ɔ ɫ u dʲ
плювати	p lʲ u ʋ ɑ t ɪ
салон	s ɛ ɫ ɔ n
розуміння	r ɔ z u m i nʲ ɛ
світанок	sʲ ʋ i t ɑ n ɔ k
неформальний	n ɪ f ɔ r m ɑ lʲ n ɪ i
продавщиця	p r ɔ d ɛ u ʃ t͡ʃ ɪ t͡sʲ ɛ
трок	t r ɔ k
декларацію	d ɪ k ɫ ɛ r ɑ t͡sʲ i j u
лихоманка	ɫ ɪ x ɔ m ɑ n k ɛ
матрьошка	m ɛ tʲ rʲ ɔ ʃ k ɛ
дитсадок	d ɪ t͡s ɛ d ɔ k
симпатичний	s ɪ m p ɛ t ɪ t͡ʃ n ɪ i
повідомлення	p ɔ ʋ i d ɔ m ɫ ɪ nʲ ɛ
довгий	d ɔ u ɦ ɪ i
репродуктивний	r ɪ p r ɔ d u k t ɪ u n ɪ i
погрожувати	p ɔ ɦ r ɔ ʒ u ʋ ɛ t ɪ
батальйон	b ɛ t ɛ lʲ j ɔ n
травень	t r ɑ ʋ ɪ nʲ
напружити	n ɛ p r u ʒ ɪ t ɪ
третій	t r ɛ tʲ i i
стрічки	s tʲ rʲ i t͡ʃ k ɪ
працівниками	p r ɛ t͡sʲ i u n ɪ k ɑ m ɪ
розмова	r ɔ z m ɔ ʋ ɛ
офіра	ɔ f i r ɛ
литва	ɫ ɪ t ʋ ɑ
начиння	n ɛ t͡ʃ ɪ nʲ ɛ
слух	s ɫ u x
південь	p i u d ɪ nʲ
абразія	ɛ b r ɑ zʲ i j ɛ
цвях	t͡sʲ ʋ ɑ x
реконструкція	r ɪ k ɔ n s t r u k t͡sʲ i j ɛ
хороший	x ɔ r ɔ ʃ ɪ i
зовнішній	z ɔ u nʲ i ʃ nʲ i i
установа	u s t ɛ n ɔ ʋ ɛ
присвійний	p r ɪ sʲ ʋ i i n ɪ i
власті	ʋ ɫ ɑ sʲ tʲ i
законослухняний	z ɛ k ɔ n ɔ s ɫ u x nʲ ɑ n ɪ i
пришвидшити	p r ɪ ʃ ʋ ɪ d͡ʒ ʃ ɪ t ɪ
слівця	sʲ lʲ i u t͡sʲ ɛ
житній	ʒ ɪ tʲ nʲ i i
оточувати	ɔ t ɔ t͡ʃ u ʋ ɛ t ɪ
здатен	z d ɑ t ɪ n
негативно	n ɪ ɦ ɛ t ɪ u n ɔ
інфікування	i nʲ f i k u ʋ ɑ nʲ ɛ
теорію	t ɪ ɔ rʲ i j u
еротика	ɪ r ɔ t ɪ k ɛ
федерації	f ɪ d ɪ r ɑ t͡sʲ i j i
проблема	p r ɔ b ɫ ɛ m ɛ
брехню	b r ɪ x nʲ u
психіка	p s ɪ x i k ɛ
білок	b i ɫ ɔ k
лист	ɫ ɪ s t
австралопітек	ɛ u s t r ɛ ɫ ɔ p i t ɛ k
кайман	k ɛ i m ɑ n
ніготь	nʲ i ɦ ɔ tʲ
марія	m ɛ rʲ i j ɛ
звикнути	z ʋ ɪ k n u t ɪ
бонусами	b ɔ n u s ɛ m ɪ
конкурс	k ɔ n k u r s
птиця	p t ɪ t͡sʲ ɛ
кота	k ɔ t ɑ
могутній	m ɔ ɦ u tʲ nʲ i i
дитсадки	d ɪ t͡s ɛ d k ɪ
авіамаяк	ɛ ʋ i ɛ m ɛ j ɑ k
новини	n ɔ ʋ ɪ n ɪ
безпритульний	b ɪ z p r ɪ t u lʲ n ɪ i
скандинавія	s k ɛ n d ɪ n ɑ ʋ i j ɛ
кишенею	k ɪ ʃ ɛ n ɪ j u
жона	ʒ ɔ n ɑ
працівницям	p r ɛ t͡sʲ i u n ɪ t͡sʲ ɛ m
індустріалізувати	i n d u s tʲ rʲ i ɛ lʲ i z u ʋ ɑ t ɪ
цією	t͡sʲ i j ɛ j u
катастрофи	k ɛ t ɛ s t r ɔ f ɪ
