в'язниця	ʋ j ɛ z n ɪ t͡sʲ ɛ
козирок	k ɔ z ɪ r ɔ k
дорогий	d ɔ r ɔ ɦ ɪ i
потилице	p ɔ t ɪ ɫ ɪ t͡s ɪ
грязь	ɦ rʲ ɑ zʲ
бацяр	b ɑ t͡sʲ ɛ r
абрикос	ɛ b r ɪ k ɔ s
заєць	z ɑ j ɪ t͡sʲ
школа	ʃ k ɔ ɫ ɛ
курити	k u r ɪ t ɪ
імпортувати	i m p ɔ r t u ʋ ɑ t ɪ
тисячоліттями	t ɪ sʲ ɛ t͡ʃ ɔ lʲ i tʲ ɛ m ɪ
фіскальний	f i s k ɑ lʲ n ɪ i
абсанс	ɛ b s ɑ n s
автобусик	ɛ u t ɔ b u s ɪ k
утомлений	u t ɔ m ɫ ɪ n ɪ i
ізраїльтянка	i z r ɛ j i lʲ tʲ ɑ n k ɛ
повернути	p ɔ ʋ ɪ r n u t ɪ
позичати	p ɔ z ɪ t͡ʃ ɑ t ɪ
район	r ɛ j ɔ n
більшати	b i lʲ ʃ ɛ t ɪ
заїр	z ɛ j i r
масштаб	m ɛ ʃ t ɑ b
золото	z ɔ ɫ ɔ t ɔ
феями	f ɛ j ɛ m ɪ
снідати	sʲ nʲ i d ɛ t ɪ
втручання	ʋ t r u t͡ʃ ɑ nʲ ɛ
бюрократка	b u r ɔ k r ɑ t k ɛ
трансформаціям	t r ɛ n s f ɔ r m ɑ t͡sʲ i j ɛ m
білоруський	b i ɫ ɔ r u sʲ k ɪ i
невидимий	n ɪ ʋ ɪ d ɪ m ɪ i
смак	s m ɑ k
наприкінці	n ɛ p r ɪ k i nʲ t͡sʲ i
автобіограф	ɛ u t ɔ b i ɔ ɦ r ɛ f
небога	n ɪ b ɔ ɦ ɛ
заохотити	z ɛ ɔ x ɔ t ɪ t ɪ
конфета	k ɔ n f ɛ t ɛ
логістичний	ɫ ɔ ɦ i s t ɪ t͡ʃ n ɪ i
вирішення	ʋ ɪ rʲ i ʃ ɪ nʲ ɛ
театр	t ɪ ɑ t r
кубічний	k u b i t͡ʃ n ɪ i
додатках	d ɔ d ɑ t k ɛ x
америка	ɛ m ɛ r ɪ k ɛ
ними	n ɪ m ɪ
виконання	ʋ ɪ k ɔ n ɑ nʲ ɛ
абстракція	ɛ b s t r ɑ k t͡sʲ i j ɛ
чотирикутний	t͡ʃ ɔ t ɪ r ɪ k u t n ɪ i
п'ятдесят	p j ɛ d d ɪ sʲ ɑ t
гуманістичний	ɦ u m ɛ nʲ i s t ɪ t͡ʃ n ɪ i
батьківщина	b ɛ tʲ k i u ʃ t͡ʃ ɪ n ɛ
пропорціях	p r ɔ p ɔ r t͡sʲ i j ɛ x
повечеряти	p ɔ ʋ ɪ t͡ʃ ɛ rʲ ɛ t ɪ
невідворотний	n ɪ ʋ i d ʋ ɔ r ɔ t n ɪ i
інна	i n ɛ
система	s ɪ s t ɛ m ɛ
геометричний	ɦ ɪ ɔ m ɪ t r ɪ t͡ʃ n ɪ i
забагти	z ɛ b ɑ ɦ t ɪ
гомосексуалізм	ɦ ɔ m ɔ s ɪ k s u ɛ lʲ i z m
троє	t r ɔ j ɪ
вмерти	ʋ m ɛ r t ɪ
альбатрос	ɛ lʲ b ɛ t r ɔ s
ратифікація	r ɛ t ɪ f i k ɑ t͡sʲ i j ɛ
тож	t ɔ ʒ
співпереживання	sʲ p i u p ɪ r ɪ ʒ ɪ ʋ ɑ nʲ ɛ
діагностика	dʲ i ɛ ɦ n ɔ s t ɪ k ɛ
відвернути	ʋ i d ʋ ɪ r n u t ɪ
кубинець	k u b ɪ n ɪ t͡sʲ
вимкнути	ʋ ɪ m k n u t ɪ
своєрідний	s ʋ ɔ j ɪ rʲ i d n ɪ i
пропорціям	p r ɔ p ɔ r t͡sʲ i j ɛ m
янтар	j ɛ n t ɑ r
станіслав	s t ɛ nʲ i s ɫ ɑ u
меланія	m ɪ ɫ ɑ nʲ i j ɛ
багато	b ɛ ɦ ɑ t ɔ
цитрина	t͡s ɪ t r ɪ n ɛ
розпізнавання	r ɔ zʲ p i z n ɛ ʋ ɑ nʲ ɛ
свекруха	s ʋ ɪ k r u x ɛ
тисячоліттях	t ɪ sʲ ɛ t͡ʃ ɔ lʲ i tʲ ɛ x
батько	b ɑ tʲ k ɔ
неправді	n ɪ p r ɑ u dʲ i
діаграма	dʲ i ɛ ɦ r ɑ m ɛ
дзеркало	d͡z ɛ r k ɛ ɫ ɔ
мур	m u r
молодий	m ɔ ɫ ɔ d ɪ i
візуальний	ʋ i z u ɑ lʲ n ɪ i
зоопарк	z ɔ ɔ p ɑ r k
авіапарк	ɛ ʋ i ɛ p ɑ r k
плюш	p lʲ u ʃ
п'ятниця	p j ɑ t n ɪ t͡sʲ ɛ
письменний	p ɪ sʲ m ɛ n ɪ i
українських	u k r ɛ j i nʲ sʲ k ɪ x
хліб	x lʲ i b
залежний	z ɛ ɫ ɛ ʒ n ɪ i
мовознавство	m ɔ ʋ ɔ z n ɑ u s t ʋ ɔ
участь	u t͡ʃ ɛ sʲ tʲ
сауна	s ɑ u n ɛ
місяць	m i sʲ ɛ t͡sʲ
фольклор	f ɔ lʲ k ɫ ɔ r
успішний	u sʲ p i ʃ n ɪ i
засмутити	z ɛ s m u t ɪ t ɪ
тацею	t ɑ t͡s ɪ j u
критерієм	k r ɪ t ɛ rʲ i j ɪ m
авіавиставка	ɛ ʋ i ɛ ʋ ɪ s t ɛ u k ɛ
підкреслювати	p i d k r ɛ sʲ lʲ u ʋ ɛ t ɪ
тільки	tʲ i lʲ k ɪ
возити	ʋ ɔ z ɪ t ɪ
зменшень	z m ɛ n ʃ ɪ nʲ
тріска	tʲ rʲ i s k ɛ
рішити	rʲ i ʃ ɪ t ɪ
інтуїтивно	i n t u j i t ɪ u n ɔ
хлопчик	x ɫ ɔ p t͡ʃ ɪ k
коліно	k ɔ lʲ i n ɔ
жорстокий	ʒ ɔ r s t ɔ k ɪ i
амфібія	ɛ m f i b i j ɛ
транзит	t r ɛ n z ɪ t
виявитися	ʋ ɪ j ɛ ʋ ɪ t ɪ sʲ ɛ
спростити	s p r ɔ s t ɪ t ɪ
криголам	k r ɪ ɦ ɔ ɫ ɑ m
мокнути	m ɔ k n u t ɪ
ростити	r ɔ s t ɪ t ɪ
зрости	z r ɔ s t ɪ
куди	k u d ɪ
відродження	ʋ i d r ɔ d͡ʒ ɪ nʲ ɛ
посталий	p ɔ s t ɑ ɫ ɪ i
його	j ɔ ɦ ɔ
кривавий	k r ɪ ʋ ɑ ʋ ɪ i
нескладовий	n ɪ s k ɫ ɛ d ɔ ʋ ɪ i
автодидакт	ɛ u t ɔ d ɪ d ɑ k t
їжакевич	j i ʒ ɛ k ɛ ʋ ɪ t͡ʃ
мем	m ɛ m
