あいがん	a̠ i ɡ ã̠ ɴ
あいにく	a̠ i ɲ̟ i k ɯ̟ᵝ
あいよ	a̠ i j o̞
あおげいとう	a̠ o̞ ɡ e̞ː t o̞ː
あおば	a̠ o̞ b a̠
あおもりけん	a̠ o̞ m o̞ ɾʲ i k ẽ̞ ɴ
あがき	a̠ ɡ a̠ kʲ i
あくせく	a̠ k ɯ̟ᵝ s e̞ k ɯ̟ᵝ
あくにち	a̠ k ɯ̟ᵝ ɲ̟ i t͡ɕ i
あげはちょう	a̠ ɡ e̞ h a̠ t͡ɕ o̞ː
あさいろ	a̠ s a̠ i ɾ o̞
あさって	a̠ s a̠ t̚ t e̞
あざわらう	a̠ z a̠ ɰᵝ a̠ ɾ a̠ ɯ̟ᵝ
あっけない	a̠ k̚ k e̞ n a̠ i
あっさく	a̠ sː a̠ k ɯ̟ᵝ
あつくるしい	a̠ t͡s ɨᵝ k ɯ̟ᵝ ɾ ɯ̟ᵝ ɕ iː
あつらえる	a̠ t͡s ɨᵝ ɾ a̠ e̞ ɾ ɯ̟ᵝ
あに	a̠ ɲ̟ i
あまでら	a̠ m a̠ d e̞ ɾ a̠
あまねく	a̠ m a̠ n e̞ k ɯ̟ᵝ
あらい	a̠ ɾ a̠ i
ある	a̠ ɾ ɯ̟ᵝ
あんこう	ã̠ ŋ k o̞ː
あんしじゅつ	ã̠ ɰ̃ ɕ i ʑ ɨᵝ t͡s ɨᵝ
あんなに	ã̠ nː a̠ ɲ̟ i
あんまり	ã̠ mː a̠ ɾʲ i
いいんかい	i ĩ ŋ k a̠ i
いう	i ɯ̟ᵝ
いしかわけん	i ɕ i k a̠ ɰᵝ a̠ k ẽ̞ ɴ
いしがんとう	i ɕ i ɡ ã̠ n t o̞ː
いしだたみ	i ɕ i d a̠ t a̠ mʲ i
いしゅう	i ɕ ɨᵝː
いすず	i s ɨᵝ z ɨᵝ
いずのくに	i z ɨᵝ n o̞ k ɯ̟ᵝ ɲ̟ i
いずれ	i z ɨᵝ ɾ e̞
いせい	i s e̞ː
いた	i t a̠
いたしゃ	i t a̠ ɕ a̠
いちじくか	i t͡ɕ i ʑ i k ɯ̟ᵝ k a̠
いちにんまえ	i t͡ɕ i ɲ̟ ĩ mː a̠ e̞
いちはやく	i t͡ɕ i h a̠ j a̠ k ɯ̟ᵝ
いちぶ	i t͡ɕ i b ɯ̟ᵝ
いちゃいちゃ	i t͡ɕ a̠ i t͡ɕ a̠
いっしゅう	i ɕː ɯ̟ᵝː
いっしょく	i ɕː o̞ k ɯ̟ᵝ
いってまいります	i t̚ t e̞ m a̠ i ɾʲ i m a̠ s ɨᵝ
いっぱんじん	i p̚ p ã̠ ɲ̟ d͡ʑ ĩ ɴ
いなせ	i n a̠ s e̞
いのち	i n o̞ t͡ɕ i
いはん	i h ã̠ ɴ
いぼじ	i b o̞ ʑ i
いわくつき	i ɰᵝ a̠ k ɯ̟ᵝ t͡s ɨᵝ kʲ i
うえきばち	ɯ̟ᵝ e̞ kʲ i b a̠ t͡ɕ i
うえさま	ɯ̟ᵝ e̞ s a̠ m a̠
うしろあるき	ɯ̟ᵝ ɕ i ɾ o̞ a̠ ɾ ɯ̟ᵝ kʲ i
うそひめ	ɯ̟ᵝ s o̞ ç i m e̞
うまれつき	ɯ̟ᵝ m a̠ ɾ e̞ t͡s ɨᵝ kʲ i
うめく	ɯ̟ᵝ m e̞ k ɯ̟ᵝ
うら	ɯ̟ᵝ ɾ a̠
うらびょうし	ɯ̟ᵝ ɾ a̠ bʲ o̞ː ɕ i
うり	ɯ̟ᵝ ɾʲ i
うろたえる	ɯ̟ᵝ ɾ o̞ t a̠ e̞ ɾ ɯ̟ᵝ
うんどうおんち	ɯ̟̃ᵝ n d o̞ː õ̞ ɲ̟ t͡ɕ i
うんどうりょう	ɯ̟̃ᵝ n d o̞ː ɾʲ o̞ː
えさ	e̞ s a̠
えさし	e̞ s a̠ ɕ i
えり	e̞ ɾʲ i
えんざんぞうふくき	ẽ̞ n d͡z ã̠ n d͡z o̞ː ɸ ɯ̟ᵝ k ɯ̟̊ᵝ kʲ i
えんしゅう	ẽ̞ ɰ̃ ɕ ɨᵝː
えんたく	ẽ̞ n t a̠ k ɯ̟ᵝ
えんだい	ẽ̞ n d a̠ i
えんちゅうひょう	ẽ̞ ɲ̟ t͡ɕ ɨᵝː ç o̞ː
えんちょうせん	ẽ̞ ɲ̟ t͡ɕ o̞ː s ẽ̞ ɴ
えんびふく	ẽ̞ m bʲ i ɸ ɯ̟̊ᵝ k ɯ̟ᵝ
えんぴつ	ẽ̞ m pʲ i̥ t͡s ɨᵝ
おいたつ	o̞ i t a̠ t͡s ɨᵝ
おうこく	o̞ː k o̞ k ɯ̟ᵝ
おうごんじだい	o̞ː ɡ õ̞ ɲ̟ d͡ʑ i d a̠ i
おうじょうぎわ	o̞ː ʑ o̞ː ɡʲ i ɰᵝ a̠
おうへい	o̞ː h e̞ː
おうれん	o̞ː ɾ ẽ̞ ɴ
おおずもう	o̞ː z ɨᵝ m o̞ː
おから	o̞ k a̠ ɾ a̠
おからこうじ	o̞ k a̠ ɾ a̠ k o̞ː ʑ i
おきゃく	o̞ kʲ a̠ k ɯ̟ᵝ
おきる	o̞ kʲ i ɾ ɯ̟ᵝ
おぎなう	o̞ ɡʲ i n a̠ ɯ̟ᵝ
おこがましい	o̞ k o̞ ɡ a̠ m a̠ ɕ iː
おこもり	o̞ k o̞ m o̞ ɾʲ i
おこる	o̞ k o̞ ɾ ɯ̟ᵝ
おしゃぶり	o̞ ɕ a̠ b ɯ̟ᵝ ɾʲ i
おじうえ	o̞ ʑ i ɯ̟ᵝ e̞
おそれる	o̞ s o̞ ɾ e̞ ɾ ɯ̟ᵝ
おち	o̞ t͡ɕ i
おとこ	o̞ t o̞ k o̞
おとこがお	o̞ t o̞ k o̞ ɡ a̠ o̞
おとこのこ	o̞ t o̞ k o̞ n o̞ k o̞
おふくろ	o̞ ɸ ɯ̟̊ᵝ k ɯ̟ᵝ ɾ o̞
おべっか	o̞ b e̞ k̚ k a̠
おまえ	o̞ m a̠ e̞
おまんこ	o̞ m ã̠ ŋ k o̞
おもいつき	o̞ m o̞ i t͡s ɨᵝ kʲ i
おもいやり	o̞ m o̞ i j a̠ ɾʲ i
おもんぱかる	o̞ m õ̞ m p a̠ k a̠ ɾ ɯ̟ᵝ
おや	o̞ j a̠
おやすみになる	o̞ j a̠ s ɨᵝ mʲ i ɲ̟ i n a̠ ɾ ɯ̟ᵝ
および	o̞ j o̞ bʲ i
おりる	o̞ ɾʲ i ɾ ɯ̟ᵝ
おんどり	õ̞ n d o̞ ɾʲ i
おんながお	õ̞ nː a̠ ɡ a̠ o̞
おんよみ	õ̞ ɰ̃ j o̞ mʲ i
かいあわせ	k a̠ i a̠ ɰᵝ a̠ s e̞
かいけつ	k a̠ i k e̞ t͡s ɨᵝ
かいこく	k a̠ i k o̞ k ɯ̟ᵝ
かいぞくばん	k a̠ i z o̞ k ɯ̟ᵝ b ã̠ ɴ
かいらいし	k a̠ i ɾ a̠ i ɕ i
かえすがえす	k a̠ e̞ s ɨᵝ ɡ a̠ e̞ s ɨᵝ
かがくはくぶつかん	k a̠ ɡ a̠ k ɯ̟ᵝ h a̠ k ɯ̟ᵝ b ɯ̟ᵝ t͡s ɨ̥ᵝ k ã̠ ɴ
かがむ	k a̠ ɡ a̠ m ɯ̟ᵝ
かきとる	k a̠ kʲ i t o̞ ɾ ɯ̟ᵝ
かぎ	k a̠ ɡʲ i
かくたる	k a̠ k ɯ̟ᵝ t a̠ ɾ ɯ̟ᵝ
かげえ	k a̠ ɡ e̞ e̞
かさい	k a̠ s a̠ i
かざい	k a̠ z a̠ i
かしこ	k a̠ ɕ i̥ k o̞
かしゃ	k a̠ ɕ a̠
かずかず	k a̠ z ɨᵝ k a̠ z ɨᵝ
かぜ	k a̠ z e̞
かそる	k a̠ s o̞ ɾ ɯ̟ᵝ
かたて	k a̠ t a̠ t e̞
かたなかじ	k a̠ t a̠ n a̠ k a̠ ʑ i
かっこうわるい	k a̠ k̚ k o̞ː ɰᵝ a̠ ɾ ɯ̟ᵝ i
かっせん	k a̠ sː ẽ̞ ɴ
かつえき	k a̠ t͡s ɨᵝ e̞ kʲ i
かつら	k a̠ t͡s ɨᵝ ɾ a̠
かのう	k a̠ n o̞ː
かふか	k a̠ ɸ ɯ̟ᵝ k a̠
かまぼこ	k a̠ m a̠ b o̞ k o̞
かみあわせる	k a̠ mʲ i a̠ ɰᵝ a̠ s e̞ ɾ ɯ̟ᵝ
かみしばい	k a̠ mʲ i ɕ i b a̠ i
から	k a̠ ɾ a̠
からすとんび	k a̠ ɾ a̠ s ɨ̥ᵝ t õ̞ m bʲ i
からだ	k a̠ ɾ a̠ d a̠
かる	k a̠ ɾ ɯ̟ᵝ
かるい	k a̠ ɾ ɯ̟ᵝ i
かんこんそうさい	k ã̠ ŋ k õ̞ ɰ̃ s o̞ː s a̠ i
かんしつけい	k ã̠ ɰ̃ ɕ i t͡s ɨᵝ k e̞ː
かんせん	k ã̠ ɰ̃ s ẽ̞ ɴ
かんたん	k ã̠ n t ã̠ ɴ
がいこうかん	ɡ a̠ i k o̞ː k ã̠ ɴ
がいちょう	ɡ a̠ i t͡ɕ o̞ː
がごう	ɡ a̠ ɡ o̞ː
がちょう	ɡ a̠ t͡ɕ o̞ː
がっこ	ɡ a̠ k̚ k o̞
がってん	ɡ a̠ t̚ t ẽ̞ ɴ
がにまた	ɡ a̠ ɲ̟ i m a̠ t a̠
がりべん	ɡ a̠ ɾʲ i b ẽ̞ ɴ
がんきゅう	ɡ ã̠ ŋʲ kʲ ɨᵝː
きえる	kʲ i e̞ ɾ ɯ̟ᵝ
きが	kʲ i ɡ a̠
ききはずす	kʲ i kʲ i h a̠ z ɨᵝ s ɨᵝ
きこくしじょ	kʲ i k o̞ k ɯ̟ᵝ ɕ i ʑ o̞
きじゅつ	kʲ i ʑ ɨᵝ t͡s ɨᵝ
きじょ	kʲ i ʑ o̞
きそく	kʲ i s o̞ k ɯ̟ᵝ
きびしい	kʲ i bʲ i ɕ i i
きゃくしょく	kʲ a̠ k ɯ̟ᵝ ɕ o̞ k ɯ̟ᵝ
きゅうげき	kʲ ɨᵝː ɡ e̞ kʲ i
きょうごうじょうたい	kʲ o̞ː ɡ o̞ː d͡ʑ o̞ː t a̠ i
きょうしゃ	kʲ o̞ː ɕ a̠
きょうしょう	kʲ o̞ː ɕ o̞ː
きょうじょう	kʲ o̞ː ʑ o̞ː
きょうせいしゅうようじょ	kʲ o̞ː s e̞ː ɕ ɨᵝː j o̞ː ʑ o̞
きょうそうきょく	kʲ o̞ː s o̞ː kʲ o̞ k ɯ̟ᵝ
きょうてん	kʲ o̞ː t ẽ̞ ɴ
きょうどうしゅっし	kʲ o̞ː d o̞ː ɕ ɨᵝ ɕː i
きょくげん	kʲ o̞ k ɯ̟ᵝ ɡ ẽ̞ ɴ
きよ	kʲ i j o̞
きれい	kʲ i ɾ e̞ː
きんてき	kʲ ĩ n t e̞ kʲ i
きんよく	kʲ ĩ ɰ̃ j o̞ k ɯ̟ᵝ
ぎゃくさつ	ɡʲ a̠ k ɯ̟ᵝ s a̠ t͡s ɨᵝ
ぎりぎり	ɡʲ i ɾʲ i ɡʲ i ɾʲ i
ぎんぽ	ɡʲ ĩ m p o̞
くたびれる	k ɯ̟ᵝ t a̠ bʲ i ɾ e̞ ɾ ɯ̟ᵝ
くだらごと	k ɯ̟ᵝ d a̠ ɾ a̠ ɡ o̞ t o̞
くちずさむ	k ɯ̟ᵝ t͡ɕ i z ɨᵝ s a̠ m ɯ̟ᵝ
くつした	k ɯ̟̊ᵝ t͡s ɨᵝ ɕ i̥ t a̠
くびったけ	k ɯ̟ᵝ bʲ i t̚ t a̠ k e̞
くへんとうゆ	k ɯ̟ᵝ h ẽ̞ n t o̞ː j ɯ̟ᵝ
くやしい	k ɯ̟ᵝ j a̠ ɕ iː
くるい	k ɯ̟ᵝ ɾ ɯ̟ᵝ i
くるいざき	k ɯ̟ᵝ ɾ ɯ̟ᵝ i z a̠ kʲ i
くわ	k ɯ̟ᵝ ɰᵝ a̠
くわわる	k ɯ̟ᵝ ɰᵝ a̠ ɰᵝ a̠ ɾ ɯ̟ᵝ
ぐうぞうすうはい	ɡ ɯ̟ᵝː z o̞ː s ɨᵝː h a̠ i
ぐせい	ɡ ɯ̟ᵝ s e̞ː
ぐちをこぼす	ɡ ɯ̟ᵝ t͡ɕ i o̞ k o̞ b o̞ s ɨᵝ
ぐんぴ	ɡ ɯ̟̃ᵝ m pʲ i
けいこうひにんやく	k e̞ː k o̞ː ç i ɲ̟ ĩ ɰ̃ j a̠ k ɯ̟ᵝ
けいりょうき	k e̞ː ɾʲ o̞ː kʲ i
けた	k e̞ t a̠
けつけつ	k e̞ t͡s ɨᵝ k e̞ t͡s ɨᵝ
けれども	k e̞ ɾ e̞ d o̞ m o̞
けんぎゅうせい	k ẽ̞ ŋʲ ɡʲ ɨᵝː s e̞ː
けんぎょう	k ẽ̞ ŋʲ ɡʲ o̞ː
けんじょうしゃ	k ẽ̞ ɲ̟ d͡ʑ o̞ː ɕ a̠
け゚	ŋ e̞
げき	ɡ e̞ kʲ i
げっか	ɡ e̞ k̚ k a̠
げんめつ	ɡ ẽ̞ mː e̞ t͡s ɨᵝ
こうきゅう	k o̞ː kʲ ɨᵝː
こうくう	k o̞ː k ɯ̟ᵝː
こうご	k o̞ː ɡ o̞
こうちしょ	k o̞ː t͡ɕ i ɕ o̞
こうつうきかん	k o̞ː t͡s ɨᵝː kʲ i k ã̠ ɴ
こうにち	k o̞ː ɲ̟ i t͡ɕ i
こうもり	k o̞ː m o̞ ɾʲ i
こうら	k o̞ː ɾ a̠
こうりゃく	k o̞ː ɾʲ a̠ k ɯ̟ᵝ
こおり	k o̞ː ɾʲ i
こおりや	k o̞ː ɾʲ i j a̠
こかげ	k o̞ k a̠ ɡ e̞
こがねいろ	k o̞ ɡ a̠ n e̞ i ɾ o̞
こくすい	k o̞ k ɯ̟ᵝ s ɨᵝ i
こくそう	k o̞ k ɯ̟ᵝ s o̞ː
こくそく	k o̞ k ɯ̟ᵝ s o̞ k ɯ̟ᵝ
こくど	k o̞ k ɯ̟ᵝ d o̞
こくどう	k o̞ k ɯ̟ᵝ d o̞ː
こくゆう	k o̞ k ɯ̟ᵝ j ɯ̟ᵝː
こけおどし	k o̞ k e̞ o̞ d o̞ ɕ i
こころみ	k o̞ k o̞ ɾ o̞ mʲ i
こせい	k o̞ s e̞ː
こちとら	k o̞ t͡ɕ i t o̞ ɾ a̠
こっくん	k o̞ k̚ k ɯ̟̃ᵝ ɴ
こづち	k o̞ z ɨᵝ t͡ɕ i
こぼれ	k o̞ b o̞ ɾ e̞
こまぶえ	k o̞ m a̠ b ɯ̟ᵝ e̞
こめ	k o̞ m e̞
こもりぐま	k o̞ m o̞ ɾʲ i ɡ ɯ̟ᵝ m a̠
こやま	o̞ j a̠ m a̠
こん	k õ̞ ɴ
こんごう	k õ̞ ŋ ɡ o̞ː
ごうご	ɡ o̞ː ɡ o̞
ごうりてき	ɡ o̞ː ɾʲ i t e̞ kʲ i
ごく	ɡ o̞ k ɯ̟ᵝ
ごくらくちょう	ɡ o̞ k ɯ̟ᵝ ɾ a̠ k ɯ̟̊ᵝ t͡ɕ o̞ː
ごげんてき	ɡ o̞ ɡ ẽ̞ n t e̞ kʲ i
ごっちゃ	ɡ o̞ t̚ t͡ɕ a̠
さいしょくしゅぎ	s a̠ i ɕ o̞ k ɯ̟ᵝ ɕ ɨᵝ ɡʲ i
さいほうし	s a̠ i h o̞ː ɕ i
さいみんりょうほう	s a̠ i mʲ ĩ n ɾʲ o̞ː h o̞ː
さえ	s a̠ e̞
さかいめ	s a̠ k a̠ i m e̞
さかな	s a̠ k a̠ n a̠
さくひん	s a̠ k ɯ̟̊ᵝ ç ĩ ɴ
さくらもち	s a̠ k ɯ̟ᵝ ɾ a̠ m o̞ t͡ɕ i
ささげる	s a̠ s a̠ ɡ e̞ ɾ ɯ̟ᵝ
ささやか	s a̠ s a̠ j a̠ k a̠
さざなみ	s a̠ z a̠ n a̠ mʲ i
さだめない	s a̠ d a̠ m e̞ n a̠ i
さっきゅう	s a̠ k̚ʲ kʲ ɨᵝː
さてつ	s a̠ t e̞ t͡s ɨᵝ
さと	s a̠ t o̞
さとうや	s a̠ t o̞ː j a̠
さば	s a̠ b a̠
さま	s a̠ m a̠
さむい	s a̠ m ɯ̟ᵝ i
さわる	s a̠ ɰᵝ a̠ ɾ ɯ̟ᵝ
さんぱくがん	s ã̠ m p a̠ k ɯ̟ᵝ ɡ ã̠ ɴ
ざっしょく	d͡z a̠ ɕː o̞ k ɯ̟ᵝ
ざっとう	d͡z a̠ t̚ t o̞ː
ざんにゅう	d͡z ã̠ ɲ̟ ɲ̟ ɯ̟ᵝː
しあがり	ɕ i a̠ ɡ a̠ ɾʲ i
しいれ	ɕ iː ɾ e̞
しお	ɕ i o̞
しおう	ɕ i o̞ː
しおり	ɕ i o̞ ɾʲ i
しかも	ɕ i k a̠ m o̞
しさん	ɕ i s ã̠ ɴ
しぜんげんご	ɕ i z ẽ̞ ŋ ɡ ẽ̞ ŋ ɡ o̞
しつどくしょう	ɕ i t͡s ɨᵝ d o̞ k ɯ̟ᵝ ɕ o̞ː
しでん	ɕ i d ẽ̞ ɴ
しとやか	ɕ i t o̞ j a̠ k a̠
しなやか	ɕ i n a̠ j a̠ k a̠
しにせ	ɕ i ɲ̟ i s e̞
しのびのもの	ɕ i n o̞ bʲ i n o̞ m o̞ n o̞
しふう	ɕ i ɸ ɯ̟ᵝː
しまね	ɕ i m a̠ n e̞
しめる	ɕ i m e̞ ɾ ɯ̟ᵝ
しもだ	ɕ i m o̞ d a̠
しゃがむ	ɕ a̠ ɡ a̠ m ɯ̟ᵝ
しゃくしじょうぎ	ɕ a̠ k ɯ̟ᵝ ɕ i d͡ʑ o̞ː ɡʲ i
しゃみ	ɕ a̠ mʲ i
しやくしょ	ɕ i j a̠ k ɯ̟̊ᵝ ɕ o̞
しゅうさく	ɕ ɨᵝː s a̠ k ɯ̟ᵝ
しゅうさん	ɕ ɨᵝː s ã̠ ɴ
しゅうたい	ɕ ɨᵝː t a̠ i
しゅくせい	ɕ ɨᵝ k ɯ̟ᵝ s e̞ː
しゅじんこうほせい	ɕ ɨᵝ ʑ ĩ ŋ k o̞ː h o̞ s e̞ː
しゅっきん	ɕ ɨᵝ k̚ʲ kʲ ĩ ɴ
しょうかんじゅう	ɕ o̞ː k ã̠ ɲ̟ d͡ʑ ɨᵝː
しょうまん	ɕ o̞ː m ã̠ ɴ
しょうり	ɕ o̞ː ɾʲ i
しょぐう	ɕ o̞ ɡ ɯ̟ᵝː
しょせいじゅつ	ɕ o̞ s e̞ː ʑ ɨᵝ t͡s ɨᵝ
しらぬい	ɕ i ɾ a̠ n ɯ̟ᵝ i
しらんぷり	ɕ i ɾ ã̠ m p ɯ̟ᵝ ɾʲ i
しるひとぞしる	ɕ i ɾ ɯ̟ᵝ ç i t o̞ d͡z o̞ ɕ i ɾ ɯ̟ᵝ
しろあり	ɕ i ɾ o̞ a̠ ɾʲ i
しんせいだい	ɕ ĩ ɰ̃ s e̞ː d a̠ i
しんそう	ɕ ĩ ɰ̃ s o̞ː
しんどく	ɕ ĩ n d o̞ k ɯ̟ᵝ
しんぱんいん	ɕ ĩ m p ã̠ ɰ̃ ĩ ɴ
しんぶつ	ɕ ĩ m b ɯ̟ᵝ t͡s ɨᵝ
しんぷく	ɕ ĩ m p ɯ̟̊ᵝ k ɯ̟ᵝ
しんりょう	ɕ ĩ n ɾʲ o̞ː
じきゅうじそく	d͡ʑ i kʲ ɨᵝː ʑ i s o̞ k ɯ̟ᵝ
じこちゅうしん	d͡ʑ i k o̞ t͡ɕ ɨᵝː ɕ ĩ ɴ
じごくへのみちはぜんいでほそうされている	d͡ʑ i ɡ o̞ k ɯ̟ᵝ e̞ n o̞ mʲ i t͡ɕ i ɰᵝ a̠ d͡z ẽ̞ ɰ̃ i d e̞ h o̞ s o̞ː s a̠ ɾ e̞ t e̞ i ɾ ɯ̟ᵝ
じじょ	d͡ʑ i ʑ o̞
じじょう	d͡ʑ i ʑ o̞ː
じせいしん	d͡ʑ i s e̞ː ɕ ĩ ɴ
じったいきょう	d͡ʑ i t̚ t a̠ i kʲ o̞ː
じつげん	d͡ʑ i t͡s ɨᵝ ɡ ẽ̞ ɴ
じてんしゃどう	d͡ʑ i t ẽ̞ ɰ̃ ɕ a̠ d o̞ː
じどうしょうじゅう	d͡ʑ i d o̞ː ɕ o̞ː ʑ ɨᵝː
じめん	d͡ʑ i m ẽ̞ ɴ
じゅうきゅう	d͡ʑ ɨᵝː kʲ ɨᵝː
じゅきょう	d͡ʑ ɨᵝ kʲ o̞ː
じゅくみん	d͡ʑ ɨᵝ k ɯ̟ᵝ mʲ ĩ ɴ
じゅんなん	d͡ʑ ɨ̃ᵝ nː ã̠ ɴ
じゆうしゅぎ	d͡ʑ i j ɯ̟ᵝː ɕ ɨᵝ ɡʲ i
じょうまえや	d͡ʑ o̞ː m a̠ e̞ j a̠
じょうようかんじ	d͡ʑ o̞ː j o̞ː k ã̠ ɲ̟ d͡ʑ i
じりん	d͡ʑ i ɾʲ ĩ ɴ
すいこう	s ɨᵝ i k o̞ː
すいこむ	s ɨᵝ i k o̞ m ɯ̟ᵝ
すいはんき	s ɨᵝ i h ã̠ ŋʲ kʲ i
すいもんがく	s ɨᵝ i m õ̞ ŋ ɡ a̠ k ɯ̟ᵝ
すがたをけす	s ɨᵝ ɡ a̠ t a̠ o̞ k e̞ s ɨᵝ
すくむ	s ɨ̥ᵝ k ɯ̟ᵝ m ɯ̟ᵝ
すけひろ	s ɨᵝ k e̞ ç i ɾ o̞
すげ	s ɨᵝ ɡ e̞
すすめ	s ɨᵝ s ɨᵝ m e̞
すっぱい	s ɨ̥ᵝ p̚ p a̠ i
すてる	s ɨᵝ t e̞ ɾ ɯ̟ᵝ
すな	s ɨᵝ n a̠
すなねずみ	s ɨᵝ n a̠ n e̞ z ɨᵝ mʲ i
すなば	s ɨᵝ n a̠ b a̠
すね	s ɨᵝ n e̞
すばしこい	s ɨᵝ b a̠ ɕ i̥ k o̞ i
すまた	s ɨᵝ m a̠ t a̠
ずるい	d͡z ɨᵝ ɾ ɯ̟ᵝ i
ずろう	d͡z ɨᵝ ɾ o̞ː
せいこつ	s e̞ː k o̞ t͡s ɨᵝ
せいぜんせつ	s e̞ː z ẽ̞ ɰ̃ s e̞ t͡s ɨᵝ
せいとうか	s e̞ː t o̞ː k a̠
せいねん	s e̞ː n ẽ̞ ɴ
せいようわさび	s e̞ː j o̞ː ɰᵝ a̠ s a̠ bʲ i
せがむ	s e̞ ɡ a̠ m ɯ̟ᵝ
せきにんかん	s e̞ k i n ĩ ŋ k ã̠ ɴ
せっけいず	s e̞ k̚ k e̞ː z ɨᵝ
せつぞく	s e̞ t͡s ɨᵝ z o̞ k ɯ̟ᵝ
せびれ	s e̞ bʲ i ɾ e̞
せんけいけいかくほう	s ẽ̞ ŋ k e̞ː k e̞ː k a̠ k ɯ̟ᵝ h o̞ː
せんげん	s ẽ̞ ŋ ɡ ẽ̞ ɴ
せんじょう	s ẽ̞ ɲ̟ d͡ʑ o̞ː
せんすいかん	s ẽ̞ ɰ̃ s ɨᵝ i k ã̠ ɴ
せんてつ	s ẽ̞ n t e̞ t͡s ɨᵝ
せんてんてき	s ẽ̞ n t ẽ̞ n t e̞ kʲ i
せんど	s ẽ̞ n d o̞
ぜんたいしゅぎ	d͡z ẽ̞ n t a̠ i ɕ ɨᵝ ɡʲ i
ぜんぶ	d͡z ẽ̞ m b ɯ̟ᵝ
そうかいそうでん	s o̞ː k a̠ i s o̞ː d ẽ̞ ɴ
そうぎや	s o̞ː ɡʲ i j a̠
そうじゅうし	s o̞ː ʑ ɨᵝː ɕ i
そうたいおんかん	d͡z e̞ t̚ t a̠ i õ̞ ŋ k ã̠ ɴ
そうわ	s o̞ː ɰᵝ a̠
そぐ	s o̞ ɡ ɯ̟ᵝ
そご	s o̞ ɡ o̞
そそう	s o̞ s o̞ː
そぞろ	s o̞ z o̞ ɾ o̞
そっぽ	s o̞ p̚ p o̞
そつぎょうしけん	s o̞ t͡s ɨᵝ ɡʲ o̞ː ɕ i k ẽ̞ ɴ
そぼろ	s o̞ b o̞ ɾ o̞
そんがい	s õ̞ ŋ ɡ a̠ i
そんご	s õ̞ ŋ ɡ o̞
そんしつ	s õ̞ ɰ̃ ɕ i t͡s ɨᵝ
そんしょく	s õ̞ ɰ̃ ɕ o̞ k ɯ̟ᵝ
そんらく	s õ̞ n ɾ a̠ k ɯ̟ᵝ
ぞうご	d͡z o̞ː ɡ o̞
ぞろぞろ	d͡z o̞ ɾ o̞ z o̞ ɾ o̞
たいいくずわり	t a̠ i i k ɯ̟ᵝ z ɨᵝ ɰᵝ a̠ ɾʲ i
たいきょ	t a̠ i kʲ o̞
たいせきがん	t a̠ i s e̞ kʲ i ɡ ã̠ ɴ
たいはい	t a̠ i h a̠ i
たいばつ	t a̠ i b a̠ t͡s ɨᵝ
たいよう	t a̠ i j o̞ː
たぎる	t a̠ ɡʲ i ɾ ɯ̟ᵝ
たこ	t a̠ k o̞
たす	t a̠ s ɨᵝ
たずねる	t a̠ z ɨᵝ n e̞ ɾ ɯ̟ᵝ
たたり	t a̠ t a̠ ɾʲ i
ただよう	t a̠ d a̠ j o̞ ɯ̟ᵝ
たちいる	t a̠ t͡ɕ iː ɾ ɯ̟ᵝ
たちよる	t a̠ t͡ɕ i j o̞ ɾ ɯ̟ᵝ
たづな	t a̠ z ɨᵝ n a̠
ためし	t a̠ m e̞ ɕ i
ためらう	t a̠ m e̞ ɾ a̠ ɯ̟ᵝ
たよる	t a̠ j o̞ ɾ ɯ̟ᵝ
たんぽぽ	t ã̠ m p o̞ p o̞
たんまつ	t ã̠ mː a̠ t͡s ɨᵝ
だいえいていこく	d a̠ i e̞ː t e̞ː k o̞ k ɯ̟ᵝ
だいえつ	d a̠ i e̞ t͡s ɨᵝ
だつじ	d a̠ t͡s ɨᵝ ʑ i
だん	d ã̠ ɴ
ちくでんき	t͡ɕ i k ɯ̟̊ᵝ d ẽ̞ ŋʲ kʲ i
ちしき	t͡ɕ i ɕ i̥ kʲ i
ちしまれっとう	t͡ɕ i ɕ i m a̠ ɾ e̞ t̚ t o̞ː
ちず	t͡ɕ i z ɨᵝ
ちっちゃい	t͡ɕ i̥ t̚ t͡ɕ a̠ i
ちびっこ	t͡ɕ i bʲ i k̚ k o̞
ちゅうきえいご	t͡ɕ ɨᵝː kʲ i e̞ː ɡ o̞
ちゅうごく	t͡ɕ ɨᵝː ɡ o̞ k ɯ̟ᵝ
ちょうじかん	t͡ɕ o̞ː ʑ i k ã̠ ɴ
ちょうど	t͡ɕ o̞ː d o̞
ちょうへん	t͡ɕ o̞ː h ẽ̞ ɴ
ちょっかく	t͡ɕ o̞ k̚ k a̠ k ɯ̟ᵝ
ちらつく	t͡ɕ i ɾ a̠ t͡s ɨᵝ k ɯ̟ᵝ
ちり	t͡ɕ i ɾʲ i
ちりょう	t͡ɕ i ɾʲ o̞ː
ちんあなご	t͡ɕ ĩ ɰ̃ a̠ n a̠ ɡ o̞
ついじゅう	t͡s ɨᵝ i ʑ ɨᵝː
つかる	t͡s ɨᵝ k a̠ ɾ ɯ̟ᵝ
つがう	t͡s ɨᵝ ɡ a̠ ɯ̟ᵝ
つきとめる	t͡s ɨᵝ kʲ i t o̞ m e̞ ɾ ɯ̟ᵝ
つくりだす	t͡s ɨᵝ k ɯ̟ᵝ ɾʲ i d a̠ s ɨᵝ
つげる	t͡s ɨᵝ ɡ e̞ ɾ ɯ̟ᵝ
つちぐも	t͡s ɨ̥ᵝ t͡ɕ i ɡ ɯ̟ᵝ m o̞
つなぐ	t͡s ɨᵝ n a̠ ɡ ɯ̟ᵝ
つのる	t͡s ɨᵝ n o̞ ɾ ɯ̟ᵝ
つみぶかい	t͡s ɨᵝ mʲ i b ɯ̟ᵝ k a̠ i
つりばしこうか	t͡s ɨᵝ ɾʲ i b a̠ ɕ i k o̞ː k a̠
ていじゅう	t e̞ː ʑ ɨᵝː
ていぞく	t e̞ː z o̞ k ɯ̟ᵝ
ていれ	t e̞ i ɾ e̞
てきおう	t e̞ kʲ i o̞ː
てきよう	t e̞ kʲ i j o̞ː
てさき	t e̞ s a̠ kʲ i
てぬかり	t e̞ n ɯ̟ᵝ k a̠ ɾʲ i
てぬぐい	t e̞ n ɯ̟ᵝ ɡ ɯ̟ᵝ i
てみじか	t e̞ mʲ i ʑ i k a̠
てらう	t e̞ ɾ a̠ ɯ̟ᵝ
てん	t ẽ̞ ɴ
てんとうむし	t ẽ̞ n t o̞ː m ɯ̟ᵝ ɕ i
てんない	t ẽ̞ nː a̠ i
でじま	d e̞ ʑ i m a̠
とぃ	t ɰᵝ i
とい	t o̞ i
とうあん	t o̞ː ã̠ ɴ
とうしつ	t o̞ː ɕ i t͡s ɨᵝ
とうちょうき	t o̞ː t͡ɕ o̞ː kʲ i
とうひょうようし	t o̞ː ç o̞ː j o̞ː ɕ i
とうべん	t o̞ː b ẽ̞ ɴ
とおる	t o̞ː ɾ ɯ̟ᵝ
ときおり	t o̞ kʲ i o̞ ɾʲ i
ときどき	t o̞ kʲ i d o̞ kʲ i
とくしん	t o̞ k ɯ̟ᵝ ɕ ĩ ɴ
とくに	t o̞ k ɯ̟ᵝ ɲ̟ i
とくはいん	t o̞ k ɯ̟ᵝ h a̠ ĩ ɴ
とけつ	t o̞ k e̞ t͡s ɨᵝ
とざんしゃ	t o̞ z ã̠ ɰ̃ ɕ a̠
とそう	t o̞ s o̞ː
とつくに	t o̞ t͡s ɨᵝ k ɯ̟ᵝ ɲ̟ i
とても	t o̞ t e̞ m o̞
とどろく	t o̞ d o̞ ɾ o̞ k ɯ̟ᵝ
とばしきじ	t o̞ b a̠ ɕ i kʲ i ʑ i
とふざい	t o̞ ɸ ɯ̟ᵝ z a̠ i
とみ	t o̞ mʲ i
ともあれ	t o̞ m o̞ a̠ ɾ e̞
ともがら	t o̞ m o̞ ɡ a̠ ɾ a̠
ともだち	t o̞ m o̞ d a̠ t͡ɕ i
ともる	t o̞ m o̞ ɾ ɯ̟ᵝ
とりしまりやくかい	t o̞ ɾʲ i ɕ i m a̠ ɾʲ i j a̠ k ɯ̟̊ᵝ k a̠ i
どうぐ	d o̞ː ɡ ɯ̟ᵝ
どうしゅつ	d o̞ː ɕ ɨᵝ t͡s ɨᵝ
どうとう	d o̞ː t o̞ː
どうぶつゆらいかんせんしょう	d o̞ː b ɯ̟ᵝ t͡s ɨᵝ j ɯ̟ᵝ ɾ a̠ i k ã̠ ɰ̃ s ẽ̞ ɰ̃ ɕ o̞ː
どうみょう	d o̞ː mʲ o̞ː
どうも	d o̞ː m o̞
どく	d o̞ k ɯ̟ᵝ
どくさつ	d o̞ k ɯ̟̊ᵝ s a̠ t͡s ɨᵝ
どだい	d o̞ d a̠ i
どっこいどっこい	d o̞ k̚ k o̞ i d o̞ k̚ k o̞ i
どべい	d o̞ b e̞ː
どんぶり	d õ̞ m b ɯ̟ᵝ ɾʲ i
ない	n a̠ i
ないじつ	n a̠ i ʑ i t͡s ɨᵝ
ないよう	n a̠ i j o̞ː
なか	n a̠ k a̠
なかだち	n a̠ k a̠ d a̠ t͡ɕ i
ながら	n a̠ ɡ a̠ ɾ a̠
ながれだす	n a̠ ɡ a̠ ɾ e̞ d a̠ s ɨᵝ
なげなわ	n a̠ ɡ e̞ n a̠ ɰᵝ a̠
なずき	n a̠ z ɨᵝ kʲ i
なぞなぞ	n a̠ z o̞ n a̠ z o̞
なつ	n a̠ t͡s ɨᵝ
ななめ	n a̠ n a̠ m e̞
なにげない	n a̠ ɲ̟ i ɡ e̞ n a̠ i
なべ	n a̠ b e̞
なま	n a̠ m a̠
なまごみ	n a̠ m a̠ ɡ o̞ mʲ i
なまみ	n a̠ m a̠ mʲ i
なみだがち	n a̠ mʲ i d a̠ ɡ a̠ t͡ɕ i
なやましい	n a̠ j a̠ m a̠ ɕ iː
なら	n a̠ ɾ a̠
ならく	n a̠ ɾ a̠ k ɯ̟ᵝ
なりぎん	n a̠ ɾʲ i ɡʲ ĩ ɴ
なるほど	n a̠ ɾ ɯ̟ᵝ h o̞ d o̞
なんごく	n ã̠ ŋ ɡ o̞ k ɯ̟ᵝ
なんで	n ã̠ n d e̞
なんなら	n ã̠ nː a̠ ɾ a̠
なんぼく	n ã̠ m b o̞ k ɯ̟ᵝ
なんぼくせんそう	n ã̠ m b o̞ k ɯ̟ᵝ s ẽ̞ ɰ̃ s o̞ː
にがて	ɲ̟ i ɡ a̠ t e̞
にぎり	ɲ̟ i ɡʲ i ɾʲ i
にくしん	ɲ̟ i k ɯ̟̊ᵝ ɕ ĩ ɴ
にじめい	ɲ̟ i ʑ i m e̞ː
にだい	ɲ̟ i d a̠ i
にっきちょう	ɲ̟ i k̚ʲ kʲ i t͡ɕ o̞ː
につかわしい	ɲ̟ i t͡s ɨ̥ᵝ k a̠ ɰᵝ a̠ ɕ iː
にほんこく	ɲ̟ i h õ̞ ŋ k o̞ k ɯ̟ᵝ
にほんざる	ɲ̟ i h õ̞ n d͡z a̠ ɾ ɯ̟ᵝ
にほんしゅ	ɲ̟ i h õ̞ ɰ̃ ɕ ɨᵝ
にもかかわらず	ɲ̟ i m o̞ k a̠ k a̠ ɰᵝ a̠ ɾ a̠ z ɨᵝ
にやく	ɲ̟ i j a̠ k ɯ̟ᵝ
にょうどうきゅうせん	ɲ̟ o̞ː d o̞ː kʲ ɨᵝː s ẽ̞ ɴ
にるい	ɲ̟ i ɾ ɯ̟ᵝ i
にんき	ɲ̟ ĩ ŋʲ kʲ i
にんじゃ	ɲ̟ ĩ ɲ̟ d͡ʑ a̠
にんじん	ɲ̟ ĩ ɲ̟ d͡ʑ ĩ ɴ
にんむ	ɲ̟ ĩ mː ɯ̟ᵝ
ぬぐ	n ɯ̟ᵝ ɡ ɯ̟ᵝ
ぬらす	n ɯ̟ᵝ ɾ a̠ s ɨᵝ
ねかす	n e̞ k a̠ s ɨᵝ
ねこすい	n e̞ k o̞ s ɨᵝ i
ねつぼうそう	n e̞ t͡s ɨᵝ b o̞ː s o̞ː
ねむい	n e̞ m ɯ̟ᵝ i
ねむけ	n e̞ m ɯ̟ᵝ k e̞
ねんかん	n ẽ̞ ŋ k ã̠ ɴ
ねんしゅつ	n ẽ̞ ɰ̃ ɕ ɨᵝ t͡s ɨᵝ
ねんじゅう	n ẽ̞ ɲ̟ d͡ʑ ɨᵝː
ねんぴ	n ẽ̞ m pʲ i
のうじょう	n o̞ː ʑ o̞ː
のうずい	n o̞ː z ɨᵝ i
のうりょく	n o̞ː ɾʲ o̞ k ɯ̟ᵝ
のがす	n o̞ ɡ a̠ s ɨᵝ
のこる	n o̞ k o̞ ɾ ɯ̟ᵝ
のどか	n o̞ d o̞ k a̠
のばす	n o̞ b a̠ s ɨᵝ
のびる	n o̞ bʲ i ɾ ɯ̟ᵝ
のみこみ	n o̞ mʲ i k o̞ mʲ i
のりかえ	n o̞ ɾʲ i k a̠ e̞
のろい	n o̞ ɾ o̞ i
はいいろぎつね	h a̠ i i ɾ o̞ ɡʲ i t͡s ɨᵝ n e̞
はいえき	h a̠ i e̞ kʲ i
はおり	h a̠ o̞ ɾʲ i
はかく	h a̠ k a̠ k ɯ̟ᵝ
はかた	h a̠ k a̠ t a̠
はがね	h a̠ ɡ a̠ n e̞
はきけ	h a̠ kʲ i̥ k e̞
はぎ	h a̠ ɡʲ i
はくしん	h a̠ k ɯ̟ᵝ ɕ ĩ ɴ
はくらいひん	h a̠ k ɯ̟ᵝ ɾ a̠ i ç ĩ ɴ
はしりまわる	h a̠ ɕ i ɾʲ i m a̠ ɰᵝ a̠ ɾ ɯ̟ᵝ
はじらう	h a̠ ʑ i ɾ a̠ ɯ̟ᵝ
はせさんじる	h a̠ s e̞ s ã̠ ɲ̟ d͡ʑ i ɾ ɯ̟ᵝ
はたけ	h a̠ t a̠ k e̞
はたらく	h a̠ t a̠ ɾ a̠ k ɯ̟ᵝ
はだでしる	h a̠ d a̠ d e̞ ɕ i ɾ ɯ̟ᵝ
はちぶんぎざ	h a̠ t͡ɕ i b ɯ̟̃ᵝ ŋʲ ɡʲ i z a̠
はっきり	h a̠ k̚ʲ kʲ i ɾʲ i
はったつしょうがい	h a̠ t̚ t a̠ t͡s ɨᵝ ɕ o̞ː ɡ a̠ i
はつか	h a̠ t͡s ɨ̥ᵝ k a̠
はつがんぶっしつ	h a̠ t͡s ɨᵝ ɡ ã̠ m b ɯ̟ᵝ ɕː i t͡s ɨᵝ
はつれい	h a̠ t͡s ɨᵝ ɾ e̞ː
はつわ	h a̠ t͡s ɨᵝ ɰᵝ a̠
はづき	h a̠ z ɨᵝ kʲ i
はなはだしい	h a̠ n a̠ h a̠ d a̠ ɕ i i
はめ	h a̠ m e̞
はもん	h a̠ m õ̞ ɴ
はやべん	h a̠ j a̠ b ẽ̞ ɴ
はやめる	h a̠ j a̠ m e̞ ɾ ɯ̟ᵝ
はらはら	h a̠ ɾ a̠ h a̠ ɾ a̠
はれる	h a̠ ɾ e̞ ɾ ɯ̟ᵝ
はろう	h a̠ ɾ o̞ː
はん	h ã̠ ɴ
はんきょうていい	h ã̠ ŋʲ kʲ o̞ː t e̞ː i
はんぎご	h ã̠ ŋʲ ɡʲ i ɡ o̞
はんしん	h ã̠ ɰ̃ ɕ ĩ ɴ
ばきゃく	b a̠ kʲ a̠ k ɯ̟ᵝ
ばくえき	b a̠ k ɯ̟ᵝ e̞ kʲ i
ばたんきゅう	b a̠ t ã̠ ŋʲ kʲ ɨᵝː
ばっする	b a̠ sː ɯ̟ᵝ ɾ ɯ̟ᵝ
ばにゅう	b a̠ ɲ̟ ɯ̟ᵝː
ばんねん	b ã̠ nː ẽ̞ ɴ
ぱくり	p a̠ k ɯ̟ᵝ ɾʲ i
ぱらぱら	p a̠ ɾ a̠ p a̠ ɾ a̠
ひがんばな	ç i ɡ ã̠ m b a̠ n a̠
ひきさく	ç i kʲ i s a̠ k ɯ̟ᵝ
ひぐま	ç i ɡ ɯ̟ᵝ m a̠
ひさいしゃ	ç i s a̠ i ɕ a̠
ひさく	ç i s a̠ k ɯ̟ᵝ
ひじょうかいだん	ç i ʑ o̞ː k a̠ i d ã̠ ɴ
ひそめる	ç i s o̞ m e̞ ɾ ɯ̟ᵝ
ひちょう	ç i t͡ɕ o̞ː
ひでん	ç i d ẽ̞ ɴ
ひとそろい	ç i̥ t o̞ s o̞ ɾ o̞ i
ひどい	ç i d o̞ i
ひどう	ç i d o̞ː
ひふびょう	ç i ɸ ɯ̟ᵝ bʲ o̞ː
ひゃくぶんりつ	ç a̠ k ɯ̟ᵝ b ɯ̟̃ᵝ n ɾʲ i t͡s ɨᵝ
ひょうてん	ç o̞ː t ẽ̞ ɴ
ひよけ	ç i j o̞ k e̞
ひらま	ç i ɾ a̠ m a̠
ひるま	ç i ɾ ɯ̟ᵝ m a̠
ひろふみ	ç i ɾ o̞ ɸ ɯ̟ᵝ mʲ i
ひろめる	ç i ɾ o̞ m e̞ ɾ ɯ̟ᵝ
ひんやり	ç ĩ ɰ̃ j a̠ ɾʲ i
びき	bʲ i kʲ i
びしょく	bʲ i ɕ o̞ k ɯ̟ᵝ
びちく	bʲ i t͡ɕ i k ɯ̟ᵝ
びゃくだんゆ	bʲ a̠ k ɯ̟ᵝ d ã̠ ɰ̃ j ɯ̟ᵝ
びわ	bʲ i ɰᵝ a̠
びん	bʲ ĩ ɴ
ふえる	ɸ ɯ̟ᵝ e̞ ɾ ɯ̟ᵝ
ふかかちぜい	ɸ ɯ̟̊ᵝ k a̠ k a̠ t͡ɕ i z e̞ː
ふくい	ɸ ɯ̟ᵝ k ɯ̟ᵝ i
ふしょう	ɸ ɯ̟ᵝ ɕ o̞ː
ふじゅん	ɸ ɯ̟ᵝ ʑ ɨ̃ᵝ ɴ
ふじゆう	ɸ ɯ̟ᵝ ʑ i j ɯ̟ᵝː
ふじん	ɸ ɯ̟ᵝ ʑ ĩ ɴ
ふせぐ	ɸ ɯ̟̊ᵝ s e̞ ɡ ɯ̟ᵝ
ふだんそう	ɸ ɯ̟ᵝ d ã̠ ɰ̃ s o̞ː
ふっかつ	ɸ ɯ̟̊ᵝ k̚ k a̠ t͡s ɨᵝ
ふみづき	ɸ ɯ̟ᵝ mʲ i z ɨᵝ kʲ i
ふめいかく	ɸ ɯ̟ᵝ m e̞ː k a̠ k ɯ̟ᵝ
ふもと	ɸ ɯ̟ᵝ m o̞ t o̞
ふゆきとどき	ɸ ɯ̟ᵝ j ɯ̟ᵝ kʲ i t o̞ d o̞ kʲ i
ふよ	ɸ ɯ̟ᵝ j o̞
ふれあう	ɸ ɯ̟ᵝ ɾ e̞ a̠ ɯ̟ᵝ
ぶっけん	b ɯ̟ᵝ k̚ k ẽ̞ ɴ
ぶっせつ	b ɯ̟ᵝ sː e̞ t͡s ɨᵝ
へいか	h e̞ː k a̠
へいかい	h e̞ː k a̠ i
へた	h e̞ t a̠
へや	h e̞ j a̠
へんしゅう	h ẽ̞ ɰ̃ ɕ ɨᵝː
へんたいかんぶん	h ẽ̞ n t a̠ i k ã̠ m b ɯ̟̃ᵝ ɴ
べいこく	b e̞ː k o̞ k ɯ̟ᵝ
べんとうばこ	b ẽ̞ n t o̞ː b a̠ k o̞
ぺらぺら	p e̞ ɾ a̠ p e̞ ɾ a̠
ほうい	h o̞ː i
ほうすいほう	h o̞ː s ɨᵝ i h o̞ː
ほうまん	h o̞ː m ã̠ ɴ
ほおづえ	h o̞ː z ɨᵝ e̞
ほこり	h o̞ k o̞ ɾʲ i
