ほしざめ	h o̞ ɕ i z a̠ m e̞
ほぜい	h o̞ z e̞ː
ほたい	h o̞ t a̠ i
ほっきょくせい	h o̞ k̚ʲ kʲ o̞ k ɯ̟ᵝ s e̞ː
ほつれる	h o̞ t͡s ɨᵝ ɾ e̞ ɾ ɯ̟ᵝ
ほとぼり	h o̞ t o̞ b o̞ ɾʲ i
ほんわか	h õ̞ ɰ̃ ɰᵝ a̠ k a̠
ぼうちょうざい	b o̞ː t͡ɕ o̞ː z a̠ i
ぼうびき	b o̞ː bʲ i kʲ i
ぼうろう	b o̞ː ɾ o̞ː
ぼけ	b o̞ k e̞
ぼせん	b o̞ s ẽ̞ ɴ
ぼっちゃん	b o̞ t̚ t͡ɕ ã̠ ɴ
まか	m a̠ k a̠
まがたま	m a̠ ɡ a̠ t a̠ m a̠
まきす	m a̠ kʲ i s ɨᵝ
まけ	m a̠ k e̞
まざる	m a̠ z a̠ ɾ ɯ̟ᵝ
まじき	m a̠ ʑ i kʲ i
まじわり	m a̠ ʑ i ɰᵝ a̠ ɾʲ i
またたび	m a̠ t a̠ t a̠ bʲ i
まちどおしい	m a̠ t͡ɕ i d o̞ː ɕ iː
まちまち	m a̠ t͡ɕ i m a̠ t͡ɕ i
まっくら	m a̠ k̚ k ɯ̟ᵝ ɾ a̠
まっこう	m a̠ k̚ k o̞ː
まつげ	m a̠ t͡s ɨᵝ ɡ e̞
まつやにあぶら	m a̠ t͡s ɨᵝ j a̠ ɲ̟ i a̠ b ɯ̟ᵝ ɾ a̠
まどい	m a̠ d o̞ i
まどうし	m a̠ d o̞ː ɕ i
まにゅう	m a̠ ɲ̟ ɯ̟ᵝː
まほし	m a̠ h o̞ ɕ i
まるがお	m a̠ ɾ ɯ̟ᵝ ɡ a̠ o̞
まんえい	m ã̠ ɰ̃ e̞ː
まんよう	m ã̠ ɰ̃ j o̞ː
みあきる	mʲ i a̠ kʲ i ɾ ɯ̟ᵝ
みえみえ	mʲ i e̞ mʲ i e̞
みおさめ	mʲ i o̞ s a̠ m e̞
みおぼえる	mʲ i o̞ b o̞ e̞ ɾ ɯ̟ᵝ
みかける	mʲ i k a̠ k e̞ ɾ ɯ̟ᵝ
みごろし	mʲ i ɡ o̞ ɾ o̞ ɕ i
みせ	mʲ i s e̞
みたす	mʲ i t a̠ s ɨᵝ
みな	mʲ i n a̠
みなみ	mʲ i n a̠ mʲ i
みぶん	mʲ i b ɯ̟̃ᵝ ɴ
みまいきん	mʲ i m a̠ i kʲ ĩ ɴ
みやの	mʲ i j a̠ n o̞
みわたす	mʲ i ɰᵝ a̠ t a̠ s ɨᵝ
むいしきてき	m ɯ̟ᵝ i ɕ i kʲ i t e̞ kʲ i
むかえうつ	m ɯ̟ᵝ k a̠ e̞ ɯ̟ᵝ t͡s ɨᵝ
むかつく	m ɯ̟ᵝ k a̠ t͡s ɨ̥ᵝ k ɯ̟ᵝ
むく	m ɯ̟ᵝ k ɯ̟ᵝ
むし	m ɯ̟ᵝ ɕ i
むしる	m ɯ̟ᵝ ɕ i ɾ ɯ̟ᵝ
むずかしい	m ɯ̟ᵝ z ɨᵝ k a̠ ɕ i i
むだげ	m ɯ̟ᵝ d a̠ ɡ e̞
むやみ	m ɯ̟ᵝ j a̠ mʲ i
むらまつ	m ɯ̟ᵝ ɾ a̠ m a̠ t͡s ɨᵝ
めあて	m e̞ a̠ t e̞
めいせきむ	m e̞ː s e̞ kʲ i m ɯ̟ᵝ
めがない	m e̞ ɡ a̠ n a̠ i
めざましい	m e̞ z a̠ m a̠ ɕ iː
めだまやき	m e̞ d a̠ m a̠ j a̠ kʲ i
もうかる	m o̞ː k a̠ ɾ ɯ̟ᵝ
もうこ	m o̞ː k o̞
もうし	m o̞ː ɕ i
もえ	m o̞ e̞
もぎり	m o̞ ɡʲ i ɾʲ i
もぐりこむ	m o̞ ɡ ɯ̟ᵝ ɾʲ i k o̞ m ɯ̟ᵝ
もしかして	m o̞ ɕ i k a̠ ɕ i t e̞
もしもし	m o̞ ɕ i m o̞ ɕ i̥
もちあわせる	m o̞ t͡ɕ i a̠ ɰᵝ a̠ s e̞ ɾ ɯ̟ᵝ
もちきたる	m o̞ t͡ɕ i kʲ i t a̠ ɾ ɯ̟ᵝ
もちさる	m o̞ t͡ɕ i s a̠ ɾ ɯ̟ᵝ
もちのろん	m o̞ t͡ɕ i n o̞ ɾ õ̞ ɴ
もっともらしい	m o̞ t̚ t o̞ m o̞ ɾ a̠ ɕ iː
もてあそぶ	m o̞ t e̞ a̠ s o̞ b ɯ̟ᵝ
もとる	m o̞ t o̞ ɾ ɯ̟ᵝ
ものさし	m o̞ n o̞ s a̠ ɕ i
ももか	m o̞ m o̞ k a̠
もろい	m o̞ ɾ o̞ i
もん	m õ̞ ɴ
やかん	j a̠ k ã̠ ɴ
やさい	j a̠ s a̠ i
やすむ	j a̠ s ɨᵝ m ɯ̟ᵝ
やすめる	j a̠ s ɨᵝ m e̞ ɾ ɯ̟ᵝ
やすやど	j a̠ s ɨᵝ j a̠ d o̞
やまい	j a̠ m a̠ i
やまいだれ	j a̠ m a̠ i d a̠ ɾ e̞
やまつなみ	j a̠ m a̠ t͡s ɨᵝ n a̠ mʲ i
やむ	j a̠ m ɯ̟ᵝ
ゆうかい	j ɯ̟ᵝː k a̠ i
ゆうせいがく	j ɯ̟ᵝː s e̞ː ɡ a̠ k ɯ̟ᵝ
ゆうれいやしき	j ɯ̟ᵝː ɾ e̞ː j a̠ ɕ i̥ kʲ i
ゆかり	j ɯ̟ᵝ k a̠ ɾʲ i
ゆめうつつ	j ɯ̟ᵝ m e̞ ɯ̟ᵝ t͡s ɨᵝ t͡s ɨᵝ
ようかい	j o̞ː k a̠ i
ようやく	j o̞ː j a̠ k ɯ̟ᵝ
よこぶえ	j o̞ k o̞ b ɯ̟ᵝ e̞
よじせいく	j o̞ ʑ i s e̞ː k ɯ̟̊ᵝ
よそう	j o̞ s o̞ː
よそもの	j o̞ s o̞ m o̞ n o̞
よわねをはく	j o̞ ɰᵝ a̠ n e̞ o̞ h a̠ k ɯ̟ᵝ
らくさん	ɾ a̠ k ɯ̟ᵝ s ã̠ ɴ
らくだい	ɾ a̠ k ɯ̟ᵝ d a̠ i
らくてんてき	ɾ a̠ k ɯ̟ᵝ t ẽ̞ n t e̞ kʲ i
らてい	ɾ a̠ t e̞ː
りがく	ɾʲ i ɡ a̠ k ɯ̟ᵝ
りくつづき	ɾʲ i k ɯ̟̊ᵝ t͡s ɨᵝ z ɨᵝ kʲ i
りさん	ɾʲ i s ã̠ ɴ
りっきょう	ɾʲ i k̚ʲ kʲ o̞ː
りっとう	ɾʲ i t̚ t o̞ː
りっぽうたい	ɾʲ i p̚ p o̞ː t a̠ i
りゅうし	ɾʲ ɨᵝː ɕ i
りょうしつ	ɾʲ o̞ː ɕ i t͡s ɨᵝ
りょうり	ɾʲ o̞ː ɾʲ i
りよう	ɾʲ i j o̞ː
るいさん	ɾ ɯ̟ᵝ i s ã̠ ɴ
れつあく	ɾ e̞ t͡s ɨᵝ a̠ k ɯ̟ᵝ
れんご	ɾ ẽ̞ ŋ ɡ o̞
れんしゅうきょく	ɾ ẽ̞ ɰ̃ ɕ ɨᵝː kʲ o̞ k ɯ̟ᵝ
れんち	ɾ ẽ̞ ɲ̟ t͡ɕ i
ろうきゅう	ɾ o̞ː kʲ ɨᵝː
ろうほう	ɾ o̞ː h o̞ː
ろばん	ɾ o̞ b ã̠ ɴ
ろんそう	ɾ õ̞ ɰ̃ s o̞ː
わけあたえる	ɰᵝ a̠ k e̞ a̠ t a̠ e̞ ɾ ɯ̟ᵝ
わごん	ɰᵝ a̠ ɡ õ̞ ɴ
わっぱ	ɰᵝ a̠ p̚ p a̠
わめい	ɰᵝ a̠ m e̞ː
われら	ɰᵝ a̠ ɾ e̞ ɾ a̠
