ئائىت	ʔ ɑ ʔ i t
ئائىلە	ʔ ɑ ʔ i l ɛ
ئابدال	ʔ ɑ b d ɑ l
ئابدۇلئەھەد	ʔ ɑ b d u l ʔ ɛ h ɛ t
ئابدۇلفەتتاھ	ʔ ɑ b d u l p ɛ t t ɑ h
ئاتا	ʔ ɑ t ɑ
ئاتلىقلار	ʔ ɑ t l i q l ɑ r
ئاتىماق	ʔ ɑ t i m ɑ q
ئاجىز	ʔ ɑ d͡ʒ i z
ئاخىرەت	ʔ ɑ χ i r ɛ t
ئادەت	ʔ ɑ d ɛ t
ئادەتتە	ʔ ɑ d ɛ t t ɛ
ئارزۇ	ʔ ɑ r z u
ئارسىن	ʔ ɑ r s i n
ئارىسىدا	ʔ ɑ r i s i d ɑ
ئازات	ʔ ɑ z ɑ t
ئازاپ	ʔ ɑ z ɑ p
ئازوت	ʔ ɑ z o t
ئاساس	ʔ ɑ s ɑ s
ئاستاتىن	ʔ ɑ s t ɑ t i n
ئاسفالت	ʔ ɑ s p ɑ l t
ئاسماق	ʔ ɑ s m ɑ q
ئاشقازان	ʔ ɑ ʃ q ɑ z ɑ n
ئاشيان	ʔ ɑ ʃ j ɑ n
ئاشپەز	ʔ ɑ ʃ p ɛ z
ئافغان	ʔ ɑ p ʁ ɑ n
ئاكا	ʔ ɑ k ɑ
ئالامەت	ʔ ɑ l ɑ m ɛ t
ئالاڭ	ʔ ɑ l ɑ ŋ
ئالتۇن	ʔ ɑ l t u n
ئالتە	ʔ ɑ l t ɛ
ئالما	ʔ ɑ l m ɑ
ئالماس	ʔ ɑ l m ɑ s
ئالپ	ʔ ɑ l p
ئامال	ʔ ɑ m ɑ l
ئامانەت	ʔ ɑ m ɑ n ɛ t
ئاياز	ʔ ɑ j ɑ z
ئاياغلار	ʔ ɑ j ɑ ʁ l ɑ r
ئاياقلار	ʔ ɑ j ɑ q l ɑ r
ئايران	ʔ ɑ j r ɑ n
ئايغىر	ʔ ɑ j ʁ i r
ئايماق	ʔ ɑ j m ɑ q
ئاپرېل	ʔ ɑ p r e l
ئاپىرىن	ʔ ɑ p i r i n
ئاپىيەت	ʔ ɑ p i j ɛ t
ئاپېلسىن	ʔ ɑ p e l s i n
ئاپەت	ʔ ɑ p ɛ t
ئاچقۇچ	ʔ ɑ t͡ʃ q u t͡ʃ
ئاچماق	ʔ ɑ t͡ʃ m ɑ q
ئاھالە	ʔ ɑ h ɑ l ɛ
ئاۋاز	ʔ ɑ w ɑ z
ئاۋام	ʔ ɑ w ɑ m
ئاۋىئاتسىيە	ʔ ɑ w i ʔ ɑ t s i j ɛ
ئوتتۇز	ʔ o t t u z
ئوتۇن	ʔ o t u n
ئوخشىماق	ʔ o χ ʃ i m ɑ q
ئورتاق	ʔ o r t ɑ q
ئوغا	ʔ o ʁ ɑ
ئوق	ʔ o q
ئوقۇتقۇچى	ʔ o q u t q u t͡ʃ i
ئومۇم	ʔ o m u m
ئومۇمىي	ʔ o m u m i j
ئومۇمىيەت	ʔ o m u m i j ɛ t
ئونىنچى	ʔ o n i n t͡ʃ i
ئىبادەتخانا	ʔ i b ɑ d ɛ t χ ɑ n ɑ
ئىت	ʔ i t
ئىتائەت	ʔ i t ɑ ʔ ɛ t
ئىجات	ʔ i d͡ʒ ɑ t
ئىجتىمائىي	ʔ i d͡ʒ t i m ɑ ʔ i j
ئىجتىمائىيەت	ʔ i d͡ʒ t i m ɑ ʔ i j ɛ t
ئىختىيار	ʔ i χ t i j ɑ r
ئىخلاس	ʔ i χ l ɑ s
ئىس	ʔ i s
ئىستىراھەت	ʔ i s t i r ɑ h ɛ t
ئىستىسنا	ʔ i s t i s n ɑ
ئىستېمال	ʔ i s t e m ɑ l
ئىستېپا	ʔ i s t e p ɑ
ئىسراپ	ʔ i s r ɑ p
ئىسلام	ʔ i s l ɑ m
ئىسلاھات	ʔ i s l ɑ h ɑ t
ئىسيانچى	ʔ i s j ɑ n t͡ʃ i
ئىشغال	ʔ i ʃ ʁ ɑ l
ئىشق	ʔ i ʃ q
ئىشقىلىپ	ʔ i ʃ q i l i p
ئىشىتمەك	ʔ i ʃ i t m ɛ k
ئىشچى	ʔ i ʃ t͡ʃ i
ئىشەك	ʔ i ʃ ɛ k
ئىقلىم	ʔ i q l i m
ئىلاھ	ʔ i l ɑ h
ئىم	ʔ i m
ئىمامەت	ʔ i m ɑ m ɛ t
ئىمكان	ʔ i m k ɑ n
ئىمكانىيەت	ʔ i m k ɑ n i j ɛ t
ئىنسانىيەت	ʔ i n s ɑ n i j ɛ t
ئىنشا	ʔ i n ʃ ɑ
ئىنكار	ʔ i n k ɑ r
ئىنى	ʔ i n i
ئىنەك	ʔ i n ɛ k
ئىيۇل	ʔ i j u l
ئىيۇن	ʔ i j u n
ئىپپەت	ʔ i p p ɛ t
ئىگە	ʔ i ɡ ɛ
ئىگەر	ʔ i ɡ ɛ r
ئۆز	ʔ ø z
ئۆستەڭ	ʔ ø s t ɛ ŋ
ئۆكتەبر	ʔ ø k t ɛ b r
ئۆپكە	ʔ ø p k ɛ
ئۆچ	ʔ ø t͡ʃ
ئۇتۇق	ʔ u t u q
ئۇرۇش	ʔ u r u ʃ
ئۇل	ʔ u l
ئۇلار	ʔ u l ɑ r
ئۇلۇغ	ʔ u l u ʁ
ئۇنىۋېرسىتېت	ʔ u n i w e r s i t e t
ئۇنۋان	ʔ u n w ɑ n
ئۇي	ʔ u j
ئۇيغۇرچە	ʔ u j ʁ u r t͡ʃ ɛ
ئۇيقۇ	ʔ u j q u
ئۇۋا	ʔ u w ɑ
ئۇۋاق	ʔ u w ɑ q
ئۈزۈك	ʔ y z y k
ئۈزۈم	ʔ y z y m
ئۈلپەت	ʔ y l p ɛ t
ئۈچ	ʔ y t͡ʃ
ئېتىراپ	ʔ e t i r ɑ p
ئېتىۋار	ʔ e t i w ɑ r
ئېربىي	ʔ e r b i j
ئېرىمەك	ʔ e r i m ɛ k
ئېكىن	ʔ e k i n
ئېيىق	ʔ e j i q
ئېھتىلام	ʔ e h t i l ɑ m
ئەبەد	ʔ ɛ b ɛ t
ئەتىر	ʔ ɛ t i r
ئەجداد	ʔ ɛ d͡ʒ d ɑ t
ئەجەب	ʔ ɛ d͡ʒ ɛ p
ئەجەم	ʔ ɛ d͡ʒ ɛ m
ئەخلاق	ʔ ɛ χ l ɑ q
ئەخمەت	ʔ ɛ χ m ɛ t
ئەدەپ	ʔ ɛ d ɛ p
ئەردەم	ʔ ɛ r d ɛ m
ئەرز	ʔ ɛ r z
ئەرپە	ʔ ɛ r p ɛ
ئەرۋاھ	ʔ ɛ r w ɑ h
ئەرەب	ʔ ɛ r ɛ p
ئەرەبچە	ʔ ɛ r ɛ b t͡ʃ ɛ
ئەزا	ʔ ɛ z ɑ
ئەسكى	ʔ ɛ s k i
ئەسلى	ʔ ɛ s l i
ئەسلىھە	ʔ ɛ s l i h ɛ
ئەسىر	ʔ ɛ s i r
ئەسەر	ʔ ɛ s ɛ r
ئەقرىبا	ʔ ɛ q r i b ɑ
ئەكس	ʔ ɛ k s
ئەل	ʔ ɛ l
ئەلا	ʔ ɛ l ɑ
ئەلۋەتتە	ʔ ɛ l w ɛ t t ɛ
ئەمما	ʔ ɛ m m ɑ
ئەيب	ʔ ɛ j p
ئەينەن	ʔ ɛ j n ɛ n
ئەيىپ	ʔ ɛ j i p
ئەپسانىۋىي	ʔ ɛ p s ɑ n i w i j
ئەپسۇس	ʔ ɛ p s u s
ئەپسۇن	ʔ ɛ p s u n
ئەپيۈن	ʔ ɛ p j y n
ئەھل	ʔ ɛ h l
ئەھمىيەت	ʔ ɛ h m i j ɛ t
ئەھەد	ʔ ɛ h ɛ t
ئەۋقاپ	ʔ ɛ w q ɑ p
باتارى	b ɑ t ɑ r i
باتىل	b ɑ t i l
باج	b ɑ d͡ʒ
بادام	b ɑ d ɑ m
بارىي	b ɑ r i j
بازار	b ɑ z ɑ r
باقىي	b ɑ q i j
بانا	b ɑ n ɑ
بانداژ	b ɑ n d ɑ ʒ
بايانات	b ɑ j ɑ n ɑ t
بايراق	b ɑ j r ɑ q
بولۇو	b o l u o
بولۇپ	b o l u p
بويسۇندۇرماق	b o j s u n d u r m ɑ q
بويۇن	b o j u n
بىتون	b i t o n
بىدئەت	b i d ʔ ɛ t
بىسمۇت	b i s m u t
بىلەن	b i l ɛ n
بىڭگۇر	b i ŋ ɡ u r
بۆشۈك	b ø ʃ y k
بۆلمەك	b ø l m ɛ k
بۆھران	b ø h r ɑ n
بۇ	b u
بۇت	b u t
بۇتپەرەس	b u t p ɛ r ɛ s
بۇدجېت	b u d d͡ʒ e t
بۇرادەر	b u r ɑ d ɛ r
بۇرۇت	b u r u t
بۇغ	b u ʁ
بۇقا	b u q ɑ
بۇيرۇق	b u j r u q
بېغىر	b e ʁ i r
بېلوك	b e l o k
بېلىقچى	b e l i q t͡ʃ i
بېنزىن	b e n z i n
بەختىيار	b ɛ χ t i j ɑ r
بەخش	b ɛ χ ʃ
بەدەل	b ɛ d ɛ l
بەدەن	b ɛ d ɛ n
بەرمەك	b ɛ r m ɛ k
بەش	b ɛ ʃ
بەلغەم	b ɛ l ʁ ɛ m
بەلكى	b ɛ l k i
بەنسىيۇەن	b ɛ n s i j u ɛ n
بەنسىچۇ	b ɛ n s i t͡ʃ u
بەياز	b ɛ j ɑ z
تارازا	t ɑ r ɑ z ɑ
تازى	t ɑ z i
تاسادىپىي	t ɑ s ɑ d i p i j
تاقەت	t ɑ q ɛ t
تاكسى	t ɑ k s i
تاللىي	t ɑ l l i j
تام	t ɑ m
تاما	t ɑ m ɑ
تاملار	t ɑ m l ɑ r
تاي	t ɑ j
تاۋار	t ɑ w ɑ r
تاۋۇز	t ɑ w u z
تورۇق	t o r u q
توشقان	t o ʃ q ɑ n
توق	t o q
توقسان	t o q s ɑ n
توققۇز	t o q q u z
تولۇق	t o l u q
توننا	t o n n ɑ
توپ	t o p
توپلىماق	t o p l i m ɑ q
توپچى	t o p t͡ʃ i
تىبابەت	t i b ɑ b ɛ t
تىجارەت	t i d͡ʒ ɑ r ɛ t
تىرناق	t i r n ɑ q
تىرىك	t i r i k
تىز	t i z
تىكەن	t i k ɛ n
تىلاۋەت	t i l ɑ w ɛ t
تىللار	t i l l ɑ r
تىلەك	t i l ɛ k
تىمساخ	t i m s ɑ χ
تىياتىر	t i j ɑ t i r
تۆش	t ø ʃ
تۆمۈر	t ø m y r
تۆھمەت	t ø h m ɛ t
تۇت	t u t
تۇخۇم	t u χ u m
تۇز	t u z
تۇزاق	t u z ɑ q
تۇل	t u l
تۈتۈن	t y t y n
تۈر	t y r
تۈمەن	t y m ɛ n
تېتىك	t e t i k
تېخنېتسىي	t e χ n e t s i j
تېربىي	t e r b i j
تېكە	t e k ɛ
تەبدىل	t ɛ b d i l
تەبرىك	t ɛ b r i k
تەبلىغ	t ɛ b l i ʁ
تەبەسسۈم	t ɛ b ɛ s s y m
تەتىل	t ɛ t i l
تەجرىبىخانا	t ɛ d͡ʒ r i b i χ ɑ n ɑ
تەجرىبە	t ɛ d͡ʒ r i b ɛ
تەخمىن	t ɛ χ m i n
تەخمىنەن	t ɛ χ m i n ɛ n
تەدبىر	t ɛ d b i r
تەر	t ɛ r
تەربىيىۋى	t ɛ r b i j i w i
تەرجىمان	t ɛ r d͡ʒ i m ɑ n
تەررەھھۇم	t ɛ r r ɛ h h u m
تەرىپ	t ɛ r i p
تەس	t ɛ s
تەسلىم	t ɛ s l i m
تەسەللى	t ɛ s ɛ l l i
تەسەۋۋۇر	t ɛ s ɛ w w u r
تەشۋىش	t ɛ ʃ w i ʃ
تەشۋىقات	t ɛ ʃ w i q ɑ t
تەقسىم	t ɛ q s i m
تەكىت	t ɛ k i t
تەكەللۇپ	t ɛ k ɛ l l u p
تەلىمىي	t ɛ l i m i j
تەلەپ	t ɛ l ɛ p
تەلەپپۇز	t ɛ l ɛ p p u z
تەنەززۇل	t ɛ n ɛ z z u l
تەنەپپۇس	t ɛ n ɛ p p u s
تەپرىقە	t ɛ p r i q ɛ
تەڭرى	t ɛ ŋ r i
تەھرىر	t ɛ h r i r
تەۋسىيە	t ɛ w s i j ɛ
جادۇگەر	d͡ʒ ɑ d u ɡ ɛ r
جازا	d͡ʒ ɑ z ɑ
جاللات	d͡ʒ ɑ l l ɑ t
جامائەت	d͡ʒ ɑ m ɑ ʔ ɛ t
جاھان	d͡ʒ ɑ h ɑ n
جاھىل	d͡ʒ ɑ h i l
جاۋاب	d͡ʒ ɑ w ɑ p
جىنايەتچى	d͡ʒ i n ɑ j ɛ t t͡ʃ i
جۇغراپىيە	d͡ʒ u ʁ r ɑ p i j ɛ
جەريان	d͡ʒ ɛ r j ɑ n
جەزىبە	d͡ʒ ɛ z i b ɛ
جەسۇر	d͡ʒ ɛ s u r
جەسەت	d͡ʒ ɛ s ɛ t
جەھەت	d͡ʒ ɛ h ɛ t
جەۋز	d͡ʒ ɛ w z
خاتىرە	χ ɑ t i r ɛ
خوش	χ o ʃ
خىت	χ i t
خىزمەتچى	χ i z m ɛ t t͡ʃ i
خۇسۇس	χ u s u s
خۇسۇسىي	χ u s u s i j
خېمىر	χ e m i r
خېچىر	χ e t͡ʃ i r
خەتمە	χ ɛ t m ɛ
خەتىپ	χ ɛ t i p
خەيرىيەت	χ ɛ j r i j ɛ t
دائىمى	d ɑ ʔ i m i
دادا	d ɑ d ɑ
داستان	d ɑ s t ɑ n
دانە	d ɑ n ɛ
داۋا	d ɑ w ɑ
دوستانە	d o s t ɑ n ɛ
دىققەت	d i q q ɛ t
دىماق	d i m ɑ q
دىن	d i n
دىۋان	d i w ɑ n
دۇئا	d u ʔ ɑ
دۇتار	d u t ɑ r
دۇتتار	d u t t ɑ r
دۇنياۋى	d u n j ɑ w i
دۈشمەن	d y ʃ m ɛ n
دېكابر	d e k ɑ b r
دېموكراتىيە	d e m o k r ɑ t i j ɛ
دېمەك	d e m ɛ k
دېڭىزچى	d e ŋ i z t͡ʃ i
دەرت	d ɛ r t
دەرىجە	d ɛ r i d͡ʒ ɛ
دەرھال	d ɛ r h ɑ l
دەرۋازا	d ɛ r w ɑ z ɑ
دەقىقە	d ɛ q i q ɛ
دەپئەتەن	d ɛ p ʔ ɛ t ɛ n
دەپتەر	d ɛ p t ɛ r
دەۋەت	d ɛ w ɛ t
رايونى	r ɑ j o n i
روھ	r o h
روھانىي	r o h ɑ n i j
رىزالەت	r i z ɑ l ɛ t
رىغبەت	r i ʁ b ɛ t
رىقابەت	r i q ɑ b ɛ t
رۇخسەت	r u χ s ɛ t
رۇكۇ	r u k u
رېفېراندۇم	r e p e r ɑ n d u m
رەئىس	r ɛ ʔ i s
رەزىل	r ɛ z i l
رەسمىي	r ɛ s m i j
زالالەت	z ɑ l ɑ l ɛ t
زامىن	z ɑ m i n
زاھىرەن	z ɑ h i r ɛ n
زوھرە	z o h r ɛ
زىكىر	z i k i r
زىنا	z i n ɑ
زىننەت	z i n n ɛ t
زىيارەت	z i j ɑ r ɛ t
زۆرۈر	z ø r y r
زۇلۇم	z u l u m
زەبۇر	z ɛ b u r
زەررە	z ɛ r r ɛ
زەينەپ	z ɛ j n ɛ p
سائادەت	s ɑ ʔ ɑ d ɛ t
ساخاۋەت	s ɑ χ ɑ w ɛ t
ساداقەت	s ɑ d ɑ q ɛ t
ساراي	s ɑ r ɑ j
ساق	s ɑ q
ساقچى	s ɑ q t͡ʃ i
سايە	s ɑ j ɛ
ساپ	s ɑ p
ساھابە	s ɑ h ɑ b ɛ
ساھىب	s ɑ h i p
ساۋاپ	s ɑ w ɑ p
سوئال	s o ʔ ɑ l
سودىگەر	s o d i ɡ ɛ r
سىركە	s i r k ɛ
سىنك	s i n k
سىنىپداش	s i n i p d ɑ ʃ
سىيىر	s i j i r
سىڭىل	s i ŋ i l
سېخىي	s e χ i j
سېمىزئوت	s e m i z ʔ o t
سېھىرگەر	s e h i r ɡ ɛ r
سەدىقە	s ɛ d i q ɛ
سەرخۇش	s ɛ r χ u ʃ
سەكسەنپۇت	s ɛ k s ɛ n p u t
سەككىز	s ɛ k k i z
سەككىزىنچى	s ɛ k k i z i n t͡ʃ i
سەنئەتكار	s ɛ n ʔ ɛ t k ɑ r
سەپەر	s ɛ p ɛ r
سەھىيە	s ɛ h i j ɛ
شاراپەت	ʃ ɑ r ɑ p ɛ t
شاپائەت	ʃ ɑ p ɑ ʔ ɛ t
شاھادەت	ʃ ɑ h ɑ d ɛ t
شاھمات	ʃ ɑ h m ɑ t
شاھىت	ʃ ɑ h i t
شىركەت	ʃ i r k ɛ t
شىمالىي	ʃ i m ɑ l i j
شىنجاڭ	ʃ i n d͡ʒ ɑ ŋ
شياڭگاڭ	ʃ j ɑ ŋ ɡ ɑ ŋ
شېكەر	ʃ e k ɛ r
شەخسىيەت	ʃ ɛ χ s i j ɛ t
شەرت	ʃ ɛ r t
شەرق	ʃ ɛ r q
شەرەپ	ʃ ɛ r ɛ p
شەيخ	ʃ ɛ j χ
شەپكە	ʃ ɛ p k ɛ
شەھەر	ʃ ɛ h ɛ r
شەۋكەت	ʃ ɛ w k ɛ t
غايىپ	ʁ ɑ j i p
غايەت	ʁ ɑ j ɛ t
غۇربەت	ʁ u r b ɛ t
غۇرۇر	ʁ u r u r
غەرب	ʁ ɛ r p
غەربىي	ʁ ɛ r b i j
غەرپ	ʁ ɛ r p
غەزەپ	ʁ ɛ z ɛ p
غەلىبە	ʁ ɛ l i b ɛ
غەلۋىر	ʁ ɛ l w i r
غەيرەت	ʁ ɛ j r ɛ t
غەيۇر	ʁ ɛ j u r
فاشىست	p ɑ ʃ i s t
قائىدە	q ɑ ʔ i d ɛ
قابىلىيەت	q ɑ b i l i j ɛ t
قات	q ɑ t
قار	q ɑ r
قارار	q ɑ r ɑ r
قارارگاھ	q ɑ r ɑ r ɡ ɑ h
قارشى	q ɑ r ʃ i
قارىن	q ɑ r i n
قازاغىستان	q ɑ z ɑ ʁ i s t ɑ n
قازانماق	q ɑ z ɑ n m ɑ q
قاسساپ	q ɑ s s ɑ p
قاغا	q ɑ ʁ ɑ
قالقان	q ɑ l q ɑ n
قالۇن	q ɑ l u n
قانائەت	q ɑ n ɑ ʔ ɛ t
قانۇنسىز	q ɑ n u n s i z
قايغۇ	q ɑ j ʁ u
قاچا	q ɑ t͡ʃ ɑ
قاھىرە	q ɑ h i r ɛ
قورقاق	q o r q ɑ q
قورقۇنچ	q o r q u n t͡ʃ
قوزا	q o z ɑ
قوزىقۇلاق	q o z i q u l ɑ q
قونچ	q o n t͡ʃ
قويۇن	q o j u n
قوڭغۇز	q o ŋ ʁ u z
قوۋم	q o w m
قوۋۇرغا	q o w u r ʁ ɑ
قىرغىن	q i r ʁ i n
قىرىق	q i r i q
قىزىلغاز	q i z i l ʁ ɑ z
قىسسە	q i s s ɛ
قىشلاق	q i ʃ l ɑ q
قىلىق	q i l i q
قىياس	q i j ɑ s
قىيما	q i j m ɑ
قىچىق	q i t͡ʃ i q
قۇتلۇق	q u t l u q
قۇزغۇن	q u z ʁ u n
قۇسماق	q u s m ɑ q
قۇمچاق	q u m t͡ʃ ɑ q
قۇيرۇق	q u j r u q
قۇچاق	q u t͡ʃ ɑ q
قۇۋانچ	q u w ɑ n t͡ʃ
قېلىن	q e l i n
قېيىن	q e j i n
قەتئىيەت	q ɛ t ʔ i j ɛ t
قەدەھ	q ɛ d ɛ h
قەرەنفىل	q ɛ r ɛ n p i l
قەسىر	q ɛ s i r
قەلب	q ɛ l p
قەلبەن	q ɛ l b ɛ n
قەلەم	q ɛ l ɛ m
قەندىل	q ɛ n d i l
قەپەز	q ɛ p ɛ z
كابىل	k ɑ b i l
كاتولىك	k ɑ t o l i k
كاتېگورىيە	k ɑ t e ɡ o r i j ɛ
كادمىي	k ɑ d m i j
كاكاۋۇ	k ɑ k ɑ w u
كالتسىي	k ɑ l t s i j
كاللا	k ɑ l l ɑ
كالىي	k ɑ l i j
كامالەت	k ɑ m ɑ l ɛ t
كاۋچۇك	k ɑ w t͡ʃ u k
كرىمنىي	k r i m n i j
كرىپتون	k r i p t o n
كور	k o r
كورلۇق	k o r l u q
كونسۇل	k o n s u l
كىت	k i t
كىر	k i r
كىرپىك	k i r p i k
كىرپىچ	k i r p i t͡ʃ
كىنو	k i n o
كىپەك	k i p ɛ k
كۆز	k ø z
كۆكس	k ø k s
كۆل	k ø l
كۆمەك	k ø m ɛ k
كۆينەك	k ø j n ɛ k
كۆپۈك	k ø p y k
كۆچ	k ø t͡ʃ
كۇتۇپخانا	k u t u p χ ɑ n ɑ
كۈلپەت	k y l p ɛ t
كۈمۈش	k y m y ʃ
كۈن	k y n
كۈپ	k y p
كېلەر	k e l ɛ r
كېپىل	k e p i l
كېچا	k e t͡ʃ ɑ
كەشنىز	k ɛ ʃ n i z
كەشپ	k ɛ ʃ p
كەكلىك	k ɛ k l i k
كەلمەك	k ɛ l m ɛ k
كەنت	k ɛ n t
كەندىر	k ɛ n d i r
كەيپىيات	k ɛ j p i j ɑ t
كەچۈرۈڭ	k ɛ t͡ʃ y r y ŋ
كەۋسەر	k ɛ w s ɛ r
لاك	l ɑ k
لايىق	l ɑ j i q
لايىھە	l ɑ j i h ɛ
لاۋا	l ɑ w ɑ
لاۋرېنتسىي	l ɑ w r e n t s i j
لىباس	l i b ɑ s
لىمونات	l i m o n ɑ t
لىڭجەن	l i ŋ d͡ʒ ɛ n
ليۇتېتسىي	l j u t e t s i j
لۇغەت	l u ʁ ɛ t
لۈتۈپ	l y t y p
لەززەت	l ɛ z z ɛ t
لەقەم	l ɛ q ɛ m
لەنەت	l ɛ n ɛ t
لەپ	l ɛ p
لەڭگەر	l ɛ ŋ ɡ ɛ r
مائارىپ	m ɑ ʔ ɑ r i p
ماتكا	m ɑ t k ɑ
ماجال	m ɑ d͡ʒ ɑ l
ماددىي	m ɑ d d i j
مارال	m ɑ r ɑ l
مارت	m ɑ r t
مارجان	m ɑ r d͡ʒ ɑ n
مارگانېتىس	m ɑ r ɡ ɑ n e t i s
ماقۇل	m ɑ q u l
مالىيە	m ɑ l i j ɛ
مامونت	m ɑ m o n t
مانېۋىر	m ɑ n e w i r
مايمۇن	m ɑ j m u n
ماۋزۇ	m ɑ w z u
مورفىن	m o r p i n
مولىبدېن	m o l i b d e n
مىس	m i s
مىللەت	m i l l ɛ t
مىليارد	m i l j ɑ r t
مىمار	m i m ɑ r
مىنگۇو	m i n ɡ u o
مىنېرال	m i n e r ɑ l
مىڭ	m i ŋ
مۆڭ	m ø ŋ
مۇئامىلە	m u ʔ ɑ m i l ɛ
مۇئەززەم	m u ʔ ɛ z z ɛ m
مۇئەسسەسە	m u ʔ ɛ s s ɛ s ɛ
مۇئەللىم	m u ʔ ɛ l l i m
مۇئەللىپ	m u ʔ ɛ l l i p
مۇبارەك	m u b ɑ r ɛ k
مۇبالىغە	m u b ɑ l i ʁ ɛ
مۇتلەق	m u t l ɛ q
مۇتەۋەللى	m u t ɛ w ɛ l l i
مۇخالىپ	m u χ ɑ l i p
مۇختار	m u χ t ɑ r
مۇداخىلە	m u d ɑ χ i l ɛ
مۇددەت	m u d d ɛ t
مۇراسىم	m u r ɑ s i m
مۇرەببى	m u r ɛ b b i
مۇرەككەپ	m u r ɛ k k ɛ p
مۇزاكىرە	m u z ɑ k i r ɛ
مۇستەھكەم	m u s t ɛ h k ɛ m
مۇسكۇل	m u s k u l
مۇسھەپ	m u ʃ ɛ p
مۇقام	m u q ɑ m
مۇلازىمەت	m u l ɑ z i m ɛ t
مۇنبەت	m u n b ɛ t
مۇپتى	m u p t i
مۇپەتتىش	m u p ɛ t t i ʃ
مۇپەسسەل	m u p ɛ s s ɛ l
مۇھاجىر	m u h ɑ d͡ʒ i r
مۇھاسىرە	m u h ɑ s i r ɛ
مۇھىت	m u h i t
مۇۋەپپەقىيەت	m u w ɛ p p ɛ q i j ɛ t
مۈشكۈل	m y ʃ k y l
مۈشۈك	m y ʃ y k
مېتان	m e t ɑ n
مېترو	m e t r o
مېھنەت	m e h n ɛ t
مەبۇد	m ɛ b u t
مەتبۇئات	m ɛ t b u ʔ ɑ t
مەجلىس	m ɛ d͡ʒ l i s
مەخلۇق	m ɛ χ l u q
مەخمۇر	m ɛ χ m u r
مەدرىسە	m ɛ d r i s ɛ
مەركەز	m ɛ r k ɛ z
مەرھۇم	m ɛ r h u m
مەزمۇن	m ɛ z m u n
مەزھەپ	m ɛ z h ɛ p
مەسخىرە	m ɛ s χ i r ɛ
مەسلەك	m ɛ s l ɛ k
مەسىھ	m ɛ s i h
مەسەلەن	m ɛ s ɛ l ɛ n
مەشرەپ	m ɛ ʃ r ɛ p
مەشغۇلات	m ɛ ʃ ʁ u l ɑ t
مەشۋەرەت	m ɛ ʃ w ɛ r ɛ t
مەغلۇبىيەت	m ɛ ʁ l u b i j ɛ t
مەقئەت	m ɛ q ʔ ɛ t
مەقسەت	m ɛ q s ɛ t
مەكتۇپ	m ɛ k t u p
مەمنۇن	m ɛ m n u n
مەمۇر	m ɛ m u r
مەنقۇلات	m ɛ n q u l ɑ t
مەنپەئەت	m ɛ n p ɛ ʔ ɛ t
مەيدان	m ɛ j d ɑ n
مەھبۇس	m ɛ h b u s
مەھسۇل	m ɛ h s u l
مەھكەم	m ɛ h k ɛ m
مەۋسۇم	m ɛ w s u m
مەۋسۈم	m ɛ w s y m
نائىلاج	n ɑ ʔ i l ɑ d͡ʒ
نائىپ	n ɑ ʔ i p
نائۇستا	n ɑ ʔ u s t ɑ
ناترىي	n ɑ t r i j
ناخشا	n ɑ χ ʃ ɑ
نادان	n ɑ d ɑ n
نازارەت	n ɑ z ɑ r ɛ t
ناماز	n ɑ m ɑ z
ناماقۇل	n ɑ m ɑ q u l
نامە	n ɑ m ɛ
نامەلۇم	n ɑ m ɛ l u m
نان	n ɑ n
ناپاك	n ɑ p ɑ k
نوبېلىي	n o b e l i j
نورمال	n o r m ɑ l
نىجات	n i d͡ʒ ɑ t
نىجاسەت	n i d͡ʒ ɑ s ɛ t
نىسبەت	n i s b ɛ t
نىسپىي	n i s p i j
نىكېل	n i k e l
نىوبىي	n i o b i j
نىگار	n i ɡ ɑ r
نۆلىنچى	n ø l i n t͡ʃ i
نۆۋەت	n ø w ɛ t
نۇر	n u r
نېمىسچە	n e m i s t͡ʃ ɛ
نېيترون	n e j t r o n
نەبى	n ɛ b i
نەسىر	n ɛ s i r
نەسىل	n ɛ s i l
نەشر	n ɛ ʃ r
نەقلىيات	n ɛ q l i j ɑ t
نەي	n ɛ j
نەپرەت	n ɛ p r ɛ t
نەپس	n ɛ p s
نەپەس	n ɛ p ɛ s
نەپەقە	n ɛ p ɛ q ɛ
ياخشى	j ɑ χ ʃ i
ياخشىمۇسىز	j ɑ χ ʃ i m u s i z
يادىكار	j ɑ d i k ɑ r
يار	j ɑ r
يارا	j ɑ r ɑ
يازماق	j ɑ z m ɑ q
ياستۇق	j ɑ s t u q
ياق	j ɑ q
ياقماق	j ɑ q m ɑ q
ياقۇت	j ɑ q u t
يالغان	j ɑ l ʁ ɑ n
يانماق	j ɑ n m ɑ q
يانۋار	j ɑ n w ɑ r
ياڭاق	j ɑ ŋ ɑ q
ياڭيۇ	j ɑ ŋ j u
ياگاو	j ɑ ɡ ɑ o
ياۋۇز	j ɑ w u z
يىتىم	j i t i m
يىراقلىق	j i r ɑ q l i q
يىلىك	j i l i k
يىڭنە	j i ŋ n ɛ
يۇتقۇنچاق	j u t q u n t͡ʃ ɑ q
يۇلتۇز	j u l t u z
يۇمماق	j u m m ɑ q
يۇپقا	j u p q ɑ
يۇڭ	j u ŋ
يۈتمەك	j y t m ɛ k
يۈز	j y z
يۈسۈپ	j y s y p
يېتەرسىز	j e t ɛ r s i z
يېقىلغۇ	j e q i l ʁ u
يېپىشماق	j e p i ʃ m ɑ q
يېڭىلىق	j e ŋ i l i q
يېۋروپىي	j e w r o p i j
يەكۈن	j ɛ k y n
يەل	j ɛ l
يەلكەن	j ɛ l k ɛ n
يەنى	j ɛ n i
يەھۇدى	j ɛ h u d i
پاجىر	p ɑ d͡ʒ i r
پاراسەت	p ɑ r ɑ s ɛ t
پاراكەندە	p ɑ r ɑ k ɛ n d ɛ
پارلاق	p ɑ r l ɑ q
پارچىلىماق	p ɑ r t͡ʃ i l i m ɑ q
پاسىق	p ɑ s i q
پاقا	p ɑ q ɑ
پاكىز	p ɑ k i z
پال	p ɑ l
پانىي	p ɑ n i j
پايتەخت	p ɑ j t ɛ χ t
پايدا	p ɑ j d ɑ
پاھىشە	p ɑ h i ʃ ɛ
پروفېسسور	p r o p e s s o r
پورازېودىم	p o r ɑ z e o d i m
پىت	p i t
پىلان	p i l ɑ n
پىنگىۋىن	p i n ɡ i w i n
پىنھان	p i n h ɑ n
پۇتبول	p u t b o l
پۇشايمان	p u ʃ ɑ j m ɑ n
پۇل	p u l
پېقىر	p e q i r
پەخرى	p ɛ χ r i
پەرز	p ɛ r z
پەرى	p ɛ r i
پەرىشتە	p ɛ r i ʃ t ɛ
پەريات	p ɛ r j ɑ t
پەرھىز	p ɛ r h i z
پەرەزىي	p ɛ r ɛ z i j
پەسىھ	p ɛ s i h
پەقەت	p ɛ q ɛ t
پەن	p ɛ n
پەنجاب	p ɛ n d͡ʒ ɑ p
چارەك	t͡ʃ ɑ r ɛ k
چوكا	t͡ʃ o k ɑ
چولپان	t͡ʃ o l p ɑ n
چىراق	t͡ʃ i r ɑ q
چىقماق	t͡ʃ i q m ɑ q
چىكەتكە	t͡ʃ i k ɛ t k ɛ
چېچەك	t͡ʃ e t͡ʃ ɛ k
چەكمەك	t͡ʃ ɛ k m ɛ k
ژاندارما	ʒ ɑ n d ɑ r m ɑ
ژانىر	ʒ ɑ n i r
ژۇرنال	ʒ u r n ɑ l
گاباردىن	ɡ ɑ b ɑ r d i n
گادولىنىي	ɡ ɑ d o l i n i j
گاڭپەن	ɡ ɑ ŋ p ɛ n
گويا	ɡ o j ɑ
گىرانىت	ɡ i r ɑ n i t
گىرىپ	ɡ i r i p
گىياھ	ɡ i j ɑ h
گۇاڭشى	ɡ u ɑ ŋ ʃ i
گۇرۇھ	ɡ u r u h
گۈللەر	ɡ y l l ɛ r
گەدەن	ɡ ɛ d ɛ n
ھاجى	h ɑ d͡ʒ i
ھادىسە	h ɑ d i s ɛ
ھازىرقى	h ɑ z i r q i
ھايا	h ɑ j ɑ
ھاۋا	h ɑ w ɑ
ھاۋز	h ɑ w z
ھىيلە	h i j l ɛ
ھۆججەت	h ø d͡ʒ d͡ʒ ɛ t
ھۆكۈم	h ø k y m
ھېسسىي	h e s s i j
ھېكايە	h e k ɑ j ɛ
ھەب	h ɛ p
ھەبەش	h ɛ b ɛ ʃ
ھەجىم	h ɛ d͡ʒ i m
ھەربىي	h ɛ r b i j
ھەقىر	h ɛ q i r
ھەقىقەتەن	h ɛ q i q ɛ t ɛ n
ھەپتە	h ɛ p t ɛ
ھەۋەسكار	h ɛ w ɛ s k ɑ r
ۋاراق	w ɑ r ɑ q
ۋارىس	w ɑ r i s
ۋاز	w ɑ z
ۋاپا	w ɑ p ɑ
ۋېلىنېمەت	w e l i n e m ɛ t
ۋەسىيەت	w ɛ s i j ɛ t
ۋەقە	w ɛ q ɛ
ۋەلسىپىت	w ɛ l s i p i t
ۋەھشەت	w ɛ h ʃ ɛ t
