<|MLT|>dgħajjef	d a j j ɛ f
<|MLT|>dgħajsa	d a j s a
<|MLT|>diffiċli	d ɪ f f iː t͡ʃ l ɪ
<|MLT|>difiża	d ɪ f iː z a
<|MLT|>din	d iː n
<|MLT|>dineb	d ɪ n ɛ p
<|MLT|>dinja	d ɪ n j ɐ
<|MLT|>direzzjoni	d ɪ r ɛ t t͡s j ɔː n ɪ
<|MLT|>disgħa	d ɪ s a
<|MLT|>disgħin	d ɪ s a j n
<|MLT|>djar	d j aː r
<|MLT|>dlam	d l aː m
<|MLT|>dmugħ	d m uː ħ
<|MLT|>dnub	d n uː p
<|MLT|>drabi	d r aː b ɪ
<|MLT|>drapp	d r a p
<|MLT|>dritt	d r ɪ t
<|MLT|>drittijiet	d r ɪ t t ɪ j ɪː t
<|MLT|>ebda	ɛ b d a
<|MLT|>edizzjoni	ɛ d ɪ t t͡s j ɔː n ɪ
<|MLT|>ejja	ɛ j j a
<|MLT|>emmen	ɛ m m ɛ n
<|MLT|>emozzjonali	ɛ m ɔ tː s j ɔ n aː l ɪ
<|MLT|>enerġija	ɛ n ɛ r d͡ʒ iː j a
<|MLT|>erbgħa	ɛ r b a
<|MLT|>erbgħin	ɛ r b ɛ j n
<|MLT|>esperjenza	ɛ s p ɛ r j ɛ n t͡s a
<|MLT|>espressjoni	ɛ s p r ɛ sː j ɔː n ɪ
<|MLT|>essenzjali	ɛ sː ɛ n t s j aː l ɪ
<|MLT|>essenzjalment	ɛ sː ɛ n t s j ɐ l m ɛ n t
<|MLT|>ewwel	ɛ w w ɛ l
<|MLT|>eċċezzjoni	ɛ tː ʃ ɛ tː s j ɔː n ɪ
<|MLT|>eżami	ɛ z aː m ɪ
<|MLT|>eżatt	ɛ z a t
<|MLT|>eżempji	ɛ z ɛ m p j ɪ
<|MLT|>fadal	f a d a l
<|MLT|>far	f aː r
<|MLT|>faċli	f aː t͡ʃ l ɪ
<|MLT|>faħħar	f a ħ ħ a r
<|MLT|>fehem	f ɛː m
<|MLT|>fejda	f ɛ j d a
<|MLT|>felaħ	f ɛ l a ħ
<|MLT|>ferħ	f ɛ r ħ
<|MLT|>fetaħ	f ɛ t a ħ
<|MLT|>fiha	f ɪː j a
<|MLT|>fihom	f ɪː j ɔ m
<|MLT|>fik	f iː k
<|MLT|>fil	f iː l
<|MLT|>filgħaxija	f ɪ l a ʃ iː j a
<|MLT|>filgħaxijiet	f ɪ l a ʃ ɪ j ɪː t
<|MLT|>fina	f iː n a
<|MLT|>fisser	f ɪ s s ɛ r
<|MLT|>fittex	f ɪ t t ɛ ʃ
<|MLT|>fliexken	f l ɪː ʃ k ɛ n
<|MLT|>flixkun	f l ɪ ʃ k uː n
<|MLT|>flok	f l ɔː k
<|MLT|>flus	f l uː s
<|MLT|>fniek	f n ɪː k
<|MLT|>folla	f ɔ l l a
<|MLT|>fomm	f ɔ m m
<|MLT|>forma	f ɔ r m a
<|MLT|>forsi	f ɔ r s ɪ
<|MLT|>fost	f ɔ s t
<|MLT|>frott	f r ɔ tː
<|MLT|>ftakar	f t a k a r
<|MLT|>ftit	f t iː t
<|MLT|>fuq	f uː ʔ
<|MLT|>gawda	ɡ a w d a
<|MLT|>gideb	ɡ ɪ d ɛ p
<|MLT|>gwerra	ɡ w ɛ r r a
<|MLT|>għada	aː d a
<|MLT|>għadd	aː t
<|MLT|>għadda	aː d d a
<|MLT|>għafas	aː f a s
<|MLT|>għajb	a j p
<|MLT|>għajn	a j n
<|MLT|>għajnuna	a j n uː n a
<|MLT|>għalaq	aː l a ʔ
<|MLT|>għaldaqstant	a l d a ʔ s t a n t
<|MLT|>għalhekk	a l ɛː k
<|MLT|>għalja	aː l j a
<|MLT|>għalliem	a l l ɪː m
<|MLT|>għalqa	aː l ʔ a
<|MLT|>għammieq	a m m ɪː ʔ
<|MLT|>għana	aː n a
<|MLT|>għand	aː n t
<|MLT|>għandek	aː n d ɛ k
<|MLT|>għandha	aː n d a
<|MLT|>għandhom	aː n d ɔ m
<|MLT|>għandi	aː n d ɪ
<|MLT|>għandkom	aː n t k ɔ m
<|MLT|>għandna	aː n n a
<|MLT|>għani	aː n ɪ
<|MLT|>għaqda	aː ʔ d a
<|MLT|>għaqdiet	a ʔ d ɪː t
<|MLT|>għaqli	aː ʔ l ɪ
<|MLT|>għaqlija	a ʔ l iː j a
<|MLT|>għaqlin	a ʔ l iː n
<|MLT|>għaraf	aː r a f
<|MLT|>għarajjes	a r a j j ɛ s
<|MLT|>għarfien	a r f ɪː n
<|MLT|>għasar	aː s a r
<|MLT|>għasfur	a s f uː r
<|MLT|>għatxana	a t t͡ʃ aː n a
<|MLT|>għawdex	a w d ɛ ʃ
<|MLT|>għawdxija	a w t͡ʃ iː j a
<|MLT|>għawdxin	a w t͡ʃ iː n
<|MLT|>għawma	a w m a
<|MLT|>għax	aː ʃ
<|MLT|>għaxar	aː ʃ a r
<|MLT|>għażel	aː z ɛ l
<|MLT|>għażiż	a z iː s
<|MLT|>għażla	aː z l a
<|MLT|>għelieqi	ɛ l ɪː ʔ ɪ
<|MLT|>għen	ɛː n
<|MLT|>għex	ɛː ʃ
<|MLT|>għid	ɛ j t
<|MLT|>għodod	ɔː d ɔ t
<|MLT|>għola	ɔː l a
<|MLT|>għolja	ɔː l j a
<|MLT|>għoljin	ɔ l j iː n
<|MLT|>gżejjer	ɡ z ɛ jː ɛ r
<|MLT|>gżira	ɡ z iː r a
<|MLT|>hawn	a w n
<|MLT|>hemm	ɛ m m
<|MLT|>hemmhekk	ɛ m m ɛː k
<|MLT|>hena	ɛː n a
<|MLT|>hewden	ɛ w d ɛ n
<|MLT|>hieni	ħ ɪː n ɪ
<|MLT|>hienja	ħ ɪː n j a
<|MLT|>hija	iː j ɐ
<|MLT|>hinn	ɪ n n
<|MLT|>huma	uː m ɐ
<|MLT|>huwa	uː w ɐ
<|MLT|>iben	ɪ b ɛ n
<|MLT|>iblah	ɪ b l a ħ
<|MLT|>id	iː t
<|MLT|>iebes	ɪː b ɛ s
<|MLT|>iebsa	ɪː p s a
<|MLT|>ieħor	ɪː ħ ɔ r
<|MLT|>ikel	ɪ k ɛ l
<|MLT|>ikrah	ɪ k r a ħ
<|MLT|>illum	ɪ l l uː m
<|MLT|>ilma	ɪ l m a
<|MLT|>ilsna	ɪ l s n ɐ
<|MLT|>imbagħad	ɪ m b aː t
<|MLT|>impjieg	ɪ m p j ɪː k
<|MLT|>impressjoni	ɪ m p r ɛ s s j ɔː n ɪ
<|MLT|>impressjonijiet	ɪ m p r ɛ s s j ɔ n ɪ j ɪː t
<|MLT|>imħabba	ɪ m ħ a b b a
<|MLT|>inbid	ɪ m b iː t
<|MLT|>indika	ɪ n d iː k ɐ
<|MLT|>indikazzjoni	ɪ n d ɪ k a t t͡s j ɔː n ɪ
<|MLT|>indipendenti	ɪ n d ɪ p ɛ n d ɛ n t ɪ
<|MLT|>indiċi	ɪ n d iː t͡ʃ ɪ
<|MLT|>infern	ɪ n f ɛ r n
<|MLT|>infezzjoni	ɪ n f ɛ t t͡s j ɔː n ɪ
<|MLT|>ingliż	ɪ n ɡ l iː s
<|MLT|>inibizzjoni	ɪ n ɪ b ɪ tː s j ɔː n ɪ
<|MLT|>inkella	ɪ n k ɛ l l a
<|MLT|>int	ɪ n t
<|MLT|>internazzjonali	ɪ n t ɛ r n a t t͡s j ɔ n aː l ɪ
<|MLT|>inti	ɪ n t ɪ
<|MLT|>intom	ɪ n t ɔ m
<|MLT|>ipprova	ɪ p p r ɔː v a
<|MLT|>irjieħ	ɪ r j ɪː ħ
<|MLT|>irrisponda	ɪ r r ɪ s p ɔ n d a
<|MLT|>isem	ɪ s ɛ m
<|MLT|>isfar	ɪ s f ɐ r
<|MLT|>isfel	ɪ s f ɛ l
<|MLT|>issa	ɪ s s a
<|MLT|>issieħeb	ɪ s s ɪː ħ ɛ p
<|MLT|>istess	ɪ s t ɛ sː
<|MLT|>itfal	ɪ t f aː l
<|MLT|>ittra	ɪ t t r a
<|MLT|>itwal	ɪ t w a l
<|MLT|>iva	iː v a
<|MLT|>iżjed	ɪ z j ɛ t
<|MLT|>jaf	j aː f
<|MLT|>jagħlaq	j aː l a ʔ
<|MLT|>jagħti	j aː t ɪ
<|MLT|>jagħżel	j aː z ɛ l
<|MLT|>jalla	j a l l a
<|MLT|>jannar	j ɐ n n ɐː r
<|MLT|>jaqbad	j a ʔ b a t
<|MLT|>jaqra	j a ʔ r a
<|MLT|>jara	j aː r a
<|MLT|>jekk	j ɛ kː
<|MLT|>jew	j ɛ w
<|MLT|>jgħallem	j aː l l ɛ m
<|MLT|>jgħid	j ɛ j t
<|MLT|>jgħin	j a j n
<|MLT|>jgħix	j ɛ j ʃ
<|MLT|>jgħodd	j ɔː t
<|MLT|>jgħożż	j ɔː s
<|MLT|>jhedded	j ɛː d d ɛ t
<|MLT|>jibgħat	j ɪ b a t
<|MLT|>jidher	j ɪ d ɛ r
<|MLT|>jiekol	j ɪː k ɔ l
<|MLT|>jiem	j ɪː m
<|MLT|>jien	j ɪː n
<|MLT|>jiena	j ɪː n ɐ
<|MLT|>jifhem	j ɪ f ɛ m
<|MLT|>jilgħab	j ɪ l a p
<|MLT|>jingħata	j ɪ n aː t a
<|MLT|>jinsa	j ɪ n s a
<|MLT|>jisimgħu	j ɪ s ɪ m ɔ w
<|MLT|>jistgħu	j ɪ s t ɔ w
<|MLT|>jitgħallem	j ɪ t aː l l ɛ m
<|MLT|>jixgħel	j ɪ ʃ a l
<|MLT|>jixhed	j ɪ ʃ ɛ t
<|MLT|>jiġifieri	j ɪ d͡ʒ ɪ f ɪː r ɪ
<|MLT|>jogħxa	j ɔː ʃ a
<|MLT|>joqgħod	j ɔ ʔ ɔ t
<|MLT|>jsib	j s iː p
<|MLT|>juri	j uː r ɪ
<|MLT|>jħobb	j ħ ɔ p
<|MLT|>kafè	k a f ɛː
<|MLT|>kamra	k a m r a
<|MLT|>kanta	k a n t a
<|MLT|>kapaċità	k ɐ p ɐ t ʃ ɪ t a
<|MLT|>kbar	ɡ b aː r
<|MLT|>kbir	ɡ b iː r
<|MLT|>kburi	ɡ b uː r ɪ
<|MLT|>keffa	k ɛ f f a
<|MLT|>kelb	k ɛ l p
<|MLT|>kelba	k ɛ l b ɐ
<|MLT|>kelma	k ɛ l m a
<|MLT|>kelmiet	k ɛ l m ɪː t
<|MLT|>kenn	k ɛ n
<|MLT|>kerha	k ɛ r a
<|MLT|>kiber	k ɪ b ɛ r
<|MLT|>kiefer	k ɪː f ɛ r
<|MLT|>kiel	k ɪː l
<|MLT|>kiesaħ	k ɪː s a ħ
<|MLT|>kisser	k ɪ s s ɛ r
<|MLT|>kiteb	k ɪ t ɛ p
<|MLT|>kittieb	k ɪ t t ɪː p
<|MLT|>kixef	k ɪ ʃ ɛ f
<|MLT|>klabb	k l a p
<|MLT|>kliem	k l ɪː m
<|MLT|>kmamar	k m aː m a r
<|MLT|>kmieni	k m ɪː n ɪ
<|MLT|>knejjes	k n ɛ j j ɛ s
<|MLT|>knisja	k n iː s j a
<|MLT|>kollezzjoni	k ɔ lː ɛ tː s j ɔː n ɪ
<|MLT|>kollha	k ɔ l l a
<|MLT|>kollhom	k ɔ l l ɔ m
<|MLT|>kollox	k ɔ l l ɔ ʃ
<|MLT|>kontra	k ɔ n t r a
<|MLT|>koppja	k ɔ p p j a
<|MLT|>kotba	k ɔ d b a
<|MLT|>kotra	k ɔ t r a
<|MLT|>ktejjeb	k t ɛ j j ɛ p
<|MLT|>ktieb	k t ɪː p
<|MLT|>kwistjoni	k w ɪ s t j ɔː n ɪ
<|MLT|>la	l aː
<|MLT|>lagħab	l aː p
<|MLT|>lanqas	l a n ʔ a s
<|MLT|>laqat	l a ʔ a t
<|MLT|>laqgħa	l a ʔ a
<|MLT|>laqgħat	l a ʔ aː t
<|MLT|>latin	l ɐ t iː n
<|MLT|>le	l ɛː
<|MLT|>lejl	l ɛ j l
<|MLT|>lejla	l ɛ j l ɐ
<|MLT|>lemin	l ɛ m iː n
<|MLT|>lesta	l ɛ s t a
<|MLT|>lewn	l ɛ w n
<|MLT|>leħen	l ɛ ħ ɛ n
<|MLT|>lgħabt	l a p t
<|MLT|>lhud	l uː t
<|MLT|>libertà	l ɪ b ɛ r t aː
<|MLT|>libsa	l ɪ p s a
<|MLT|>liema	l ɪː m a
<|MLT|>lingwa	l ɪ n ɡ w ɐ
<|MLT|>liġi	l iː d͡ʒ ɪ
<|MLT|>lpup	l p uː p
<|MLT|>lsien	l s ɪː n
<|MLT|>ma	m aː
<|MLT|>magħha	m a ħ ħ a
<|MLT|>magħhom	m a ħ ħ ɔ m
<|MLT|>magħkom	m aː k ɔ m
<|MLT|>magħmul	m a m uː l
<|MLT|>magħna	m aː n a
<|MLT|>magħqud	m a ʔ uː t
<|MLT|>magħruf	m a r uː f
<|MLT|>malajr	m a l a j r
<|MLT|>malti	m ɐ l t ɪ
<|MLT|>maltija	m ɐ l t iː j ɐ
<|MLT|>maltin	m ɐ l t iː n
<|MLT|>maqtugħ	m a ʔ t uː ħ
<|MLT|>maqtugħa	m a ʔ t uː w a
<|MLT|>mara	m a r a
<|MLT|>mard	m a r t
<|MLT|>marsaxlokk	m a r s a ʃ l ɔ k
<|MLT|>mart	m a r t
<|MLT|>maxtura	m a ʃ t uː r a
<|MLT|>maħbub	m a ħ b uː p
<|MLT|>mbagħad	m b aː t
<|MLT|>mejjet	m ɛ j j ɛ t
<|MLT|>mejta	m ɛ j t a
<|MLT|>mela	m ɛ l a
<|MLT|>merħba	m ɛ r ħ b ɐ
<|MLT|>mess	m ɛ s
<|MLT|>meta	m ɛ t a
<|MLT|>mewt	m ɛ w t
<|MLT|>mexa	m ɛ ʃ a
<|MLT|>mgħallem	m aː l l ɛ m
<|MLT|>mgħallma	m aː l l m a
<|MLT|>mhedda	m ɛː d d a
<|MLT|>mhux	m uː ʃ
<|MLT|>mibegħda	m ɪ b ɛː d a
<|MLT|>mibjugħ	m ɪ b j uː ħ
<|MLT|>miegħek	m ɪː j a k
<|MLT|>miegħu	m ɪː j ɔ w
<|MLT|>miet	m ɪː t
<|MLT|>mifhum	m ɪ f uː m
<|MLT|>miftuħa	m ɪ f t uː ħ a
<|MLT|>mija	m iː j a
<|MLT|>milied	m ɪ l ɪː t
<|MLT|>minna	m ɪ n n a
<|MLT|>minnek	m ɪ n n ɛ k
<|MLT|>minnha	m ɪ n n a
<|MLT|>minnhom	m ɪ n n ɔ m
<|MLT|>minni	m ɪ n n ɪ
<|MLT|>minnkom	m ɪ n k ɔ m
<|MLT|>mistennija	m ɪ s t ɛ n n iː j a
<|MLT|>mistieden	m ɪ s t ɪː d ɛ n
<|MLT|>mistoqsija	m ɪ s t ɔ ʔ s iː j a
<|MLT|>mistoqsijiet	m ɪ s t ɔ ʔ s ɪ j ɪː t
<|MLT|>mitfugħ	m ɪ t f uː ħ
<|MLT|>mitt	m ɪ t
<|MLT|>miżżewweġ	m ɪ z z ɛ w w ɛ t͡ʃ
<|MLT|>miżżewġa	m ɪ z z ɛ w d͡ʒ a
<|MLT|>miżżewġin	m ɪ z z ɛ w d͡ʒ iː n
<|MLT|>mkien	m k ɪː n
<|MLT|>mogħdija	m ɔ d iː j a
<|MLT|>mogħti	m ɔː t ɪ
<|MLT|>mqaddes	m ʔ a d d ɛ s
<|MLT|>mħabba	m ħ a b b a
<|MLT|>nar	n aː r
<|MLT|>navigazzjoni	n a v ɪ ɡ a t t͡s j ɔː n ɪ
<|MLT|>nazzjonali	n a t t͡s j ɔ n aː l ɪ
<|MLT|>nazzjonalist	n a t t͡s j ɔ n a l ɪ s t
<|MLT|>naħa	n a ħ a
<|MLT|>naħat	n a ħ aː t
<|MLT|>nbena	m b ɛ n a
<|MLT|>nesa	n ɛ s a
<|MLT|>ngħata	n aː t a
<|MLT|>nhar	n aː r
<|MLT|>nieda	n ɪː d a
<|MLT|>niedi	n ɪː d ɪ
<|MLT|>nieqes	n ɪː ʔ ɛ s
<|MLT|>nies	n ɪː s
<|MLT|>niexef	n ɪː ʃ ɛ f
<|MLT|>nifs	n ɪ f s
<|MLT|>nisa	n ɪ s a
<|MLT|>nisel	n ɪ s ɛ l
<|MLT|>nisrani	n ɪ s r aː n ɪ
<|MLT|>niżbogħ	n ɪ z b ɔ ħ
<|MLT|>niżel	n ɪ z ɛ l
<|MLT|>nkiteb	n k ɪ t ɛ p
<|MLT|>nofs	n ɔ f s
<|MLT|>nofsinhar	n ɔ f s ɪ n aː r
<|MLT|>nsara	n s aː r a
<|MLT|>ntefa	n t ɛ f a
<|MLT|>obda	ɔ b d a
<|MLT|>omm	ɔ mː
<|MLT|>omosesswali	ɔ m ɔ s ɛ s s w aː l ɪ
<|MLT|>opinjoni	ɔ p ɪ n j ɔː n ɪ
<|MLT|>ordna	ɔ r d n a
<|MLT|>oħla	ɔ ħ l a
<|MLT|>oħra	ɔ ħ r a
<|MLT|>oħrajn	ɔ ħ r a j n
<|MLT|>oħt	ɔ ħ t
<|MLT|>pajjiż	p a j j iː s
<|MLT|>parteċipazzjoni	p a r t ɛ t͡ʃ ɪ p a t t͡s j ɔː n ɪ
<|MLT|>passjoni	p ɐ sː j ɔː n ɪ
<|MLT|>patt	p a t
<|MLT|>paġna	p aː d͡ʒ n a
<|MLT|>pinġa	p ɪ n d͡ʒ a
<|MLT|>pitter	p ɪ t t ɛ r
<|MLT|>politika	p ɔ l iː t ɪ k a
<|MLT|>popli	p ɔ p l ɪ
<|MLT|>possibbli	p ɔ s s ɪ b b l ɪ
<|MLT|>povertà	p ɔ v ɛ r t aː
<|MLT|>pożizzjoni	p ɔ z ɪ tː s j ɔː n ɪ
<|MLT|>pparteċipa	p p a r t ɛ t͡ʃ iː p a
<|MLT|>pprova	ɪ p p r ɔː v a
<|MLT|>promozzjoni	p r ɔ m ɔ t t͡s j ɔː n ɪ
<|MLT|>protezzjoni	p r ɔ t ɛ t t͡s j ɔː n ɪ
<|MLT|>qabad	ʔ a b a t
<|MLT|>qabel	ʔ a b ɛ l
<|MLT|>qabilha	ʔ a b ɪ l a
<|MLT|>qabża	ʔ a b z a
<|MLT|>qadim	ʔ a d iː m
<|MLT|>qagħad	ʔ aː t
<|MLT|>qal	ʔ aː l
<|MLT|>qalb	ʔ a l p
<|MLT|>qam	ʔ aː m
<|MLT|>qarben	ʔ a r b ɛ n
<|MLT|>qares	ʔ aː r ɛ s
<|MLT|>qarib	ʔ a r iː p
<|MLT|>qarraq	ʔ a r r a ʔ
<|MLT|>qasir	ʔ a s iː r
<|MLT|>qassis	ʔ a s s iː s
<|MLT|>qatgħa	ʔ a t a
<|MLT|>qatigħ	ʔ a t iː ħ
<|MLT|>qatra	ʔ a t r a
<|MLT|>qawmien	ʔ a w m ɪː n
<|MLT|>qawwa	ʔ a w w a
<|MLT|>qawwi	ʔ a w w ɪ
<|MLT|>qed	ʔ ɛː t
<|MLT|>qeda	ʔ ɛ d a
<|MLT|>qegħdin	ʔ ɛ d iː n
<|MLT|>qiegħed	ʔ ɛː t
<|MLT|>qima	ʔ iː m a
<|MLT|>qliel	ʔ l ɪː l
<|MLT|>qorti	ʔ ɔ r t ɪ
<|MLT|>ra	r aː
<|MLT|>rabba	r a b b a
<|MLT|>randan	r a n d aː n
<|MLT|>ras	r aː s
<|MLT|>raħal	r a ħ a l
<|MLT|>raħħal	r a ħ ħ aː l
<|MLT|>re	r ɛː
<|MLT|>rebaħ	r ɛ b a ħ
<|MLT|>rebbieħ	r ɛ b b ɪː ħ
<|MLT|>rebħa	r ɛ p ħ a
<|MLT|>relazzjonijiet	r ɛ l a t t͡s j ɔ n ɪ j ɪː t
<|MLT|>resaq	r ɛ s a ʔ
<|MLT|>ried	r ɪː t
<|MLT|>rikk	r ɪ k
<|MLT|>rispett	r ɪ s p ɛ t
<|MLT|>risposta	r ɪ s p ɔ s t a
<|MLT|>risq	r ɪ s ʔ
<|MLT|>rix	r iː ʃ
<|MLT|>rjus	r j uː s
<|MLT|>rokna	r ɔ k n ɐ
<|MLT|>rqaq	r ʔ aː ʔ
<|MLT|>rringrazzja	ɪ r r ɪ n ɡ r a t t͡s j a
<|MLT|>ruħ	r uː ħ
<|MLT|>rwol	r w ɔː l
<|MLT|>rċieva	r t͡ʃ ɪː v a
<|MLT|>rħam	r ħ aː m
<|MLT|>rħula	r ħ uː l a
<|MLT|>sa	s a
<|MLT|>sab	s aː p
<|MLT|>sabar	s a b a r
<|MLT|>sabiħ	s a b ɪː ħ
<|MLT|>sabiħa	s a b ɪː ħ a
<|MLT|>safi	s aː f ɪ
<|MLT|>sahra	s aː r a
<|MLT|>sajd	s a j t
<|MLT|>sajf	s a j f
<|MLT|>sajran	s a j r aː n
<|MLT|>salib	s a l iː p
<|MLT|>saltna	s a l t n a
<|MLT|>salva	s a l v a
<|MLT|>salvaġġa	s a l v a d d͡ʒ a
<|MLT|>sapun	s a p uː n
<|MLT|>saqaf	s a ʔ a f
<|MLT|>sar	s aː r
<|MLT|>saċerdot	s a t͡ʃ ɛ r d ɔː t
<|MLT|>saħan	s a ħ a n
<|MLT|>sbieħ	z b ɪː ħ
<|MLT|>se	s ɛ
<|MLT|>sebgħa	s ɛ b a
<|MLT|>sehem	s ɛː m
<|MLT|>sejjaħ	s ɛ j j a ħ
<|MLT|>sejjer	s ɛ j j ɛ r
<|MLT|>sejħa	s ɛ j ħ a
<|MLT|>sema	s ɛ m a
<|MLT|>sena	s ɛ n a
<|MLT|>sengħa	s ɛ n a
<|MLT|>seqer	s ɛ ʔ ɛ r
<|MLT|>serp	s ɛ r p
<|MLT|>sess	s ɛ sː
<|MLT|>sewwa	s ɛ w w a
<|MLT|>seħħ	s ɛ ħ
<|MLT|>sforza	s f ɔ r t͡s a
<|MLT|>sibt	s ɪ p t
<|MLT|>sidna	s iː d n a
<|MLT|>siegħa	s ɪː j a
<|MLT|>sieq	s ɪː ʔ
<|MLT|>sieħeb	s ɪː ħ ɛ p
<|MLT|>sigriet	s ɪ ɡ r ɪː t
<|MLT|>sikkina	s ɪ k k iː n a
<|MLT|>sinna	s ɪ n n a
<|MLT|>sistema	s ɪ s t ɛː m ɐ
<|MLT|>sistematikament	s ɪ s t ɛ m ɐ t ɪ k ɐ m ɛ n t
<|MLT|>sitt	s ɪ t
<|MLT|>sitta	s ɪ t t a
<|MLT|>sittax	s ɪ t t aː ʃ
<|MLT|>sittin	s ɪ t t iː n
<|MLT|>sitwazzjoni	s ɪ t w a t t͡s j ɔː n ɪ
<|MLT|>siġra	s ɪ d͡ʒ r a
<|MLT|>skejjel	s k ɛ j j ɛ l
<|MLT|>skiet	s k ɪː t
<|MLT|>skola	s k ɔː l a
<|MLT|>smajt	s m a j t
<|MLT|>smigħ	s m ɪː ħ
<|MLT|>sorm	s ɔ r m
<|MLT|>soċjetà	s ɔ t͡ʃ j ɛ t a
<|MLT|>spalla	s p a l l a
<|MLT|>speċifikament	s p ɛ t ʃ ɪ f ɪ k ɐ m ɛ n t
<|MLT|>sqallija	s ʔ a l l iː j a
<|MLT|>stampa	s t a m p a
<|MLT|>staqsa	s t a ʔ s a
<|MLT|>stat	s t aː t
<|MLT|>stazzjon	s t a t t͡s j ɔː n
<|MLT|>stedina	s t ɛ d iː n a
<|MLT|>stess	s t ɛ s
<|MLT|>stieden	s t ɪː d ɛ n
<|MLT|>stilla	s t ɪ l l a
<|MLT|>storja	s t ɔː r j a
<|MLT|>suq	s uː ʔ
<|MLT|>sur	s uː r
<|MLT|>svediż	z v ɛ d iː s
<|MLT|>swied	s w ɪː t
<|MLT|>swieq	s w ɪː ʔ
<|MLT|>sħab	s ħ aː p
<|MLT|>sħana	s ħ aː n ɐ
<|MLT|>sħiħ	s ħ ɪː ħ
<|MLT|>ta	t aː
<|MLT|>tabib	t a b iː p
<|MLT|>tabilħaqq	t a b ɪ l ħ a ʔ
<|MLT|>tagħha	t a ħ ħ a
<|MLT|>tagħhom	t a ħ ħ ɔ m
<|MLT|>tagħkom	t aː k ɔ m
<|MLT|>tagħlim	t a l iː m
<|MLT|>tagħlima	t a l iː m a
<|MLT|>tagħna	t aː n a
<|MLT|>tagħrif	t a r iː f
<|MLT|>tajba	t a j b a
<|MLT|>tajt	t a j t
<|MLT|>talab	t a l a p
<|MLT|>taljan	t ɐ l j ɐː n
<|MLT|>tama	t a m a
<|MLT|>tar	t aː r
<|MLT|>tarbija	t a r b iː j a
<|MLT|>tarf	t a r f
<|MLT|>tassew	t ɐ sː ɛ w
<|MLT|>taħt	t a ħ t
<|MLT|>tbigħ	d b ɪː ħ
<|MLT|>telaq	t ɛ l a ʔ
<|MLT|>tenna	t ɛ n n a
<|MLT|>terremot	t ɛ r r ɛ m ɔː t
<|MLT|>tfajla	t f a j l a
<|MLT|>tfal	t f aː l
<|MLT|>tfittxija	t f ɪ t t͡ʃ iː j a
<|MLT|>tgħallem	t aː l l ɛ m
<|MLT|>tgħid	t ɛ j t
<|MLT|>tgħin	t ɛ j n
<|MLT|>tiegħi	t ɪː j ɛ j
<|MLT|>tifla	t ɪ f l a
<|MLT|>tikmix	t ɪ k m iː ʃ
<|MLT|>tilef	t ɪ l ɛ f
<|MLT|>tini	t ɪ n ɪ
<|MLT|>tkellem	t k ɛ l l ɛ m
<|MLT|>tlettax	t l ɛ t t aː ʃ
<|MLT|>tliet	t l ɪː t
<|MLT|>tlieta	t l ɪː t a
<|MLT|>tmien	t m ɪː n
<|MLT|>tmint	t m ɪ n t
<|MLT|>toqba	t ɔ ʔ b a
<|MLT|>toqob	t ɔ ʔ ɔ p
<|MLT|>tork	t ɔ r k
<|MLT|>tqatel	t ʔ aː t ɛ l
<|MLT|>tqila	t ʔ iː l a
<|MLT|>trab	t r aː p
<|MLT|>trabba	t r a b b a
<|MLT|>tradizzjoni	t r ɐ d ɪ tː s j ɔː n ɪ
<|MLT|>tul	t uː l
<|MLT|>twal	t w aː l
<|MLT|>twelled	t w ɛ l l ɛ t
<|MLT|>tweġiba	t w ɛ d͡ʒ iː b a
<|MLT|>twieled	t w ɪː l ɛ t
<|MLT|>twil	t w iː l
<|MLT|>twila	t w iː l a
<|MLT|>umli	uː m l ɪ
<|MLT|>uża	uː z a
<|MLT|>vapur	v a p uː r
<|MLT|>veloċità	v ɛ l ɔ t ʃ ɪ t a
<|MLT|>vjaġġ	v j a t͡ʃ
<|MLT|>vjolenti	v j ɔ l ɛ n t ɪ
<|MLT|>vuċi	v uː t͡ʃ ɪ
<|MLT|>waqaf	w a ʔ a f
<|MLT|>waqt	w a ʔ t
<|MLT|>wara	w a r a
<|MLT|>ward	w a r t
<|MLT|>warda	w a r d a
<|MLT|>wasal	w a s a l
<|MLT|>wegħda	w ɛː d a
<|MLT|>wera	w ɛ r a
<|MLT|>weraq	w ɛ r a ʔ
<|MLT|>wesgħin	w ɛ s a j n
<|MLT|>wettaq	w ɛ t t a ʔ
<|MLT|>weġġaħ	w ɛ d d͡ʒ a ħ
<|MLT|>widna	w ɪ d n a
<|MLT|>widnejn	w ɪ d n ɛ j n
<|MLT|>wiesgħa	w ɪː s a
<|MLT|>wieġeb	w ɪː d͡ʒ ɛ p
<|MLT|>wieħed	w ɪː ħ ɛ t
<|MLT|>wirdien	w ɪ r d ɪː n
<|MLT|>wiret	w ɪ r ɛ t
<|MLT|>wirja	w ɪ r j a
<|MLT|>wkoll	w k ɔ l l
<|MLT|>xahar	ʃ aː r
<|MLT|>xahrejn	ʃ a r ɛ j n
<|MLT|>xandar	ʃ a n d a r
<|MLT|>xatt	ʃ a t
<|MLT|>xemx	ʃ ɛ m ʃ
<|MLT|>xena	ʃ ɛː n ɐ
<|MLT|>xenqa	ʃ ɛ n ʔ a
<|MLT|>xerred	ʃ ɛ r r ɛ t
<|MLT|>xhieda	ʃ ɪː d a
<|MLT|>xhur	ʃ uː r
<|MLT|>xi	ʃ ɪ
<|MLT|>xiex	ʃ ɪː ʃ
<|MLT|>xita	ʃ ɪ t a
<|MLT|>xkora	ʃ k ɔː r a
<|MLT|>xorb	ʃ ɔ r p
<|MLT|>xorta	ʃ ɔ r t a
<|MLT|>xorti	ʃ ɔ r t ɪ
<|MLT|>xtaq	ʃ t aː ʔ
<|MLT|>xtara	ʃ t a r a
<|MLT|>xuereb	ʃ w ɪː r ɛ p
<|MLT|>ċar	t͡ʃ aː r
<|MLT|>ċavetta	t͡ʃ a v ɛ t t a
<|MLT|>ċediment	t͡ʃ ɛ d ɪ m ɛ n t
<|MLT|>ċivili	t͡ʃ ɪ v iː l ɪ
<|MLT|>ċkejken	t͡ʃ k ɛ j k ɛ n
<|MLT|>ċkejkna	t͡ʃ k ɛ j k n a
<|MLT|>ċkejknin	t͡ʃ k ɛ j k n iː n
<|MLT|>ċuċ	t͡ʃ uː t͡ʃ
<|MLT|>ġa	d͡ʒ a
<|MLT|>ġab	d͡ʒ aː p
<|MLT|>ġappun	d͡ʒ a p p uː n
<|MLT|>ġawhra	d͡ʒ a w r a
<|MLT|>ġedded	d͡ʒ ɛ d d ɛ t
<|MLT|>ġenna	d͡ʒ ɛ n n a
<|MLT|>ġesù	d͡ʒ ɛ s uː
<|MLT|>ġibed	d͡ʒ ɪ b ɛ t
<|MLT|>ġid	d͡ʒ iː t
<|MLT|>ġie	d͡ʒ ɪː
<|MLT|>ġifa	d͡ʒ iː f a
<|MLT|>ġimgħat	d͡ʒ ɪ m aː t
<|MLT|>ġirien	d͡ʒ ɪ r ɪː n
<|MLT|>ġlieda	d͡ʒ l ɪː d a
<|MLT|>ġnien	d͡ʒ n ɪː n
<|MLT|>ġrajja	d͡ʒ r a j j a
<|MLT|>ħa	ħ aː
<|MLT|>ħabb	ħ a p
<|MLT|>ħabel	ħ a b ɛ l
<|MLT|>ħabs	ħ a p s
<|MLT|>ħabta	ħ a b t a
<|MLT|>ħadd	ħ a t
<|MLT|>ħaddem	ħ a d d ɛ m
<|MLT|>ħaddiem	ħ a d d ɪː m
<|MLT|>ħadt	ħ a t
<|MLT|>ħafif	ħ a f iː f
<|MLT|>ħajja	ħ a j j a
<|MLT|>ħajjin	ħ a j j iː n
<|MLT|>ħajr	ħ a j r
<|MLT|>ħalaq	ħ a l a ʔ
<|MLT|>ħalib	ħ a l iː p
<|MLT|>ħalla	ħ a l l a
<|MLT|>ħallat	ħ a l l a t
<|MLT|>ħallelin	ħ a l l ɛ l iː n
<|MLT|>ħalliel	ħ a l l ɪː l
<|MLT|>ħalq	ħ a l ʔ
<|MLT|>ħamest	ħ a m ɛ s t
<|MLT|>ħamsin	ħ a m s iː n
<|MLT|>ħanin	ħ a n iː n
<|MLT|>ħaqq	ħ a ʔ
<|MLT|>ħaseb	ħ a s ɛ p
<|MLT|>ħasra	ħ a s r a
<|MLT|>ħass	ħ a s
<|MLT|>ħatar	ħ a t a r
<|MLT|>ħawt	ħ a w t
<|MLT|>ħaġa	ħ aː d͡ʒ a
<|MLT|>ħaġar	ħ a d͡ʒ a r
<|MLT|>ħażen	ħ a z ɛ n
<|MLT|>ħbiberija	ħ b ɪ b ɛ r iː j a
<|MLT|>ħeba	ħ ɛ b a
<|MLT|>ħejja	ħ ɛ j j a
<|MLT|>ħela	ħ ɛ l a
<|MLT|>ħelwa	ħ ɛ l w ɐ
<|MLT|>ħeġġeġ	ħ ɛ d d͡ʒ ɛ t͡ʃ
<|MLT|>ħieles	ħ ɪː l ɛ s
<|MLT|>ħin	ħ iː n
<|MLT|>ħlas	ħ l aː s
<|MLT|>ħlejjaq	ħ l ɛ j j a ʔ
<|MLT|>ħlief	ħ l ɪː f
<|MLT|>ħmistax	ħ m ɪ s t aː ʃ
<|MLT|>ħniena	ħ n ɪː n a
<|MLT|>ħolm	ħ ɔ l m
<|MLT|>ħolma	ħ ɔ l m a
<|MLT|>ħsara	ħ s aː r a
<|MLT|>ħsibijiet	ħ s ɪ b ɪ j ɪː t
<|MLT|>ħsieb	ħ s ɪː p
<|MLT|>ħut	ħ uː t
<|MLT|>ħwienet	ħ w ɪː n ɛ t
<|MLT|>żagħżugħ	z a z uː ħ
<|MLT|>żagħżugħa	z a z uː w a
<|MLT|>żar	z aː r
<|MLT|>żball	z b a l l
<|MLT|>żewġ	z ɛ w t͡ʃ
<|MLT|>żgur	z ɡ uː r
<|MLT|>żgħar	z aː r
<|MLT|>żgħir	z ɛ j r
<|MLT|>żgħira	z a j r a
<|MLT|>żied	z ɪː t
<|MLT|>żieda	z ɪː d a
<|MLT|>żmien	z m ɪː n
<|MLT|>żnuber	z n uː b ɛ r
<|MLT|>żwieġ	z w ɪː t͡ʃ
<|MLT|>żżewweġ	ɪ z z ɛ w w ɛ t͡ʃ
<|HUN|>ablakból	ɒ b l ɒ ɡ b oː l
<|HUN|>acéllemez	ɒ t͡s eː lː ɛ m ɛ z
<|HUN|>adatainak	ɒ d ɒ t ɒ j i n ɒ k
<|HUN|>adni	ɒ d n i
<|HUN|>ajánlattevő	ɒ j aː n l ɒ tː ɛ v øː
<|HUN|>akad	ɒ k ɒ d
<|HUN|>akció	ɒ k t͡s i j oː
<|HUN|>akihez	ɒ k i ɦ ɛ z
<|HUN|>akiknek	ɒ k i k n ɛ k
<|HUN|>alkalmasnak	ɒ l k ɒ l m ɒ ʃ n ɒ k
<|HUN|>alkalmazni	ɒ l k ɒ l m ɒ z n i
<|HUN|>alkalmazása	ɒ l k ɒ l m ɒ z aː ʃ ɒ
<|HUN|>alkalmazásának	ɒ l k ɒ l m ɒ z aː ʃ aː n ɒ k
<|HUN|>alkotó	ɒ l k o t oː
<|HUN|>allen	ɛ l ɛ n
<|HUN|>amelyen	ɒ m ɛ j ɛ n
<|HUN|>amelynél	ɒ m ɛ j n eː l
<|HUN|>amikkel	ɒ m i kː ɛ l
<|HUN|>amit	ɒ m i t
<|HUN|>analfabéták	ɒ n ɒ l f ɒ b eː t aː k
<|HUN|>andrás	ɒ n d r aː ʃ
<|HUN|>anesztézia	ɒ n ɛ s t eː z i j ɒ
<|HUN|>annyi	ɒ ɲː i
<|HUN|>annál	ɒ nː aː l
<|HUN|>antal	ɒ n t ɒ l
<|HUN|>anyagokat	ɒ ɲ ɒ ɡ o k ɒ t
<|HUN|>anyuka	ɒ ɲ u k ɒ
<|HUN|>apa	ɒ p ɒ
<|HUN|>arca	ɒ r t͡s ɒ
<|HUN|>arcán	ɒ r t͡s aː n
<|HUN|>attribútum	ɒ t r i b uː t u m
<|HUN|>ausztriában	ɒ u s t r i j aː b ɒ n
<|HUN|>autók	ɒ u t oː k
<|HUN|>azokat	ɒ z o k ɒ t
<|HUN|>azért	ɒ z eː r t
<|HUN|>balatoni	b ɒ l ɒ t o n i
<|HUN|>be	b ɛ
<|HUN|>befejezetlen	b ɛ f ɛ j ɛ z ɛ t l ɛ n
<|HUN|>befejezés	b ɛ f ɛ j ɛ z eː ʃ
<|HUN|>befektetők	b ɛ f ɛ k t ɛ t øː k
<|HUN|>bejelenteni	b ɛ j ɛ l ɛ n t ɛ n i
<|HUN|>belüli	b ɛ l y l i
<|HUN|>bemutatásra	b ɛ m u t ɒ t aː ʃ r ɒ
<|HUN|>benyomni	b ɛ ɲ o m n i
<|HUN|>benzin	b ɛ n z i n
<|HUN|>beszerzés	b ɛ s ɛ r z eː ʃ
<|HUN|>beszédét	b ɛ s eː d eː t
<|HUN|>beszéljen	b ɛ s eː jː ɛ n
<|HUN|>betegségek	b ɛ t ɛ k ʃ eː ɡ ɛ k
<|HUN|>betyárok	b ɛ c aː r o k
<|HUN|>betöltött	b ɛ t ø l t ø tː
<|HUN|>birtoka	b i r t o k ɒ
<|HUN|>bizonytalanságok	b i z o ɲ t ɒ l ɒ n ʃ aː ɡ o k
<|HUN|>biztató	b i s t ɒ t oː
<|HUN|>biztonságosabb	b i s t o n ʃ aː ɡ o ʃ ɒ bː
<|HUN|>borító	b o r iː t oː
<|HUN|>buda	b u d ɒ
<|HUN|>budapestre	b u d ɒ p ɛ ʃ t r ɛ
<|HUN|>burkolat	b u r k o l ɒ t
<|HUN|>buszok	b u s o k
<|HUN|>bécsben	b eː d͡ʒ b ɛ n
<|HUN|>bérelt	b eː r ɛ l t
<|HUN|>bír	b iː r
<|HUN|>büntetés	b y n t ɛ t eː ʃ
<|HUN|>bűn	b yː n
<|HUN|>ceremónia	t͡s ɛ r ɛ m oː n i j ɒ
<|HUN|>cikket	t͡s i kː ɛ t
<|HUN|>cipzár	t͡s i b z aː r
<|HUN|>citromsav	t͡s i t r o m ʃ ɒ v
<|HUN|>csaknem	t͡ʃ ɒ k n ɛ m
<|HUN|>családja	t͡ʃ ɒ l aː ɟː ɒ
<|HUN|>csap	t͡ʃ ɒ p
<|HUN|>csapadék	t͡ʃ ɒ p ɒ d eː k
<|HUN|>csapatok	t͡ʃ ɒ p ɒ t o k
<|HUN|>csapatoknak	t͡ʃ ɒ p ɒ t o k n ɒ k
<|HUN|>csatlakozik	t͡ʃ ɒ t l ɒ k o z i k
<|HUN|>csehek	t͡ʃ ɛ h ɛ k
<|HUN|>cseppet	t͡ʃ ɛ pː ɛ t
<|HUN|>csillagok	t͡ʃ i lː ɒ ɡ o k
<|HUN|>csodálatos	t͡ʃ o d aː l ɒ t o ʃ
<|HUN|>csoki	t͡ʃ o k i
<|HUN|>csoportját	t͡ʃ o p o r c aː t
<|HUN|>csökkentése	t͡ʃ ø kː ɛ n t eː ʃ ɛ
<|HUN|>csütörtök	t͡ʃ y t ø r t ø k
<|HUN|>csütörtökön	t͡ʃ y t ø r t ø k ø n
<|HUN|>cukor	t͡s u k o r
<|HUN|>cégek	t͡s eː ɡ ɛ k
<|HUN|>célkitűzés	t͡s eː l k i t yː z eː ʃ
<|HUN|>célpontok	t͡s eː l p o n t o k
<|HUN|>címe	t͡s iː m ɛ
<|HUN|>debreceni	d ɛ b r ɛ t͡s ɛ n i
<|HUN|>demokraták	d ɛ m o k r ɒ t aː k
<|HUN|>dimenziók	d i m ɛ n z i j oː k
<|HUN|>dobogó	d o b o ɡ oː
<|HUN|>dolgát	d o l ɡ aː t
<|HUN|>dönt	d ø n t
<|HUN|>döntéshozó	d ø n t eː ʃ h o z oː
<|HUN|>döntő	d ø n t øː
<|HUN|>ebből	ɛ bː øː l
<|HUN|>egerek	ɛ ɡ ɛ r ɛ k
<|HUN|>egyenesen	ɛ ɟ ɛ n ɛ ʃ ɛ n
<|HUN|>egyház	ɛ c h aː z
<|HUN|>egykor	ɛ c k o r
<|HUN|>egyre	ɛ ɟ r ɛ
<|HUN|>egyének	ɛ ɟ eː n ɛ k
<|HUN|>egyénileg	ɛ ɟ eː n i l ɛ ɡ
<|HUN|>egészségbiztosítási	ɛ ɡ eː ʃː eː ɡ b i s t o ʃ iː t aː ʃ i
<|HUN|>el	ɛ l
<|HUN|>elektromos	ɛ l ɛ k t r o m o ʃ
<|HUN|>elektronikus	ɛ l ɛ k t r o n i k u ʃ
<|HUN|>elem	ɛ l ɛ m
<|HUN|>elemző	ɛ l ɛ m z øː
<|HUN|>elismerés	ɛ l i ʃ m ɛ r eː ʃ
<|HUN|>eljáró	ɛ jː aː r oː
<|HUN|>elkészítése	ɛ l k eː s iː t eː ʃ ɛ
<|HUN|>elkövetkező	ɛ l k ø v ɛ t k ɛ z øː
<|HUN|>ellentétes	ɛ lː ɛ n t eː t ɛ ʃ
<|HUN|>elnézést	ɛ l n eː z eː ʃ t
<|HUN|>elnöke	ɛ l n ø k ɛ
<|HUN|>elnöki	ɛ l n ø k i
<|HUN|>elnökének	ɛ l n ø k eː n ɛ k
<|HUN|>elnökét	ɛ l n ø k eː t
<|HUN|>elnököt	ɛ l n ø k ø t
<|HUN|>elsődleges	ɛ l ʃ øː d l ɛ ɡ ɛ ʃ
<|HUN|>eltérő	ɛ l t eː r øː
<|HUN|>elvétve	ɛ l v eː t v ɛ
<|HUN|>eléréséhez	ɛ l eː r eː ʃ eː ɦ ɛ z
<|HUN|>előkészítése	ɛ l øː k eː s iː t eː ʃ ɛ
<|HUN|>előleg	ɛ l øː l ɛ ɡ
<|HUN|>előnye	ɛ l øː ɲ ɛ
<|HUN|>előtti	ɛ l øː tː i
<|HUN|>előítélet	ɛ l øː j iː t eː l ɛ t
<|HUN|>emelkedő	ɛ m ɛ l k ɛ d øː
<|HUN|>emlékszik	ɛ m l eː k s i k
<|HUN|>emlő	ɛ m l øː
<|HUN|>energiát	ɛ n ɛ r ɡ i j aː t
<|HUN|>ennek	ɛ nː ɛ k
<|HUN|>ennél	ɛ nː eː l
<|HUN|>erdőkben	ɛ r d øː ɡ b ɛ n
<|HUN|>eredmények	ɛ r ɛ d m eː ɲ ɛ k
<|HUN|>eredményre	ɛ r ɛ d m eː ɲ r ɛ
<|HUN|>eredményt	ɛ r ɛ d m eː ɲ t
<|HUN|>erősítése	ɛ r øː ʃ iː t eː ʃ ɛ
<|HUN|>esemény	ɛ ʃ ɛ m eː ɲ
<|HUN|>esküvői	ɛ ʃ k y v øː j i
<|HUN|>esti	ɛ ʃ t i
<|HUN|>estig	ɛ ʃ t i ɡ
<|HUN|>eszerint	ɛ s ɛ r i n t
<|HUN|>eszközzel	ɛ s k ø zː ɛ l
<|HUN|>eszközök	ɛ s k ø z ø k
<|HUN|>esztek	ɛ s t ɛ k
<|HUN|>esély	ɛ ʃ eː j
<|HUN|>esélyekkel	ɛ ʃ eː j ɛ kː ɛ l
<|HUN|>esős	ɛ ʃ øː ʃ
<|HUN|>evezős	ɛ v ɛ z øː ʃ
<|HUN|>expedíció	ɛ k s p ɛ d iː t͡s i j oː
<|HUN|>export	ɛ k s p o r t
<|HUN|>ezernyi	ɛ z ɛ r ɲ i
<|HUN|>falat	f ɒ l ɒ t
<|HUN|>fegyverek	f ɛ ɟ v ɛ r ɛ k
<|HUN|>fejleszteni	f ɛ j l ɛ s t ɛ n i
<|HUN|>fejlesztésének	f ɛ j l ɛ s t eː ʃ eː n ɛ k
<|HUN|>fejlődése	f ɛ j l øː d eː ʃ ɛ
<|HUN|>fejlődő	f ɛ j l øː d øː
<|HUN|>feladatai	f ɛ l ɒ d ɒ t ɒ j i
<|HUN|>felelősségtudat	f ɛ l ɛ l øː ʃː eː k t u d ɒ t
<|HUN|>felelősségét	f ɛ l ɛ l øː ʃː eː ɡ eː t
<|HUN|>felszínes	f ɛ l s iː n ɛ ʃ
<|HUN|>felsőbb	f ɛ l ʃ øː bː
<|HUN|>feltételek	f ɛ l t eː t ɛ l ɛ k
