aare	ɑ ɹ ə
unvitiated	ʌ n v ɪ ʃ i e ɪ t ɪ d
upcycling	ʌ p s a ɪ k l ɪ ŋ
uphold	ʌ p h o l d
uptalking	ə p t ɔ k ɪ ŋ
urethra	j ʊ ɹ i θ ɹ ə
usabilities	j u z ə b ɪ l ɪ t i z
usable	j u z ə b ə l
usie	ʌ s i
using	j u z ɪ ŋ
uterus	j u t ə ɹ ə s
uxoricide	ʌ k s ɔ ɹ ɪ s a ɪ d
vali	v ɑ l ɪ
valiant	v æ l j ə n t
validate	v æ l ə d e ɪ t
validation	v æ l ə d e ɪ ʃ ə n
valleys	v æ l i z
values	v æ l j u z
vancomycin	v æ ŋ k ə m a ɪ s ɪ n
vandal	v æ n d ə l
vanes	v e ɪ n z
vanish	v æ n ɪ ʃ
vat	v æ t
vaticination	v ə t ɪ s ɪ n e ɪ ʃ ə n
veep	v i p
vega	v e ɪ ɡ ə
vegeburger	v ɛ d͡ʒ i b ɜ ɹ ɡ ə ɹ
vegetal	v ɛ d͡ʒ ɪ̈ t l̩
venda	v ɛ n d ə
venomous	v ɛ n ə m ə s
verdure	v ɜ d͡ʒ ɚ
veridical	v ə ɹ ɪ d ɪ k ə l
vertigo	v ɝ t ɪ ɡ o ʊ
vetter	v ɛ t ɚ
veurne	v ɜ ɹ n ə
vibrissa	v ɪ b ɹ ɪ s ə
vicegerency	v a ɪ s d͡ʒ ɪ ə ɹ ə n t s i
viceroy	v a ɪ s ɹ ɔ ɪ
victories	v ɪ k t ə ɹ i z
victuals	v ɪ t l̩ z
vig	v ɪ ɡ
vigil	v ɪ d͡ʒ ə l
vigneron	v i n j ə ɹ ɔ̃
vignette	v ɪ n j ɛ t
vila	v i l ə
villa	v ɪ l ə
villages	v ɪ l ɪ d͡ʒ ɪ z
vindication	v ɪ n d ɪ k e ɪ ʃ ə n
vinetree	v a ɪ n t ɹ i
violoncello	v a ɪ ə l ə n t͡ʃ ɛ l o ʊ
virginia	v ɚ d͡ʒ ɪ n j ə
virginian	v ɚ d͡ʒ ɪ n j ə n
virology	v ʌ ɪ ɹ ɔ l ə d͡ʒ i
virtuous	v ɝ t͡ʃ u ə s
vishnu	v ɪ ʃ n u
vivid	v ɪ v ɪ d
vivifying	v ɪ v ɪ f ʌ ɪ ŋ
vocal	v o ʊ k ə l
vogt	v o ʊ ɡ t
vogue	v o ʊ ɡ
volley	v ɔ l i
voltaic	v ɔ l t e ɪ ɪ k
volumes	v ɑ l j u m z
voluntary	v ɑ l ə n t ɛ ɹ i
vorozole	v ɔ ɹ ə z o ʊ l
vulpine	v ʌ l p a ɪ n
wabash	w ɑ b æ ʃ
wack	w æ k
wagon	w æ ɡ ə n
waistband	w e ɪ s t b æ n d
wallaby	w ɑ l ə b i
wanton	w ɑ n t ə n
war	w ɔ ɹ
warning	w ɔ ɹ n ɪ ŋ
wasp	w ɑ s p
watercress	w ɔ t ə ɹ k ɹ ɛ s
wattle	w ɔ t ə l
waving	w e ɪ v ɪ ŋ
waxy	w æ k s i
weaken	w i k ə n
weaponize	w ɛ p ə n a ɪ z
wee	w i
weel	w i l
weely	w i l i
weevil	w i v ɪ l
wellington	w ɛ l ɪ ŋ t ə n
welly	w ɛ l i
weltanschauung	v ɛ l t ɑ n ʃ a ʊ ʊ ŋ
welwyn	w ɛ l ɪ n
wesleyanism	w ɛ z l ɪ ə n ɪ z ə m
westside	w ɛ s t s a ɪ d
whaling	w e ɪ l ɪ ŋ
whallah	w ɑ l ɑ
whammo	w æ m o ʊ
wharfage	w ɔ ɹ f ɪ d͡ʒ
wheelchair	w i l t͡ʃ ɛ ɹ
whiffle	w ɪ f l̩
wholly	h o ʊ l i
whoo	w u
whooshy	w u ʃ i
whyja	w a ɪ d͡ʒ ə
wicky	w ɪ k i
wilde	w a ɪ l d
willing	w ɪ l ɪ ŋ
wilton	w ɪ l t ə n
windage	w ɪ n d ɪ d͡ʒ
windowsill	w ɪ n d o ʊ s ɪ l
winemaker	w a ɪ n m e ɪ k ɚ
winner	w ɪ n ɚ
wiper	w a ɪ p ɚ
wiry	w a ɪ ə ɹ i
wispy	w ɪ s p i
wistful	w ɪ s t f ə l
withers	w ɪ ð ɚ z
witherward	w ɪ ð ə ɹ w ə ɹ d
wlan	d ʌ b ə l j u l æ n
woken	w o ʊ k ə n
woman	w ʊ m ə n
womanhood	w ʊ m ə n h ʊ d
wonder	w ʌ n d ɚ
woodchuck	w ʊ d t͡ʃ ʌ k
woolfian	w ʊ l f i ə n
working	w ɝ k ɪ ŋ
woundable	w u n d ə b ə l
wounds	w u n d z
wrath	ɹ æ θ
wrawl	ɹ ɔ l
wreck	ɹ ɛ k
wrength	ɹ ɛ ŋ θ
wrexham	ɹ ɛ k s ə m
wrinkle	ɹ ɪ ŋ k l̩
wrizzled	ɹ ɪ z ə l d
wronged	ɹ ɔ ŋ d
wushu	w u ʃ u
wuss	w ʊ s
wuvz	w ʌ v z
xining	ʃ i n ɪ ŋ
xizang	ʃ i z ɑ ŋ
yahweh	j ɑ w e ɪ
yak	j æ k
yank	j æ ŋ k
yare	j ɛ ɹ
yearningly	j ɝ n ɪ ŋ l i
yeovil	j o ʊ v ɪ l
yerevanian	j e ɹ ə v ɑ n i ə n
yerk	j ɜ ɹ k
yes	j ɛ s
yesses	j ɛ s ɪ z
yeung	j ʌ ŋ
yiwu	j i w u
yoicks	j ɔ ɪ k s
yonic	j o ʊ n ɪ k
zachary	z æ k ə ɹ i
zambuck	z æ m b ʌ k
zed	z ɛ d
zelensky	z ɪ l ɛ n s k i
zerbert	z ɜ ɹ b ə ɹ t
zerk	z ɝ k
zetetic	z ə t ɛ t ɪ k
zillionths	z ɪ l j ə n θ s
zine	z i n
zinefan	z i n f æ n
zipper	z ɪ p ɚ
ziti	z i t i
zoologist	z o ʊ ɑ l ə d͡ʒ ɪ s t
zowie	z a ʊ ɪ
zythology	z a ɪ θ ɔ l ə d͡ʒ i
